[
    {
        "question": "Where can a mural celebrating Buggy be found within CMU, and what does it depict?",
        "context": "Fairings have been a key feature for the Fringe team in recent years, which is celebrating its 50th anniversary of Buggy.\n We have a reputation of being the quietest on the course, said Diya Nuxoll, who wrapped up her bachelor's degree in mechanical engineering in December and is working on an advanced studies master's degree in design and manufacturing. Nuxoll leads the Fringe team as one of two head mechanics.\nAn mural celebrating Buggy can be found in\u00a0CMU's\u00a0Stever House. The artwork is part of a larger installation showcasing Sweepstakes and its traditions.\nSweepstakes Slang\nBuggy: Vehicle being raced and also a nickname for the competition. ",
        "retrieved_doc": "Buggy can be found in\u00a0CMU's\u00a0Stever House. The artwork is part of a larger installation showcasing Sweepstakes and its traditions. Sweepstakes Slang Buggy: Vehicle being raced and also a nickname for the competition. Chute: A section of the freeroll|April 12, 2024: Event Name: History of Buggy 4:00 PM-5:00 PMET Open to entire CMU community Learn about the origin and development of the Sweepstakes races and what students are doing to push the boundaries of the sport in new directions. Note: Registration required. Walk-ins are welcome as space permits. No event fee. This event is open to the entire CMU community and their guests. |in mechanical engineering in December and is working on an advanced studies master's degree in design and manufacturing. Nuxoll leads the Fringe team as one of two head mechanics. An mural celebrating Buggy can be found in\u00a0CMU's\u00a0Stever House. The|April 11, 2024: Event Name: Buggy Showcase 12:00 PM-2:00 PMET Open to entire CMU community Kick off your Carnival Weekend with Buggy! View the latest buggy designs, talk with the teams, enjoy kid-friendly buggy activities and vote for the Buggy People\u2019s Choice Award. Note: No registration required. No event fee. This event is open to the entire CMU community and their guests. |April 13, 2024: Event Name: Buggy Alumni Association Information Tent 8:00 AM-12:00 PMET Open to entire CMU community Come by the Buggy Alumni Association tent during Sweepstakes races to meet your BAA officers and learn about our work. Note: No registration required. No event fee. This event is open to the entire CMU community and their guests. |April 12, 2024: Event Name: Buggy Alumni Association Information Tent 8:00 AM-12:00 PMET Open to entire CMU community Come by the Buggy Alumni Association tent during Sweepstakes races to meet your BAA officers and learn about our work. Note: No registration required. No event fee. This event is open to the entire CMU community and their guests. ",
        "retrieved_relevant_part": false,
        "model_answer": "A mural celebrating Buggy can be found in Stever House at Carnegie Mellon University. It is part of a larger installation showcasing Sweepstakes and its traditions",
        "actual_answer": "A mural celebrating Buggy can be found in CMU's Stever House. It is part of a larger installation showcasing Sweepstakes and its traditions",
        "exact_match": false,
        "f1_max_min_avg": [
            0.86,
            0.86,
            0.86
        ],
        "recall_max_min_avg": [
            0.91,
            0.91,
            0.91
        ]
    },
    {
        "question": "What role does the driver play in controlling the buggy's movement?",
        "context": "where buggies make the sharp righthand turn from Schenley Drive onto Frew Street. Chute Flagger: Team member who provides a signal for buggy drivers to know when to start the right-hand turn from Schenley Drive onto Frew Street. Driver: Person who travels with a buggy and controls the vehicles via steering and braking systems. Pushbar: Structure attached to a buggy that a person pushes to propel that buggy forward. Pusher: Person who propels a buggy via a pushbar along one of the five hills of the buggy course. Shell: Entire outer structure or covering of a buggy that determines that buggy's aerodynamic characteristics.",
        "retrieved_doc": "Person who travels with a buggy and controls the vehicles via steering and braking systems. Pushbar: Structure attached to a buggy that a person pushes to propel that buggy forward. Pusher: Person who propels a buggy via a pushbar along one of the|and braking mechanisms. Behind Singh are other buggies built by Fringe.    Behind the Wheel Drivers, have the closest connection to the vehicles, aside from the mechanics who spent countless hours building and maintaining individual buggies. While|propels a buggy via a pushbar along one of the five hills of the buggy course. Shell: Entire outer structure or covering of a buggy that determines that buggy's aerodynamic characteristics. Transition: Procedure whereby one pusher finishes pushing a|turn from Schenley Drive onto Frew Street. Chute Flagger: Team member who provides a signal for buggy drivers to know when to start the right-hand turn from Schenley Drive onto Frew Street. Driver: Person who travels with a buggy and controls the|as weather permits. Buggies are often built around drivers, so the fit can be snug, and drivers are often less than 5 feet, 3 inches in height. Most \u2014 but not all \u2014 are women. Tishya Girdhar, a junior in neuroscience, is social chair for Fringe. She|Sweepstakes. \"Our team's philosophy is to teach everyone how to do everything,\" Girdhar said. \"But I came to CMU wanting to drive. I wanted to drive so badly.\"    Amy Chen demonstrates how a driver is positioned inside of Boson, a Fringe buggy built",
        "retrieved_relevant_part": true,
        "model_answer": "The driver is responsible for controlling the buggy by using steering and braking systems",
        "actual_answer": "The driver controls the buggy's movement via steering and braking systems.",
        "exact_match": false,
        "f1_max_min_avg": [
            0.48,
            0.48,
            0.48
        ],
        "recall_max_min_avg": [
            0.55,
            0.55,
            0.55
        ]
    },
    {
        "question": "Can you describe the role and responsibilities of a pusher in a buggy race?",
        "context": "Pusher: Person who propels a buggy via a pushbar along one of the five hills of the buggy course. Shell: Entire outer structure or covering of a buggy that determines that buggy's aerodynamic characteristics. Transition: Procedure whereby one pusher finishes pushing a buggy and the next pusher in sequence starts to push that same buggy. \n Members of Fringe, celebrating their 50th year of Buggy racing,\u00a0allowed a rare visit into its shop for a behind-the-scenes tour. \n \n This year Fringe is planning to roll four different vehicles, built and maintained in the Fringe workshop in the basement of the East Campus Garage, known as the \"Froom.\\n\"We're used to saying everything with 'fr' in front of it but when we say something in front of other people, it gets them confused,\" said Fringe head mechanic Dave Singh,",
        "retrieved_doc": "Person who travels with a buggy and controls the vehicles via steering and braking systems. Pushbar: Structure attached to a buggy that a person pushes to propel that buggy forward. Pusher: Person who propels a buggy via a pushbar along one of the|propels a buggy via a pushbar along one of the five hills of the buggy course. Shell: Entire outer structure or covering of a buggy that determines that buggy's aerodynamic characteristics. Transition: Procedure whereby one pusher finishes pushing a|Procedure whereby one pusher finishes pushing a buggy and the next pusher in sequence starts to push that same buggy.               Members of Fringe, celebrating their 50th year of Buggy racing,\u00a0allowed a rare visit into its shop for a|are needed to make a successful race happen. A year of planning goes into just over two minutes of racing. The Machine The basics of a buggy are straightforward, but teams are often secretive in how they build the machines, in particular the way|and maintaining individual buggies. While races are brief, each driver must log a number of practice runs to qualify to race. Teams practice nights and weekends throughout the fall and spring semesters as weather permits. Buggies are often built|three points of contact to the body of the buggy, gloves and a helmet. And during practice runs and races, flaggers man the course to let drivers know if it's safe to proceed. The streets of the race course haven't changed, but the condition of the",
        "retrieved_relevant_part": true,
        "model_answer": "A pusher is responsible for controlling the buggy by using steering and braking systems",
        "actual_answer": "The pusher is the person who propels the buggy along one of the five hills of the buggy course using a pushbar.",
        "exact_match": false,
        "f1_max_min_avg": [
            0.28,
            0.28,
            0.28
        ],
        "recall_max_min_avg": [
            0.23,
            0.23,
            0.23
        ]
    },
    {
        "question": "How does the transition process work during a buggy race?",
        "context": "Shell: Entire outer structure or covering of a buggy that determines that buggy's aerodynamic characteristics. Transition: Procedure whereby one pusher finishes pushing a buggy and the next pusher in sequence starts to push that same buggy.\n            \n Members of Fringe, celebrating their 50th year of Buggy racing,\u00a0allowed a rare visit into its shop for a behind-the-scenes tour. \n \n This year Fringe is planning to roll four different vehicles, built and maintained in the Fringe workshop in the basement of the East Campus Garage, known as the \"Froom.\"\n\"We're used to saying everything with 'fr' ",
        "retrieved_doc": "are needed to make a successful race happen. A year of planning goes into just over two minutes of racing. The Machine The basics of a buggy are straightforward, but teams are often secretive in how they build the machines, in particular the way|Procedure whereby one pusher finishes pushing a buggy and the next pusher in sequence starts to push that same buggy.               Members of Fringe, celebrating their 50th year of Buggy racing,\u00a0allowed a rare visit into its shop for a|propels a buggy via a pushbar along one of the five hills of the buggy course. Shell: Entire outer structure or covering of a buggy that determines that buggy's aerodynamic characteristics. Transition: Procedure whereby one pusher finishes pushing a|and maintaining individual buggies. While races are brief, each driver must log a number of practice runs to qualify to race. Teams practice nights and weekends throughout the fall and spring semesters as weather permits. Buggies are often built|vessels carrying drivers with nerves of steel are a far cry from the two-man teams that once changed places halfway through a race and rode in everything from rain barrels with bicycle wheels to three-wheeled ash cans 99 years ago. Today, it takes|Buggy Races Keep Rolling at Carnegie Mellon -     News - Carnegie Mellon University Carnegie Mellon University \u2014\u2014\u2014  Search  Search  Search this site only  News   News                                      \u00a0\u203a\u00a0             Stories",
        "retrieved_relevant_part": false,
        "model_answer": "The transition process works by having one pusher finishes pushing a buggy and the next pusher in sequence starts to push the same buggy",
        "actual_answer": "The transition process in a buggy race involves one pusher finishing their push, and then the next pusher takes over to continue propelling the buggy along the course.",
        "exact_match": false,
        "f1_max_min_avg": [
            0.46,
            0.46,
            0.46
        ],
        "recall_max_min_avg": [
            0.43,
            0.43,
            0.43
        ]
    },
    {
        "question": "How does the pushbar contribute to the propulsion of the buggy during the race?",
        "context": "Drive onto Frew Street. Driver: Person who travels with a buggy and controls the vehicles via steering and braking systems. Pushbar: Structure attached to a buggy that a person pushes to propel that buggy forward. Pusher: Person who propels a buggy via a pushbar along one of the five hills of the buggy course. Shell:  ",
        "retrieved_doc": "Person who travels with a buggy and controls the vehicles via steering and braking systems. Pushbar: Structure attached to a buggy that a person pushes to propel that buggy forward. Pusher: Person who propels a buggy via a pushbar along one of the|propels a buggy via a pushbar along one of the five hills of the buggy course. Shell: Entire outer structure or covering of a buggy that determines that buggy's aerodynamic characteristics. Transition: Procedure whereby one pusher finishes pushing a|Procedure whereby one pusher finishes pushing a buggy and the next pusher in sequence starts to push that same buggy.               Members of Fringe, celebrating their 50th year of Buggy racing,\u00a0allowed a rare visit into its shop for a|are needed to make a successful race happen. A year of planning goes into just over two minutes of racing. The Machine The basics of a buggy are straightforward, but teams are often secretive in how they build the machines, in particular the way|they build the machines, in particular the way they brake, steer and what types of wheels are used. Each has a body, pushbar for runners to move the machine up the hills, wheels, a safety harness and driving and braking mechanisms. Some also include|see buggies up close.    Dave Singh explains how Fringe builds its buggies. Each team keeps its actual processes a secret, but each buggy has certain features such as a body, pushbar, wheels and driving and braking mechanisms. Behind Singh are other",
        "retrieved_relevant_part": true,
        "model_answer": "The pushbar propels the buggy forward using a pushbar",
        "actual_answer": "The pushbar contributes to the propulsion of the buggy by providing a structure that a person can use to propel the buggy forward.",
        "exact_match": false,
        "f1_max_min_avg": [
            0.31,
            0.31,
            0.31
        ],
        "recall_max_min_avg": [
            0.22,
            0.22,
            0.22
        ]
    },
    {
        "question": "What are the five pieces of safety gear required for all drivers in the race?",
        "context": "All drivers are required to have five pieces of safety gear: mouth guard, goggles, a harness that includes three points of contact to the body of the buggy, gloves and a helmet. And during practice runs and races, flaggers man the course to let drivers know if it's safe to proceed.\nThe streets of the race course haven't changed, but the condition of the course varies due to potholes, which can make or break a fast run. The last course records were set in 2017, but this year potholes are making for some challenging conditions, said Amy Chen, a senior in psychology who has been driving for four years.\nWith the vehicles just inches from the ground, \"even poorly filled potholes makes it dangerous to drive,\" she added.\n",
        "retrieved_doc": "positioned inside of Boson, a Fringe buggy built in 2016.    Safety is a top priority for teams. All drivers are required to have five pieces of safety gear: mouth guard, goggles, a harness that includes three points of contact to the body of the|three points of contact to the body of the buggy, gloves and a helmet. And during practice runs and races, flaggers man the course to let drivers know if it's safe to proceed. The streets of the race course haven't changed, but the condition of the|they build the machines, in particular the way they brake, steer and what types of wheels are used. Each has a body, pushbar for runners to move the machine up the hills, wheels, a safety harness and driving and braking mechanisms. Some also include|vessels carrying drivers with nerves of steel are a far cry from the two-man teams that once changed places halfway through a race and rode in everything from rain barrels with bicycle wheels to three-wheeled ash cans 99 years ago. Today, it takes|and maintaining individual buggies. While races are brief, each driver must log a number of practice runs to qualify to race. Teams practice nights and weekends throughout the fall and spring semesters as weather permits. Buggies are often built|are needed to make a successful race happen. A year of planning goes into just over two minutes of racing. The Machine The basics of a buggy are straightforward, but teams are often secretive in how they build the machines, in particular the way",
        "retrieved_relevant_part": false,
        "model_answer": "All drivers are required to wear a five safety gears, including a mouth guard, goggles, a harness with three points of contact to the body of the buggy, and a helmet",
        "actual_answer": "The five pieces of safety gear required for all drivers in the race are a mouth guard, goggles, a harness that includes three points of contact to the body of the buggy, gloves, and a helmet.",
        "exact_match": false,
        "f1_max_min_avg": [
            0.57,
            0.57,
            0.57
        ],
        "recall_max_min_avg": [
            0.53,
            0.53,
            0.53
        ]
    },
    {
        "question": "What types of materials are showcased in the exhibition in carnival events?",
        "context": "ands of projects and the work of hundreds of designers. The exhibition highlights the wide diversity of materials from preliminary sketches to presentation renderings to specifications and photographs to publications and select architectural models which help piece together the rich history of the built environment of Pittsburgh and the region. Note: No registration required. No event fee. This event is open to the entire CMU community and their guests. April 10, 2024: Event Name: Inventing Shakespeare: Text, Technology and The Four Folios 8:00 AM-6:00 PMET Open to entire CMU community Inventing Sh",
        "retrieved_doc": "April 11, 2024: Event Name: Carnival Rides 3:30 PM-11:00 PMET Open to entire CMU community Be sure to check out all of the rides and activities, including traditions like ferris wheel and swings. There will also be a special kid's ride area. Note: No registration required. Individual tickets or all-day passes may be purchased onsite at the vendor\u2019s ticketing booth. Weekend hours: * Thursday: 3:30-11 p.m. * Friday & Saturday: 11 a.m.-11 p.m. |April 13, 2024: Event Name: Carnival Rides 11:00 AM-11:00 PMET Open to entire CMU community Be sure to check out all of the rides and activities, including traditions like ferris wheel and swings. There will also be a special kid's ride area. Weekend hours: * Thursday: 3:30-11 p.m. * Friday & Saturday: 11 a.m.-11 p.m. Note: No registration required. Individual tickets or all-day passes may be purchased onsite at the vendor\u2019s ticketing booth. |April 12, 2024: Event Name: Carnival Rides 11:00 AM-11:00 PMET Open to entire CMU community Be sure to check out all of the rides and activities, including traditions like ferris wheel and swings. There will also be a special kid's ride area. Weekend hours: * Thursday: 3:30-11 p.m. * Friday & Saturday: 11 a.m.-11 p.m. Note: No registration required. Individual tickets or all-day passes may be purchased onsite at the vendor\u2019s ticketing booth. |April 13, 2024: Event Name: Crafting with the Spring Carnival Committee 2:00 PM-4:00 PMET Open to entire CMU community The Spring Carnival Committee (SCC) invites the CMU community to join them in some fun crafting projects. Note: Registration not required. No event fee. |February 5, 2024: Event Name: Faces of Carnival Photo Mosaic 2/5/24 \u2013 4/15/24 8:00 AM-9:00 PMET Open to entire CMU community Submit your photo by April 16 to be included in the Faces of Carnival. Look for your image \u2014 along with hundreds of others from the worldwide CMU community \u2014 when we share the mosaic on social media and in email after Spring Carnival 2024. |April 11, 2024: Event Name: Buggy Showcase 12:00 PM-2:00 PMET Open to entire CMU community Kick off your Carnival Weekend with Buggy! View the latest buggy designs, talk with the teams, enjoy kid-friendly buggy activities and vote for the Buggy People\u2019s Choice Award. Note: No registration required. No event fee. This event is open to the entire CMU community and their guests. ",
        "retrieved_relevant_part": false,
        "model_answer": "The exhibition in carnegie Mellon University showscased materials such as photographs, swings, and tradition",
        "actual_answer": "The materials showcased include preliminary sketches, presentation renderings, specifications, photographs, publications, and select architectural models.",
        "exact_match": false,
        "f1_max_min_avg": [
            0.28,
            0.28,
            0.28
        ],
        "recall_max_min_avg": [
            0.27,
            0.27,
            0.27
        ]
    },
    {
        "question": "What is the time and format of the WRCT Radio Buggy Preview event on April 10, 2024?",
        "context": "Objects in the exhibit range from a fully immersive VR tour of a reconstructed Shakespearean playhouse, a 1960s-era mechanical collator designed to compare multiple copies of the First Folio, and fragments of the folios themselves. Note: No registration required. No event fee. This event is open to the entire CMU community and their guests. April 10, 2024: Event Name: WRCT Radio Buggy Preview 3:00 PM-4:00 PMET Virtual Event: Open to All",
        "retrieved_doc": "April 10, 2024: Event Name: WRCT Radio Buggy Preview 3:00 PM-4:00 PMET Virtual Event: Open to All Tune into WRCT at 88.3 FM to hear Buggy Alumni Association (BAA) guest panelists discuss Buggy. Note: Add event during registration for calendar hold. A reminder with link will be sent to registrants 24 hours and one hour prior. |April 13, 2024: Event Name: WRCT's 75th Anniversary Reception 1:00 PM-3:00 PMET Open to WRCT community Join current WRCT leadership for this casual reception as we celebrate 75 years. At 1:30 pm, we'll share highlights from the past 75 years, as well as share some goals for the future. We hope you are able to drop by! Note: Registration required. Walk-ins are welcome as space permits. No event fee. This event is open to the WRCT community, alumni and their guests. |April 11, 2024: Event Name: |April 11, 2024: Event Name: Buggy Alumni Association Welcome Event 7:00 PM-9:00 PMET Open to Buggy community Join the Buggy Alumni Association for food and drinks and make your predictions for the Sweepstakes prelims. Note: Pay on your own at restaurant. Open to members of the Buggy community. |April 11, 2024: Event Name: Buggy Showcase 12:00 PM-2:00 PMET Open to entire CMU community Kick off your Carnival Weekend with Buggy! View the latest buggy designs, talk with the teams, enjoy kid-friendly buggy activities and vote for the Buggy People\u2019s Choice Award. Note: No registration required. No event fee. This event is open to the entire CMU community and their guests. |April 12, 2024: Event Name: Buggy Bash 7:00 PM-9:00 PMET Open to the Buggy community Buggy Bash RD24 is here! Join buggy students and alumni for a night of food, trivia and our finals lead truck auction. This auction will be open on the Buggy Alumni Association website on April 11 until 11 p.m. Note: Registration required. Walk-ins are welcome as space permits. No event fee. This event is open to the Buggy community and their guests. ",
        "retrieved_relevant_part": false,
        "model_answer": "The WRCT Radio Buggy Preview event on April 10, 2024 will take place from 3:00 PM to 4:00 PM ET",
        "actual_answer": "The WRCT Radio Buggy Preview event is scheduled for April 10, 2024, from 3:00 PM to 4:00 PM Eastern Time and is a virtual event open to all.",
        "exact_match": false,
        "f1_max_min_avg": [
            0.54,
            0.54,
            0.54
        ],
        "recall_max_min_avg": [
            0.46,
            0.46,
            0.46
        ]
    },
    {
        "question": "Who is invited to the Spring Carnival Midway Opening Ceremony?",
        "context": " to CMU faculty and staff and their guests. Weekend hours: * Thursday: 3-6 p.m. * Friday: 1-4 p.m. April 11, 2024: Event Name: Spring Carnival Midway Opening Ceremony 3:00 PM-3:30 PMET Open to entire CMU community Join the Spring Carnival committee, Pipes & Drums Band and Scotty as we celebrate the opening of Midway! Can't make it back to campus? Sign up for the calendar hold hold - we'll add the livestream link a week prior, as well as send an event reminder with link 24-hours and one-hour prior. Note: No registration required for in-person event. No event fee. This event is open to the entire CMU community and their guests. April 11, 2024: Event Name: Carnival Activities Tent 3:30 PM-7:00 PMET Open to entire CMU community Featuring entertainment and games for students, alumni",
        "retrieved_doc": "April 11, 2024: Event Name: Spring Carnival Midway Opening Ceremony 3:00 PM-3:30 PMET Open to entire CMU community Join the Spring Carnival committee, Pipes & Drums Band and Scotty as we celebrate the opening of Midway! Can't make it back to campus? Sign up for the calendar hold hold - we'll add the livestream link a week prior, as well as send an event reminder with link 24-hours and one-hour prior. Note: No registration required for in-person event. No event fee. This event is open to the entire CMU community and their guests. |April 13, 2024: Event Name: Spring Carnival Parents and Families Hospitality Suite 1:30 PM-3:00 PMET Open to parents and families All families are welcome to drop in to our hospitality lounge to take a break, grab some snacks, take a photo, mingle with fellow families and chat with staff. Note: No registration required. No event fee. This event is open to parents and families of current students. |April 13, 2024: Event Name: Spring Carnival Booth & Sweepstakes Award Ceremony 4:30 PM-5:30 PMET Open to entire CMU community Note: No registration required. No event fee. |April 13, 2024: Event Name: School of Architecture Pavilion Dedication & Alumni Open House 1:00 PM-2:30 PMET Open to School of Architecture Community Drop by the official Spring Carnival entrance pavilion to meet School of Architecture Head Omar Khan and current students who designed and built this NOMAS-led project. Note: Registration required. Walk-ins are welcome as space permits. No event fee. This event is open to the Architecture community and their guests. |February 5, 2024: Event Name: Faces of Carnival Photo Mosaic 2/5/24 \u2013 4/15/24 8:00 AM-9:00 PMET Open to entire CMU community Submit your photo by April 16 to be included in the Faces of Carnival. Look for your image \u2014 along with hundreds of others from the worldwide CMU community \u2014 when we share the mosaic on social media and in email after Spring Carnival 2024. |April 11, 2024: Event Name: Activities Board Spring Carnival Speakers Show 7:00 PM-10:00 PMET CMU Community Members with CMU ID or Alumni with Ticket Performer(s) will be added after the Activities Board Speakers committee officially makes their announcement. \"Like\" Activities Board on Instagram for updates on artists, giveaways and location. Note: Time may change. Tickets details and information to be added in the coming weeks. ",
        "retrieved_relevant_part": true,
        "model_answer": "The Spring Carnival Midway Opening Ceremony is open to the entire CMU community and their guests",
        "actual_answer": "The Spring Carnival Midway Opening Ceremony is open to the entire CMU community.",
        "exact_match": false,
        "f1_max_min_avg": [
            0.83,
            0.83,
            0.83
        ],
        "recall_max_min_avg": [
            0.92,
            0.92,
            0.92
        ]
    },
    {
        "question": "Who sponsors the Carnival Activities Tent event?",
        "context": "April 11, 2024: Event Name: Carnival Activities Tent 3:30 PM-7:00 PMET Open to entire CMU community Featuring entertainment and games for students, alumni, faculty and staff throughout the entire weekend. Full schedule coming in March. Sponsored by the Spring Carnival Committee and the CMU Alumni Association. Note: No registration required. No event fee. This event is open to students, faculty, staff and alumni",
        "retrieved_doc": "April 13, 2024: Event Name: Carnival Activities Tent 11:00 AM-7:00 PMET Open to entire CMU community Featuring entertainment and games for students, alumni, faculty and staff throughout the entire weekend. Full schedule coming in March. Sponsored by the Spring Carnival Committee and the CMU Alumni Association. Note: No registration required. No event fee. This event is open to students, faculty, staff and alumni. Parents: Check out the separate kidzone area for kid-focused fun and activities. Weekend hours: * Thursday: 3-7 p.m. * Friday & Saturday: 11 a.m. to 7 p.m. |April 12, 2024: Event Name: Carnival Activities Tent 11:00 AM-7:00 PMET Open to entire CMU community Featuring entertainment and games for students, alumni, faculty and staff throughout the entire weekend. Full schedule coming in March. Sponsored by the Spring Carnival Committee and the CMU Alumni Association. Note: No registration required. No event fee. This event is open to students, faculty, staff and alumni. Parents: Check out the separate kidzone area for kid-focused fun and activities. Weekend hours: * Thursday: 3-7 p.m. * Friday & Saturday: 11 a.m. to 7 p.m. |April 11, 2024: Event Name: Carnival Activities Tent 3:30 PM-7:00 PMET Open to entire CMU community Featuring entertainment and games for students, alumni, faculty and staff throughout the entire weekend. Full schedule coming in March. Sponsored by the Spring Carnival Committee and the CMU Alumni Association. Note: No registration required. No event fee. This event is open to students, faculty, staff and alumni. Parents: Check out the separate kidzone area for kid-focused fun and activities. Weekend hours: * Thursday: 3-7 p.m. * Friday & Saturday: 11 a.m. to 7 p.m. |April 13, 2024: Event Name: Carnival Wellness Tent 11:00 AM-7:00 PMET Open to entire CMU community Relax and breathe with calming activities, sessions, information and much more. Full schedule available in March. Sponsored by Wellness Initiatives and the CMU Alumni Association. Note: No registration required. No event fee. This event is open to the entire CMU community and their guests. Weekend hours: * Thursday: 3-7 p.m. * Friday & Saturday: 11 a.m. to 7 p.m. |April 12, 2024: Event Name: Carnival Wellness Tent 11:00 AM-7:00 PMET Open to entire CMU community Relax and breathe with calming activities, sessions, information and much more. Full schedule available in March. Sponsored by Wellness Initiatives and the CMU Alumni Association. Note: No registration required. No event fee. This event is open to the entire CMU community and their guests. Weekend hours: * Thursday: 3-7 p.m. * Friday & Saturday: 11 a.m. to 7 p.m. |April 11, 2024: Event Name: Carnival Wellness Tent 3:30 PM-7:00 PMET Open to entire CMU community Relax and breathe with calming activities, sessions, information and much more. Full schedule available in March. Sponsored by Wellness Initiatives and the CMU Alumni Association. Note: No registration required. No event fee. This event is open to the entire CMU community and their guests. Weekend hours: * Thursday: 3-7 p.m. * Friday & Saturday: 11 a.m. to 7 p.m. ",
        "retrieved_relevant_part": false,
        "model_answer": "The Carnival Activities Tent event is sponsored by the Spring Carnival Committee and the CMU Alumni Association",
        "actual_answer": "The Carnival Activities Tent event is sponsored by the Spring Carnival Committee and the CMU Alumni Association.",
        "exact_match": false,
        "f1_max_min_avg": [
            0.82,
            0.82,
            0.82
        ],
        "recall_max_min_avg": [
            0.82,
            0.82,
            0.82
        ]
    },
    {
        "question": "Where will the Material Science and Engineering (MSE) Alumni Deck Party take place on April 12, 2024?",
        "context": "April 12, 2024: Event Name: Material Science and Engineering (MSE) Alumni Deck Party 3:30 PM-5:30 PMET Open to MSE alumni Alumni of the Materials Science and Engineering Department (and their guests) are invited to catch up with the faculty and staff on the MSE Deck for a happy hour. Note: Registration required. Walk-ins are welcome as space permits. No event fee.",
        "retrieved_doc": "April 12, 2024: Event Name: Material Science and Engineering (MSE) Alumni Deck Party 3:30 PM-5:30 PMET Open to MSE alumni Alumni of the Materials Science and Engineering Department (and their guests) are invited to catch up with the faculty and staff on the MSE Deck for a happy hour. Note: Registration required. Walk-ins are welcome as space permits. No event fee. This event is open to the alumni and guests of the MSE community. |April 13, 2024: Event Name: MechE Alumni Breakfast 9:30 AM-11:30 AMET Open to alumni and families of the MechE community Mechanical Engineering alumni and their families are invited to join us in Scaife Hall to watch the Buggy races and enjoy breakfast pastries, coffee and community. Note: Registration required. Walk-ins are welcome as space permits. No event fee. This event is open to the MechE community and their guests. |April 12, 2024: Event Name: ChemE Alumni, Faculty & Student Mixer 3:00 PM-5:00 PMET Open to alumni and families of the ChemE community ChemE alumni are invited to join the faculty and students in the Rothfus Lab for a meet and greet with refreshments. Catch up on what's new with student and faculty research projects and other department activities. Note: Registration required. Walk-ins are welcome as space permits. No event fee. This event is open to the ChemE community and their guests. |Spring 2024: Date: 2024-05-12 Day: Su Event: Commencement|April 12, 2024: Event Name: Engineering and Public Policy (EPP) Ice Cream Social 3:30 PM-5:30 PMET Open to EPP community EPP students, alumni, parents and families are invited to join the EPP faculty and staff for ice cream sundaes. Note: Registration required. Walk-ins are welcome as space permits. No event fee. This event is open to EPP alumni and their guests. |Spring 2024: Date: 2024-04-15-2024-04-19 Day: M-F Event: Fall 2024 Registration Week",
        "retrieved_relevant_part": false,
        "model_answer": "The Materials Science and Engineering (MSE) Alumni Deck Party will take place on April 12, 2024",
        "actual_answer": "The Material Science and Engineering (MSE) Alumni Deck Party will take place on the MSE Deck.",
        "exact_match": false,
        "f1_max_min_avg": [
            0.75,
            0.75,
            0.75
        ],
        "recall_max_min_avg": [
            0.75,
            0.75,
            0.75
        ]
    },
    {
        "question": "Who donated $1 million for the creation of a technical institute in Pittsburgh in 1900?",
        "context": "He turned his attention to writing, social activism and philanthropy, determined to establish educational opportunities for the general public where few existed.\nIn 1900, he donated $1 million for the creation of a technical institute for the city of Pittsburgh, envisioning a school where working-class men and women of Pittsburgh could learn practical skills, trades and crafts that would.",
        "retrieved_doc": "philanthropy, determined to establish educational opportunities for the general public where few existed. In 1900, he donated $1 million for the creation of a technical institute for the city of Pittsburgh, envisioning a school where working-class|century.    Carnegie Technical Schools  At one point the richest man in the world, Carnegie believed that \"to die rich is to die disgraced.\" He turned his attention to writing, social activism and philanthropy, determined to establish educational|Tartan Facts: Who founded Carnegie Mellon University? Carnegie Technical Schools was founded in 1900 by Andrew Carnegie. Twelve years later it became known as the Carnegie Institute of Technology. In 1967, the school merged with Mellon Institute and|envisioning a school where working-class men and women of Pittsburgh could learn practical skills, trades and crafts that would enhance their careers, lives and communities. \"My heart is in the work,\" he stated, which would become part of the|Andrew Carnegie and other funders, Carnegie Tech laid the foundation for a school on the cutting edge. Some key developments were: It expanded from two buildings into an elegant 20th century campus designed in the beaux arts architectural style,|degrees through its College of Engineering and College of Fine Arts, becoming the Carnegie Institute of Technology, or \"Carnegie Tech.\" During the first half of the 20th century, with support from Andrew Carnegie and other funders, Carnegie Tech",
        "retrieved_relevant_part": false,
        "model_answer": "The person who donated 1 million for the creation of a technical institute in Pittsburgh in 1900 is not mentioned in the context",
        "actual_answer": "Andrew Carnegie.",
        "exact_match": false,
        "f1_max_min_avg": [
            0,
            0,
            0.0
        ],
        "recall_max_min_avg": [
            0,
            0,
            0.0
        ]
    },
    {
        "question": "What statement became part of the official motto of the technical institute?",
        "context": "he donated $1 million for the creation of a technical institute for the city of Pittsburgh, envisioning a school where working-class men and women of Pittsburgh could learn practical skills, trades and crafts that would enhance their careers, lives and communities.\n\"My heart is in the work,\" he stated, which would become part of the school's official motto.\nThe Carnegie Technical Schools offered two- and three-year certificates in the arts as well as in engineering disciplines and included a college for women, Margaret Morrison Carnegie College.\n \n Carnegie Tech \u2013 Early Years \nSoon faced with the demand for baccalaureate programs, Carnegie Technical Schools began offering bachelor's degrees through its College of Engineering and College of Fine Arts",
        "retrieved_doc": "work,\" he stated, which would become part of the school's official motto. The Carnegie Technical Schools offered two- and three-year certificates in the arts as well as in engineering disciplines and included a college for women, Margaret Morrison|envisioning a school where working-class men and women of Pittsburgh could learn practical skills, trades and crafts that would enhance their careers, lives and communities. \"My heart is in the work,\" he stated, which would become part of the|designed in the beaux arts architectural style, housing a wealth of machine shops, studios and laboratories \u2014 the hands-on center of learning that persists today. It pioneered conservatory degree programs in music and drama, in addition to visual|century.    Carnegie Technical Schools  At one point the richest man in the world, Carnegie believed that \"to die rich is to die disgraced.\" He turned his attention to writing, social activism and philanthropy, determined to establish educational|the 20th century brought unprecedented growth to Carnegie Tech. In 1956, the arrival of the first IBM computer to campus was revolutionary, initiating a university culture where information technology pervaded virtually all areas of study.|Spring offering: Course: 18578 Title: Mechatronic Design Units: 12.0 Lec/Sec: Section A Days: Monday, Wednesday Begin: 12:00PM End: 01:50PM Bldg/Room: SH 238 Location: Pittsburgh, Pennsylvania Instructor(s): Riviere ",
        "retrieved_relevant_part": false,
        "model_answer": "Mechanical Design",
        "actual_answer": "\"My heart is in the work\" became part of the school's official motto.",
        "exact_match": false,
        "f1_max_min_avg": [
            0,
            0,
            0.0
        ],
        "recall_max_min_avg": [
            0,
            0,
            0.0
        ]
    },
    {
        "question": "When did Carnegie Tech merge with the Mellon Institute?",
        "context": "In 1967, Carnegie Tech merged with the Mellon Institute, a science research center founded by the Mellon family of Pittsburgh, to become known as Carnegie Mellon University. The merger built upon a long history of support from the Mellons.\nIt allowed Carnegie Mellon to establish the last of its current pillars: the\u00a0Mellon College of Science\u00a0and the College of Humanities and Social Sciences, now known as\u00a0Marianna Brown Dietrich College of Humanities and Social Sciences.\nIn 2017,",
        "retrieved_doc": "In 1967, Carnegie Tech merged with the Mellon Institute, a science research center founded by the Mellon family of Pittsburgh, to become known as Carnegie Mellon University. The merger built upon a long history of support from the Mellons. It|now known as\u00a0Marianna Brown Dietrich College of Humanities and Social Sciences. In 2017, Carnegie Mellon celebrated the 50th anniversary of the Carnegie Tech-Mellon Institute merger, revisiting the shared vision of the founders and recognizing the|Mellon has soared to national and international leadership in higher education and research. A birthplace of innovation since its founding, it continues to be known for innovation, for solving real-world problems and for interdisciplinary|Tartan Facts: Who founded Carnegie Mellon University? Carnegie Technical Schools was founded in 1900 by Andrew Carnegie. Twelve years later it became known as the Carnegie Institute of Technology. In 1967, the school merged with Mellon Institute and|1967, the school merged with Mellon Institute and became what is known today as Carnegie Mellon University. What is a Tartan? The Carnegie Mellon athletic teams are nicknamed the \"Tartans\" as a nod to Andrew Carnegie's Scottish heritage. A tartan is|public sector. 1986:\u00a0School of Computer Science, pioneering computing and artificial intelligence, led by interdisciplinary efforts of Allen Newell and Herbert Simon.    Carnegie Mellon University  In 1967, Carnegie Tech merged with the Mellon",
        "retrieved_relevant_part": false,
        "model_answer": "In 1967",
        "actual_answer": "Carnegie Tech merged with the Mellon Institute in 1967.",
        "exact_match": false,
        "f1_max_min_avg": [
            0,
            0,
            0.0
        ],
        "recall_max_min_avg": [
            0,
            0,
            0.0
        ]
    },
    {
        "question": "What is the current name of the College of Humanities and Social Sciences at Carnegie Mellon University?",
        "context": "\nIt allowed Carnegie Mellon to establish the last of its current pillars: the\u00a0Mellon College of Science\u00a0and the College of Humanities and Social Sciences, now known as\u00a0Marianna Brown Dietrich College of Humanities and Social Sciences.\nIn 2017, Carnegie Mellon celebrated the 50th anniversary of the Carnegie Tech-Mellon Institute merger, revisiting the shared vision of the founders and recognizing the impact it has had, and will continue to have, in the world of higher education, research and discovery.\n \n A Global Impact \nIn its 115 years, Carnegie Mellon has soared to national and international leadership in higher education and research.",
        "retrieved_doc": "now known as\u00a0Marianna Brown Dietrich College of Humanities and Social Sciences. In 2017, Carnegie Mellon celebrated the 50th anniversary of the Carnegie Tech-Mellon Institute merger, revisiting the shared vision of the founders and recognizing the|Requests     Department Quick Facts  Name of School: Carnegie Mellon University  City/Zip: Pittsburgh, PA 15213  Founded: 1900  Enrollment (undergrad): 6,982- Fall 2021  Enrollment (graduate and doctoral): 7,062 - Fall 2021  Alumni: 102,577|a long history of support from the Mellons. It allowed Carnegie Mellon to establish the last of its current pillars: the\u00a0Mellon College of Science\u00a0and the College of Humanities and Social Sciences, now known as\u00a0Marianna Brown Dietrich College of|6 1 Welcome Welcome to Carnegie Mellon University! Being in the CMU School of Computer Science (SCS) is a unique experience because of the size of the school (over 2000 students, staff and faculty), the quality of its members, the variety of research being conducted, and unparalleled learning opportunities. We encourage you to take adva ntage of CMU offerings, both inside and outside SCS, and also to explore Pittsburgh and southw est Pennsylvania to the extent your schedule permits. What you will find is an environm ent that encourages and rewards hard work and accomplishment. Pittsburgh has long been an indu strial area whose residents build things. In SCS we build things, and you will also. While this handbook is specific to your academic ex perience in the MSAII program, there are several other resources and offices graduate students are encouraged to consult during their tenure at Carnegie Mellon University. Infor mation about The Word, the student handbook, the Office of Graduate and Postdoc A ffairs, the Office of the Dean of Student Affairs and others are included in Appendix A of this handbook. 2 Mission, Vision and Philosophy Carnegie Mellon University will have a transfor mative impact on society through continual innovation in education, research, creativity, and entrepreneurship. Our mission is to create a transformative educatio nal experience for students focused on deep disciplinary knowledge; problem solving; teamwork, leadership, communication, and interpersonal skills; and pers onal health and well-being. The university community is committed to (a) at tracting and retaining diverse, world-class talent; (b) creating a collaborative environment open to the free exchange of ideas, in which research, creativity, innovation, and entrepreneu rship can flourish; and (c) ensuring individuals can achieve their full potential. We encourage our members to impact society in a transformative way \u2014 regionally, nationally, and globally \u2014 by engaging with partners out side the traditional bor ders of the university campus. See the full university mission statement . 3 Carnegie Mellon Statement of Assurance Carnegie Mellon University does not discriminate in admission, employment or administration of its programs or activities on the basis of r ace, color, national origin, sex, handicap or disability, age, sexual orientation, gender identity , religion, creed, ancestry , belief, veteran status or genetic information. Furthe rmore, Carnegie Mellon University does not discriminate and is required not to discriminate in violation of fede ral, state or local laws or executive orders|Carnegie Mellon University has been a birthplace  of innovation since its founding in 1900. Today, CMU is a global leader bringing groundbreaking  ideas to market and creating successful startup  businesses. Our award-winning faculty are renowned for  working closely with students to solve major scientific,  technological and societal challenges. We put a strong  emphasis on creating things \u2014 from art to robots. We  have become a model for economic development in  forming partnerships with companies such as Uber,  Google and Disney. Our students are recruited by some  of the world\u2019s most innovative companies. MANAGEMENT  INFORMATION  SYSTEMS U.S. News & World Report, 2022#1 ARTIFICIAL  INTELLIGENCE U.S. News & World Report, 2022#1 AMONG U.S.   UNIVERSITIES Times Higher Education   World University  Ranking, 2023#19SOFTWARE  ENGINEERING U.S. News & World Report, 2022COLLEGE OF  ENGINEERING U.S. News & World Report, 2022#1 #4#1SCHOOL OF  COMPUTER  SCIENCE U.S. News & World Report, 2022 UNIVERSITY   IN THE WORLD Times Higher Education   World University   Ranking, 2023#28TIME-BASED/   NEW MEDIA U.S. News & World Report, 2019#11,529   FACULTY16,779   STUDENTSGraduate Undergraduate 117,257  ALUMNI (LIVING) 85%  U.S. 15%  International35%  U.S. 65%  International 76%  U.S. 24%  InternationalGLOBAL COMMUNITY Students representing 126 countries Faculty representing 56 countries Alumni representing  148 countries OF COMPUTER  SCIENCE\u2019S FIRST- YEAR STUDENTS   WERE WOMEN   IN 2019 Nearly triple the   national average\u201c My Heart is in the Work. \u201d    Andrew Carnegie, Founder    November 15, 1900 49.8 % 87%  U.S. 13%  InternationalSCHOOLS AND COLLEGES College of Engineering  College of Fine Arts Dietrich College of Humanities   and Social Sciences Heinz College of Information Systems  and Public Policy Mellon College of Science School of Computer Science Tepper School of Business cmu.edu/assets/pdfs/cmu-fact-sheet.pdf    |   cmu.edu/about/awards.htmlMarch 2020BIG IDEAS THAT SHAPE YOUR WORLD START HERE 1,000+ companies greenlighted  across the U.S. and internationally  Cognitive tutors,  which improve  the math skills of 500,000+  students each year  The first U.S. school to award   a degree in drama  in 1914 James Gosling (SCS 1983)  invented the Java computer  programming language . The first exclusive higher  education partner of the Tony  Awards\u00ae , co-creating the first,  national recognition program  honoring K-12 theatre educators The first smile in an email , created  in 1982 by professor Scott Fahlman Kevlar Fiber , invented by alumna  Stephanie Kwolek (MM 1946) The Last Lecture , written   by alumni Randy Pausch (SCS 1988)   and Jeffrey Zaslow (DC 1980) In 1919, CMU\u2019s first Ph.D.  was  awarded to Mao Yisheng, father   of Chinese bridge construction.  Duolingo , invented by professor   Luis von Ahn (CS 2003, 2005), had   10 million downloads in 12 months  and was named Apple\u2019s 2013 app   of the year. :-) LEADERSHIP Farnam Jahanian    President David Coulter   Chair, Board of Trustees James H. Garrett Jr.   Provost2 National Academy of Engineering       3 National Academy of Sciences        4 National Academy of Medicine  Won by alumni and current/former faculty The leading university center  for cybersecurity , providing  support to more than 110  centers around the world  The world\u2019s first university  robotics department ,   founded in 1979 Alumnus Andy Warhol    (CFA1949), pop artist pioneer   and cultural icon One of only 29 universities   invited to be a member of the  World Economic Forum\u2019s  Global University   Leaders Forum CMU.EDU ECONOMIC IMPACT \u2022 Attracting major companies  \u2014   including Google, Intel, Uber and GE \u2014   to locate operations and create new   jobs in Pittsburgh \u2022 To date, the CMU community has  launched more than 400 startups   and created more than 152 spinoff  companies . \u2022 Contributing to the cultural and civic life of   the city with performances , exhibitions   and research collaborations 13 ACADEMY   AWARDS65 MEMBERS   OF NAE2 146 EMMY   AWARDS20 MEMBERS   OF NAS3 6 MEMBERS   OF NAM4 13 TURING   AWARDS 20 NOBEL   LAUREATES 58 TONY   AWARDS May 2023|Mellon throughout the world.   Carnegie Mellon University challenges the curious and passionate to deliver work that matters. Calendar Careers",
        "retrieved_relevant_part": false,
        "model_answer": "The current name of the College of Humanities and Social Sciences at Carnegie Mellon University is \"Mariam Brown Dietrich College of Humanities and Social Sciences.\"",
        "actual_answer": "The College of Humanities and Social Sciences is now known as the Marianna Brown Dietrich College of Humanities and Social Sciences.",
        "exact_match": false,
        "f1_max_min_avg": [
            0.48,
            0.48,
            0.48
        ],
        "recall_max_min_avg": [
            0.52,
            0.52,
            0.52
        ]
    },
    {
        "question": "How many years has Carnegie Mellon been in existence as of now?",
        "context": "the shared vision of the founders and recognizing the impact it has had, and will continue to have, in the world of higher education, research and discovery.\n \n A Global Impact \nIn its 115 years, Carnegie Mellon has soared to national and international leadership in higher education and research.",
        "retrieved_doc": "shared vision of the founders and recognizing the impact it has had, and will continue to have, in the world of higher education, research and discovery.    A Global Impact  In its 115 years, Carnegie Mellon has soared to national and international|Requests     Department Quick Facts  Name of School: Carnegie Mellon University  City/Zip: Pittsburgh, PA 15213  Founded: 1900  Enrollment (undergrad): 6,982- Fall 2021  Enrollment (graduate and doctoral): 7,062 - Fall 2021  Alumni: 102,577|Mellon has soared to national and international leadership in higher education and research. A birthplace of innovation since its founding, it continues to be known for innovation, for solving real-world problems and for interdisciplinary|Carnegie Mellon University has been a birthplace  of innovation since its founding in 1900. Today, CMU is a global leader bringing groundbreaking  ideas to market and creating successful startup  businesses. Our award-winning faculty are renowned for  working closely with students to solve major scientific,  technological and societal challenges. We put a strong  emphasis on creating things \u2014 from art to robots. We  have become a model for economic development in  forming partnerships with companies such as Uber,  Google and Disney. Our students are recruited by some  of the world\u2019s most innovative companies. MANAGEMENT  INFORMATION  SYSTEMS U.S. News & World Report, 2022#1 ARTIFICIAL  INTELLIGENCE U.S. News & World Report, 2022#1 AMONG U.S.   UNIVERSITIES Times Higher Education   World University  Ranking, 2023#19SOFTWARE  ENGINEERING U.S. News & World Report, 2022COLLEGE OF  ENGINEERING U.S. News & World Report, 2022#1 #4#1SCHOOL OF  COMPUTER  SCIENCE U.S. News & World Report, 2022 UNIVERSITY   IN THE WORLD Times Higher Education   World University   Ranking, 2023#28TIME-BASED/   NEW MEDIA U.S. News & World Report, 2019#11,529   FACULTY16,779   STUDENTSGraduate Undergraduate 117,257  ALUMNI (LIVING) 85%  U.S. 15%  International35%  U.S. 65%  International 76%  U.S. 24%  InternationalGLOBAL COMMUNITY Students representing 126 countries Faculty representing 56 countries Alumni representing  148 countries OF COMPUTER  SCIENCE\u2019S FIRST- YEAR STUDENTS   WERE WOMEN   IN 2019 Nearly triple the   national average\u201c My Heart is in the Work. \u201d    Andrew Carnegie, Founder    November 15, 1900 49.8 % 87%  U.S. 13%  InternationalSCHOOLS AND COLLEGES College of Engineering  College of Fine Arts Dietrich College of Humanities   and Social Sciences Heinz College of Information Systems  and Public Policy Mellon College of Science School of Computer Science Tepper School of Business cmu.edu/assets/pdfs/cmu-fact-sheet.pdf    |   cmu.edu/about/awards.htmlMarch 2020BIG IDEAS THAT SHAPE YOUR WORLD START HERE 1,000+ companies greenlighted  across the U.S. and internationally  Cognitive tutors,  which improve  the math skills of 500,000+  students each year  The first U.S. school to award   a degree in drama  in 1914 James Gosling (SCS 1983)  invented the Java computer  programming language . The first exclusive higher  education partner of the Tony  Awards\u00ae , co-creating the first,  national recognition program  honoring K-12 theatre educators The first smile in an email , created  in 1982 by professor Scott Fahlman Kevlar Fiber , invented by alumna  Stephanie Kwolek (MM 1946) The Last Lecture , written   by alumni Randy Pausch (SCS 1988)   and Jeffrey Zaslow (DC 1980) In 1919, CMU\u2019s first Ph.D.  was  awarded to Mao Yisheng, father   of Chinese bridge construction.  Duolingo , invented by professor   Luis von Ahn (CS 2003, 2005), had   10 million downloads in 12 months  and was named Apple\u2019s 2013 app   of the year. :-) LEADERSHIP Farnam Jahanian    President David Coulter   Chair, Board of Trustees James H. Garrett Jr.   Provost2 National Academy of Engineering       3 National Academy of Sciences        4 National Academy of Medicine  Won by alumni and current/former faculty The leading university center  for cybersecurity , providing  support to more than 110  centers around the world  The world\u2019s first university  robotics department ,   founded in 1979 Alumnus Andy Warhol    (CFA1949), pop artist pioneer   and cultural icon One of only 29 universities   invited to be a member of the  World Economic Forum\u2019s  Global University   Leaders Forum CMU.EDU ECONOMIC IMPACT \u2022 Attracting major companies  \u2014   including Google, Intel, Uber and GE \u2014   to locate operations and create new   jobs in Pittsburgh \u2022 To date, the CMU community has  launched more than 400 startups   and created more than 152 spinoff  companies . \u2022 Contributing to the cultural and civic life of   the city with performances , exhibitions   and research collaborations 13 ACADEMY   AWARDS65 MEMBERS   OF NAE2 146 EMMY   AWARDS20 MEMBERS   OF NAS3 6 MEMBERS   OF NAM4 13 TURING   AWARDS 20 NOBEL   LAUREATES 58 TONY   AWARDS May 2023|a long history of support from the Mellons. It allowed Carnegie Mellon to establish the last of its current pillars: the\u00a0Mellon College of Science\u00a0and the College of Humanities and Social Sciences, now known as\u00a0Marianna Brown Dietrich College of|now known as\u00a0Marianna Brown Dietrich College of Humanities and Social Sciences. In 2017, Carnegie Mellon celebrated the 50th anniversary of the Carnegie Tech-Mellon Institute merger, revisiting the shared vision of the founders and recognizing the",
        "retrieved_relevant_part": false,
        "model_answer": "Carnegie Mellon has been in existence for 2017",
        "actual_answer": "Carnegie Mellon has been in existence for 115 years.",
        "exact_match": false,
        "f1_max_min_avg": [
            0.82,
            0.82,
            0.82
        ],
        "recall_max_min_avg": [
            0.78,
            0.78,
            0.78
        ]
    },
    {
        "question": "Question: What is the focus of the Ph.D. program in Language and Information Technology (LTI)?",
        "context": "nPh.D. in Language and Information Technology: The Ph.D. in LTI focuses on developing the next generation of scientific and entrepreneurial leaders. The first two years of the Ph.D. program are similar to our MLT program. After the second year, you will spend most of your time working closely with your faculty advisor on research that advances the state-of-the-art in computer science.\n\nPh.D. students are expected to publish papers about original research in the most competitive scientific journals and international conference proceedings, and to present their research at conferences and workshops. Most of our Ph.D. graduates become professors and research scientists, while a few have started their own companies.\n \nPh.D. in Language and Information Technology Requirements: In general, students pursuing a Ph.D. in Language and Information Technologies must\n\n    Pass at least 96 units of graduate-level courses.\n    Satisfy proficiencies in writing, presentation, programming and teaching; and\n    Propose, write and defend a Ph.D. dissertation (thesis).\n\nStudents must also attend the LTI Colloquium each semester and satisfy our Research Speaking Requirement.\n\nFor a detailed breakdown of the above requirements, download and read the PhD Handbook.\n",
        "retrieved_doc": "Ph.D. in Language and Information Technology: The Ph.D. in LTI focuses on developing the next generation of scientific and entrepreneurial leaders. The first two years of the Ph.D. program are similar to our MLT program. After the second year, you will spend most of your time working closely with your faculty advisor on research that advances the state-of-the-art in computer science.  Ph.D. students are expected to publish papers about original research in the most competitive scientific journals and international conference proceedings, and to present their research at conferences and workshops. Most of our Ph.D. graduates become professors and research scientists, while a few have started their own companies.|LTI Ph.D. Graduate Student Handbook Page 9 1 Introduction Welcome to the Language Technologies Institute, a graduate department in the School of Computer Science at Carnegie Mellon University. You have joined a Ph.D. program that focuses on excellence, creativity, and training the next generation of research leaders. While the next few years will be a time of hard work and intense concentration, we hope that your time at the LTI will also be rewarding professionally and personally. Obtaining a Ph.D. is a long and often intense journey. A healthy work-life balance helps to keep it in perspective. Carnegie Mellon is located in Pittsburgh, a city with a rich industrial and labor heritage. In the past, it was the heart of the U.S. steel industry, a source for quality packaged foods, an important financial hub, and an early pioneer in railroads, radio, and nuclear power. This is a city where people worked hard and made things that changed the world. Today, Pittsburgh has reinvented itself as a leader in Computer Science and medicine, but it is still a place where people work hard and make things that change the world . It is also an informal city, where people don\u2019t take themselves too seriously and remember to have fun. It is home to excellent museums, competitive professional sports teams, inexpensive magic shows, and free music during the summer, with skiing and magnificent state parks nearby. Your stay here will be more rewarding if you make time for e xploring the many activities that Pittsburgh and Southwest Pennsylvania have to offer. There are significant differences between CMU's different departments and degree programs in philosophical approach, procedures, policies, and regulations. Each department issues a handbook that informs graduate students of their program requirements and procedures and ensures that students have written access to standard information. This handbook describes the policies, procedures, and requirements for the Ph.D. in Language and Information Technologies. All policies not explicitly described in this document conform to School of Computer Science (SCS) policies and university policies. For information about Carnegie Mellon requirements and policies, please see the university\u2019s handbook The Word , the Office of Graduate and Postdoctoral Affairs web page , the Office of the Dean of Students web page , and other resources contained in Appendix A of this handbook. Welcome! We hope that your time here is a life-changing experience. 1.1 Degrees Offered The Language Technologies Institute offers two Ph.D. programs and four Master degrees. \u2022 Ph.D. in Language and Information Technologies (LTI Ph.D. ) \u2022 Dual-Degree Ph.D. in Language and Information Technologies (CMU-PT Ph.D.) \u2022 Masters in Language Technologies (MLT) \u2022 Master of Science in Intelligent Information Systems (MIIS) \u2022 Master of Computational Data Science (MCDS) \u2022 Master of Science in Artificial Intelligence and Innovation (MSAII)|LTI Ph.D. Graduate Student Handbook Page 10 This handbook applies to the LTI Ph.D. The Ph.D. in Language and Information Technologies (LTI Ph.D. ) is focused on understanding and extending the state of the art in computational linguistics, natural language processing, dialogue systems, information retrieval, machine translation, speech processing, video understanding, multimodal systems, automated reasoning, and other topics related to analysis and understanding of unstructured information (e.g., machine learning, and software engineering of intelligent systems). 1.2 Department Personnel The people responsible for administering the LTI Ph.D. degree are: Jamie Callan Ph.D. Program Director Professor GHC 5419 callan@cs.cmu.edu 412-268-4525 Stacey Young Ph.D. Academic Program Manager LTI Graduate Program Manager GHC 6415 staceyy@cs.cmu.edu 412-268-2623 Mona Diab LTI Director Professor GHC 5723 mdiab@andrew.cmu.edu 412-268-3669 Joan Axelson Office Manager GHC 5405 jaxelson@andrew.cmu.edu 412-268-7517 Julie Nys Employment Processes Manger GHC 5405 jnys@andrew.cmu.edu 412-268-3515 1.3 University Policies and Expectations It is the responsibility of each member of the Carnegie Mellon community to be familiar with university policies and guidelines. In addition to this departmental graduate student handbook, the following resources are available to assist you in understanding community expectations. \u2022 The Word/Student Handbook: https://www.cmu.edu/student-a ffairs/theword//index.html \u2022 Academic Integrity Policy: https:// www.cmu.edu/policies/student-and-student-life/academic-integrity.html|LTI Ph.D. Graduate Student Handbook Page 1 Ph.D. in Language and Information Technologies Student Handbook 2023-2024 Last revision: Tuesday, August 29, 2023|Ph.D. in Language and Information Technology Requirements: In general, students pursuing a Ph.D. in Language and Information Technologies must      Pass at least 96 units of graduate-level courses.     Satisfy proficiencies in writing, presentation, programming and teaching; and     Propose, write and defend a Ph.D. dissertation (thesis).  Students must also attend the LTI Colloquium each semester and satisfy our Research Speaking Requirement.  For a detailed breakdown of the above requirements, download and read the PhD Handbook.|Dual-Degree Ph.D. in Language and Information Technologies (Portugal Partnership): The LTI offers a dual-degree Ph.D. in Language and Information Technologies in cooperation with:      Universidade de Aveiro (Ph.D. in Computer Engineering), Universidade do Minho (Ph.D. in Informatics)  and the Universidade do Porto (FCUP, Ph.D. in Computer Science and FEUP, Ph.D. in Computer Science) as part of MAPi;     Universidade de Lisboa, Faculdade de Ci\u00eancias \u2013 FCUL (Ph.D. in Informatics)       Universidade de Lisboa, Instituto Superior T\u00e9cnico \u2013 IST  (Ph.D. in Computer Science and Engineering, Ph.D. in Electrical and Computer Engineering, Ph.D. in Information Security)      Universidade Nova de Lisboa, Faculdade de Ci\u00eancias e Tecnologia \u2013 FCTUNL (Ph.D. in Computer Science)      Universidade de Coimbra, Faculdade de Ci\u00eancias e Tecnologia \u2013 FCTUC (Ph.D. in Information Science and Technology)  Students jointly enrolled in the LTI Ph.D program spend a year in Portugal, then two years at Carnegie Mellon taking classes in linguistics, computer science, statistical learning and task orientation.  After completing the majority of their academic requirements, students return to Portugal for the next two years to conduct extensive research, ultimately leading to a dissertation topic that will be publicly defended. One adviser from each institution co-supervises their student\u2019s progress and helps to define their final thesis topic.",
        "retrieved_relevant_part": false,
        "model_answer": "The Ph.D. program in Language and Information Technologies (LTI) teaches students to be scientific and entrepreneurial leaders",
        "actual_answer": "The Ph.D. program in LTI focuses on developing the next generation of scientific and entrepreneurial leaders in the field.",
        "exact_match": false,
        "f1_max_min_avg": [
            0.44,
            0.44,
            0.44
        ],
        "recall_max_min_avg": [
            0.42,
            0.42,
            0.42
        ]
    },
    {
        "question": "How does the Ph.D. program in LTI differ from the MLT program during the first two years?",
        "context": "nPh.D. in Language and Information Technology: The Ph.D. in LTI focuses on developing the next generation of scientific and entrepreneurial leaders. The first two years of the Ph.D. program are similar to our MLT program. After the second year, you will spend most of your time working closely with your faculty advisor on research that advances the state-of-the-art in computer science.\n\nPh.D. students are expected to publish papers about original research in the most competitive scientific journals and international conference proceedings, and to present their research at conferences and workshops. Most of our Ph.D. graduates become professors and research scientists, while a few have started their own companies.\n \nPh.D. in Language and Information Technology Requirements: In general, students pursuing a Ph.D. in Language and Information Technologies must\n\n    Pass at least 96 units of graduate-level courses.\n    Satisfy proficiencies in writing, presentation, programming and teaching; and\n    Propose, write and defend a Ph.D. dissertation (thesis).\n\nStudents must also attend the LTI Colloquium each semester and satisfy our Research Speaking Requirement.\n\nFor a detailed breakdown of the above requirements, download and read the PhD Handbook.\n",
        "retrieved_doc": "Ph.D. in Language and Information Technology: The Ph.D. in LTI focuses on developing the next generation of scientific and entrepreneurial leaders. The first two years of the Ph.D. program are similar to our MLT program. After the second year, you will spend most of your time working closely with your faculty advisor on research that advances the state-of-the-art in computer science.  Ph.D. students are expected to publish papers about original research in the most competitive scientific journals and international conference proceedings, and to present their research at conferences and workshops. Most of our Ph.D. graduates become professors and research scientists, while a few have started their own companies.|LTI Ph.D. Graduate Student Handbook Page 2|LTI Ph.D. Graduate Student Handbook Page 26 4.1.7 Transferring Into the Ph.D. Program The LTI does not allow direct transfers from its master\u2019s programs into its Ph.D. program . The student must apply for the Ph.D. at the usual time . However, students that are already enrolled in an LTI degree program are not required to retake GRE and TOEFL exams or to produce new transcripts from other universities. 4.1.8 Transferring Out of the Ph.D. Program The Ph.D. program doe s not prevent students from transferring to another degree program . A student who is interested in transferring out of the Ph.D. degree program should consult the handbook and Program Director of the desired degree program to learn whether transfers are permitted, and if so, how, and when to request such a transfer. 4.2 LTI Academic Policies 4.2.1 \u201cGrandfather\u201d Policy A student can graduate under the policies in effect at the time that the student entered the program; or, at the student's choice, the student can graduate under policies that are adopted after the student entered the program. If it is not realistic to follow a particular policy exactly, the department may approximate the policy as closely as possible; this situation is rare and typically arises only when a student is enrolled in the program for an extended period of time. 4.2.2 Definition of Transfer Credit vs. Course Exemption The LT I may grant transfer credit or issue an exemption for equivalent graduate courses previously completed at another institution. This decision rests with the director of the particular program. If a student is exempt from a required course due to prior cour ses or experience, the student can replace that course with an open elective. The student does not receive credit for the external course but can take any course that could normally count toward the degree in its place. If a student receives credit for pr ior coursework completed at CMU or elsewhere, the student receives that many units of credit, and the total amount of required coursework is reduced by that amount. 4.2.3 External Employment/Consulting Students funded by LTI research projects are expected to wor k primarily for those projects. Since consulting provides useful experience, students are generally permitted to consult at most one day per seven-day week, with the advisor's consent . International students must also have approval in advance from the Office of International Education (OIE) ; otherwise, they may be in violation of their visa status. See also External Internships|LTI Ph.D. Graduate Student Handbook Page 4 3.3 LTI Orientation ................................................................................................................................. 18 3.4 End of Semester Evaluation ............................................................................................................ 18 3.5 Electives Outside of SCS ................................................................................................................. 19 3.6 Completing an M.S. Degree Enrou te to a Ph.D. ........................................................................ 19 3.7 Grading and Evaluation ................................................................................................................. 20 3.7.1 University Policy on Grades ................................................................................................. 20 3.7.2 University Policy on Grades for Transfer Courses ......................................................... 20 3.8 Academic Integrity ........................................................................................................................... 21 3.9 Withdrawal of a Degree ................................................................................................................. 22 3.10 Employment Eligibility Verification ........................................................................................... 22 3.11 Additional Guidance for Students ............................................................................................... 22 3.11.1 Program of Study ..................................................................................................................... 23 3.11.2 Financial Aid and Student Account ................................................................................... 23 3.11.3 International Students ........................................................................................................... 23 4 Ph.D. Academic Policies ................................................................................................................. 23 4.1 Duration of Study ............................................................................................................................ 23 4.1.1 Department Policy on Double Counting Courses .......................................................... 24 4.1.2 External Internships .............................................................................................................. 24 4.1.3 Maximum Courseload ........................................................................................................... 25 4.1.4 Pass/Fail Grades ...................................................................................................................... 25 4.1.5 Transfer Credit ........................................................................................................................ 25 4.1.6 Residency Requirements ...................................................................................................... 25 4.1.7 Transferring Into the Ph.D. Program .................................................................................. 26|Master of Language Technologies: The MLT program prepares students for a research career in academia or industry. In this program, you\u2019ll be immersed in research for two full years. During the academic year, your time will be evenly split between taking courses and doing research with your faculty advisor. Your summer will be devoted entirely to research. Many MLT grads continue on to Ph.D. programs at CMU and other top institutions, while others pursue careers at companies emphasizing research and rapid innovation.|LTI Ph.D. Graduate Student Handbook Page 3 Contents 1 Introduction ........................................................................................................................................ 9 1.1 Degrees Offered .................................................................................................................................. 9 1.2 Department Personnel ..................................................................................................................... 10 1.3 University Policies and Expectations .......................................................................................... 10 1.4 The Academic Calendar .................................................................................................................. 11 1.5 Carnegie Mellon University Statement of Assurance ............................................................. 11 1.6 The Carnegie Mellon Code ............................................................................................................. 12 2 The Language Technologies Institute ......................................................................................... 12 2.1 Pittsburgh Campus Location ......................................................................................................... 12 2.2 Office Space ........................................................................................................................................ 13 2.3 Mailboxes and Office Supplies ...................................................................................................... 13 2.4 Photocopies and Printers ................................................................................................................ 13 2.5 Computers for LTI Ph.D. Students ............................................................................................... 13 3 Standard Degree Requirements & Degree Certification ....................................................... 14 3.1 LTI Ph.D. Degree Requirements ................................................................................................... 14 3.1.1 Course Requirements ............................................................................................................. 14 3.1.2 Grade Requirements ............................................................................................................... 15 3.1.3 Proficiency Requirements ...................................................................................................... 15 3.1.4 The Ph.D. Dissertation ............................................................................................................ 16 3.1.5 Research Speaking Requirement ......................................................................................... 17 3.2 Advising .............................................................................................................................................. 17",
        "retrieved_relevant_part": false,
        "model_answer": "The Ph.D. program in LTI is different from the MLT program during the first two years",
        "actual_answer": "The first two years of the Ph.D. program are similar to the MLT program, after which students primarily engage in research under the guidance of faculty advisors.",
        "exact_match": false,
        "f1_max_min_avg": [
            0.42,
            0.42,
            0.42
        ],
        "recall_max_min_avg": [
            0.33,
            0.33,
            0.33
        ]
    },
    {
        "question": "What are the prerequisites for students interested in the language technologies minor?",
        "context": "Undergraduate LT Concentration Requirements: \n\n\nStudents interested in the language technologies minor must complete our prerequisite courses with an average grade of B (3.0) or better before applying to the program. (Students who do not meet this average must submit a letter of explanation along with their application.) Prerequisites include:\n\n    Principles of Imperative Computation (15-122)\n    Principles of Functional Programming (15-150)\n\nWe also strongly encourage candidates to take\n\n    Differential and Integral Calculus (21-120) and Integration and Approximation (21-122)\n    Matrices and Linear Transformations (21-241) or Matrix Theory (21-242)\n    Probability and Computing (15-259) or Probability (21-325) or Probability Theory for Computer Scientists (36-218) or Introduction to Probability Theory (36-225)",
        "retrieved_doc": "Undergraduate LT Concentration Requirements:    Students interested in the language technologies minor must complete our prerequisite courses with an average grade of B (3.0) or better before applying to the program. (Students who do not meet this average must submit a letter of explanation along with their application.) Prerequisites include:      Principles of Imperative Computation (15-122)     Principles of Functional Programming (15-150)  We also strongly encourage candidates to take      Differential and Integral Calculus (21-120) and Integration and Approximation (21-122)     Matrices and Linear Transformations (21-241) or Matrix Theory (21-242)     Probability and Computing (15-259) or Probability (21-325) or Probability Theory for Computer Scientists (36-218) or Introduction to Probability Theory (36-225)|Undergraduate LT Concentration Admission: Students interested in earning a minor in language technologies must apply for admission no later than September 30 of their senior year. An admission decision will usually be made within one month. Students may petition the LTI undergraduate program director to be admitted to the minor earlier or later in their undergraduate careers. To apply, contact the program's director, Carolyn Ros\u00e9.|Undergraduate LT Concentration Curriculum: The Language Technologies Concentration requires that SCS students complete one core course and their choice of three elective courses of at least 9 units each. The electives can be chosen from a specific set of stand-alone courses. In addition to the four courses, students are required to do an undergraduate research project for at least 9 units to complete their concentration.|Undergraduate LT Concentration: Human language technologies have become an increasingly central component of computer science. Information retrieval, machine translation and speech technology are used daily by the general public, while text mining, natural language processing and language-based tutoring are common within more specialized professional or educational environments. The LTI prepares students for this world by offering a minor that gives you the opportunity to not only learn about language technologies, but to also apply that knowledge through a directed project.|MLT Graduate Student Handbook Page 13 4 MLT Degree Attainment 4.1 Course Requirements In order to complete the Master of Language Technologies degree, the student must pass 120 or more course units of senior-to-graduate courses, and meet the following criteria: \u2022 within those 120 units, at least 72 units of \u201cLTI\u201d courses and 24 units of \u201cSCS\u201d courses, \u2022 within those 72 units, 11-711, 11-791 (or an equivalent , see below ), and one ``Task Orientation Focus'' class, and \u2022 within those 72 units, at least one of the following: o an LTI lab course, o 11-792, or o project-oriented Masters \u2019 thesis; \u2022 Of the remaining 24 unit s, 12 must be 11-910 Directed Research ; \u2022 The final 12 units are an Open Elective. The student must also complete two summers of full-time directed research, attend the LTI Colloquium (11-700) each semester, and satisfy the Research Speaking Requirement desc ribed elsewhere. Since 11-791 is not being offered currently, the faculty have defined a list of acceptable substitute courses: \u2022 11-727: Computational Semantics for NLP ( only if the course project was done as a group project) \u2022 11-731: Machine Translation \u2022 11-747: Neural Networks for NLP \u2022 11-751: Speech Recognition \u2022 11-775: Large-Scale Multimedia \u2022 11-776: Multimodal Affective Computing \u2022 11-777: Multimodal Machine Learning \u2022 11-785: Deep Learning \u2022 11-797: Question Answering Students may request to have other LTI course s with a group engineering project component to be added to this list. For definitions of quoted terms, see the section on \u201cDefinitions of LTI Terminology .\u201d Unless approved by the Program Director in advance, t he course requirements must be satisfied by actual classroom courses, not credit given for research or independent study|Ph.D. in Language and Information Technology Requirements: In general, students pursuing a Ph.D. in Language and Information Technologies must      Pass at least 96 units of graduate-level courses.     Satisfy proficiencies in writing, presentation, programming and teaching; and     Propose, write and defend a Ph.D. dissertation (thesis).  Students must also attend the LTI Colloquium each semester and satisfy our Research Speaking Requirement.  For a detailed breakdown of the above requirements, download and read the PhD Handbook.",
        "retrieved_relevant_part": false,
        "model_answer": "Students must complete their prerequisite courses with an average grade of B (3.0) or better in order to be eligible for the language technologies minor",
        "actual_answer": "The prerequisites for the language technologies minor include completing Principles of Imperative Computation (15-122) and Principles of Functional Programming (15-150) with an average grade of B (3.0) or better.",
        "exact_match": false,
        "f1_max_min_avg": [
            0.48,
            0.48,
            0.48
        ],
        "recall_max_min_avg": [
            0.45,
            0.45,
            0.45
        ]
    },
    {
        "question": "When does the application period for Fall 2024 admission to the Master of Science in Intelligent Information Systems (MIIS) program at Carnegie Mellon University open?",
        "context": " \nMaster of Science in Intelligent Information Systems (MIIS) Admission: \n\nCarnegie Mellon's School of Computer Science has a centralized online application process. Applications and all supporting documentation for fall admission to any of the LTI's graduate programs must be received by the application deadline. Incomplete applications will not be considered. The application period for Fall 2024 will open on September 6, 2023.\n\n*Please note, we no longer require mailed, hard versions of transcripts or test scores at the time of application. Do not mail anything to the admissions office. If you are accepted to a program, you will be given instruction to then mail your materials.\n\nFinal Application Deadline\n\nDecember 13, 2023 at 3:00 p.m. EST.\n\nCost\n\n    $100 per program, $80 for applications submitted before November 29, 2023 at 3:00 p.m. EST (early deadline).\n\nFee Waivers\n\nFee waivers may be available in cases of financial hardship, or for participants in select \"pipeline\" programs. For more information, please refer to the School of Computer Science Fee Waiver page.\n\nRequirements\n\nThe School of Computer Science requires the following for all Master's applications.\n\n    GRE scores: MIIS applicants must submit their GRE scores. The scores must be less than five years old. The GRE Subject Test is not required, but is recommended. Our Institution Code is 2074; Department Code is 0402.\n\n    Proof of English Language Proficiency:\n\nIf you will be studying on an F-1 or J-1 visa, and English is not a native language for you (native language\u2026meaning spoken at home and from birth), we are required to formally evaluate your English proficiency. We require applicants who will be studying on an F-1 or J-1 visa, and for whom English is not a native language, to demonstrate English proficiency via one of these standardized tests: TOEFL (preferred), IELTS, or Duolingo.  We discourage the use of the \"TOEFL ITP Plus for China,\" since speaking is not scored.\n\nWe do not issue waivers for non-native speakers of English.  In particular, we do not issue waivers based on previous study at a U.S. high school, college, or university.  We also do not issue waivers based on previous study at an English-language high school, college, or university outside of the United States.  No amount of educational experience in English, regardless of which country it occurred in, will result in a test waiver. Submit valid, recent scores: If as described above you are required to submit proof of English proficiency, your TOEFL, IELTS or Duolingo test scores will be considered valid as follows: If you have not received a bachelor\u2019s degree in the U.S., you will need to submit an English proficiency score no older than two years. (scores from exams taken before Sept. 1, 2021, will not be accepted.)\n\nIf you are currently working on or have received a bachelor's and/or a master's degree in the U.S., you may submit an expired test score up to five years old. (scores from exams taken before Sept. 1, 2018, will not be accepted.)Additional details about English proficiency requirements are provided on the FAQ page.\n\n    Official transcripts from each university you have attended, regardless of whether you received your degree there.\n    Current resume.\n    Statement of Purpose.\n    Three letters of recommendation.\n\nFor more details on these requirements, please see the SCS Master's Admissions page.\n\nIn addition to the SCS guidelines, the MIIS requires:\n\n    A short (1-3 minute) video of yourself. There will be a prompt question that you will respond to. You will have three attempts.\n\nNo incomplete applications will be eligible for consideration.\n\nFor specific application/admissions questions, please contact Brianna Eriksen.\n\n",
        "retrieved_doc": "Master of Science in Intelligent Information Systems (MIIS) Admission:   Carnegie Mellon's School of Computer Science has a centralized online application process. Applications and all supporting documentation for fall admission to any of the LTI's graduate programs must be received by the application deadline. Incomplete applications will not be considered. The application period for Fall 2024 will open on September 6, 2023.  *Please note, we no longer require mailed, hard versions of transcripts or test scores at the time of application. Do not mail anything to the admissions office. If you are accepted to a program, you will be given instruction to then mail your materials.  Final Application Deadline  December 13, 2023 at 3:00 p.m. EST.  Cost      $100 per program, $80 for applications submitted before November 29, 2023 at 3:00 p.m. EST (early deadline).  Fee Waivers  Fee waivers may be available in cases of financial hardship, or for participants in select \"pipeline\" programs. For more information, please refer to the School of Computer Science Fee Waiver page.  Requirements  The School of Computer Science requires the following for all Master's applications.      GRE scores: MIIS applicants must submit their GRE scores. The scores must be less than five years old. The GRE Subject Test is not required, but is recommended. Our Institution Code is 2074; Department Code is 0402.      Proof of English Language Proficiency:  If you will be studying on an F-1 or J-1 visa, and English is not a native language for you (native language\u2026meaning spoken at home and from birth), we are required to formally evaluate your English proficiency. We require applicants who will be studying on an F-1 or J-1 visa, and for whom English is not a native language, to demonstrate English proficiency via one of these standardized tests: TOEFL (preferred), IELTS, or Duolingo.  We discourage the use of the \"TOEFL ITP Plus for China,\" since speaking is not scored.  We do not issue waivers for non-native speakers of English.  In particular, we do not issue waivers based on previous study at a U.S. high school, college, or university.  We also do not issue waivers based on previous study at an English-language high school, college, or university outside of the United States.  No amount of educational experience in English, regardless of which country it occurred in, will result in a test waiver. Submit valid, recent scores: If as described above you are required to submit proof of English proficiency, your TOEFL, IELTS or Duolingo test scores will be considered valid as follows: If you have not received a bachelor\u2019s degree in the U.S., you will need to submit an English proficiency score no older than two years. (scores from exams taken before Sept. 1, 2021, will not be accepted.)  If you are currently working on or have received a bachelor's and/or a master's degree in the U.S., you may submit an expired test score up to five years old. (scores from exams taken before Sept. 1, 2018, will not be accepted.)Additional details about English proficiency requirements are provided on the FAQ page.      Official transcripts from each university you have attended, regardless of whether you received your degree there.     Current resume.     Statement of Purpose.     Three letters of recommendation.  For more details on these requirements, please see the SCS Master's Admissions page.  In addition to the SCS guidelines, the MIIS requires:      A short (1-3 minute) video of yourself. There will be a prompt question that you will respond to. You will have three attempts.  No incomplete applications will be eligible for consideration.  For specific application/admissions questions, please contact Brianna Eriksen.|Master of Science in Artificial Intelligence and Innovation (MSAII) Admission:   Carnegie Mellon's School of Computer Science has a centralized online application process. Applications and all supporting documentation for fall admission to any of the LTI's graduate programs must be received by the application deadline. Incomplete applications will not be considered. The application period for Fall 2024 will open on September 6, 2023.  Final Application Deadline  December 13, 2023 at 3:00 p.m. EST.  Cost      $100 for one program, $80 if application is submitted before November 29, 2023 at 3PM EST (early deadline).  Fee Waivers  Fee waivers may be available in cases of financial hardship, or for participants in select \"pipeline\" programs. For more information, please refer to the School of Computer Science Fee Waiver page.  Requirements  The School of Computer Science requires the following for all applications:      A GPA of 3.0 or higher. (Students should report raw university GPA scores and NOT converted scores. Please DO NOT convert your international score to a US GPA or weighted GPA or other system).      GRE scores: GRE is required. Our Institution Code is 2074; Department Code is 0402.       English Language Proficiency: If you will be studying on an F-1 or J-1 visa, and English is not a native language for you (native language\u2026meaning spoken at home and from birth), an official copy of an English proficiency score report is required. The English proficiency requirement cannot be waived for any reason. Find more information under \"Test Scores\" on our FAQ page.Unofficial transcripts from each university you have attended, regardless of whether you received a degree.      Current resume.      Statement of Purpose. A Statement of Purpose is not a resume. It should discuss your reasons for choosing the MSAII program and indicate your intended career path.       Three letters of recommendation.      A short (1-3 minutes) video of yourself. Tell us about you and why you are interested in the MSAII program. This is not a required part of the application process, but it is STRONGLY suggested.    For specific application/admissions questions, please contact Amber Vivis.|MIIS Graduate Student Handbook Page 6 1 Welcome Welcome to the Language Technologies Institute. While this handbook (and your college graduate student handbook) is specific to your academic experience in the LTI, there are several other resources and offices that graduate students are encouraged to consult during their tenure at Carnegie Mellon University. Information about The Word, the student handbook, the Office of Graduate and Postdoc Affairs, the Office of the Dean of Student Affairs, and others, are included in Appendix A of this handbook. 1.1 Vision Carnegie Mellon University will have a transformative impact on society through continual innovation in education, research, creativity, and entrepreneurship. 1.2 Mission To create a transformative educational experience for students focused on deep disciplinary knowledge; problem solving; leadership, communication, and interpersonal skills; and personal health and well-being. To cultivate a transformative university community committed to (a) attracting and retaining diverse, world-class talent; (b) creating a collaborative environment open to the free exchange of ideas, where research, creativity, innovation, and entrepreneurship can flourish; and (c) ensuring individuals can achieve their full potential. To impact society in a transformative way \u2014 regionally, nationally, and globally \u2014 by engaging with partners outside the traditional borders of the university campus. 1.3 The MIIS Degree The Master of Science in Intelligent Information Systems (MIIS) is a professional degree offered by the Language Technologies Institute (LTI), a graduate department in the School of Computer Science at Carnegie Mellon University. The MIIS degree provides advanced study and practical experience in areas of Computer Science focused on the processing and analysis of unstructured and semi-structured information, for example, text, image, video, speech, and audio information. It is a practice-oriented professional degree designed for students who want to rapidly master advanced content-analysis, mining, and intelligent information technologies prior to beginning or resuming leadership careers in industry and government. There are significant differences between CMU's different departments and degree programs in philosophical approach, procedures, policies, and regulations. Each department issues a|Master of Computational Data Science (MCDS) Admission:   Carnegie Mellon's School of Computer Science has a centralized online application process. Applications and all supporting documentation for fall admission to any of the LTI's graduate programs must be received by the application deadline. Incomplete applications will not be considered. The application period for Fall 2024 will open on September 6, 2023.  *Please note, we no longer require mailed, hard versions of transcripts or test scores at the time of application. Do not mail anything to the admissions office. If you are accepted to a program, you will be given instruction to then mail your materials.  Final Application Deadline  December 13, 2023 at 3:00 p.m. EST.  Cost      $100 per program, $80 for applications submitted before November 29,2023 at 3:00 p.m. EST (early deadline).  Fee Waivers  Fee waivers may be available in cases of financial hardship, or for participants in select \"pipeline\" programs. For more information, please refer to the School of Computer Science Fee Waiver page.  Requirements  The School of Computer Science requires the following for all Ph.D. applications.      GRE scores: These must be less than five years old. The GRE Subject Test is not required, but is recommended. Our Institution Code is 2074; Department Code is 0402.      Proof of English Language Proficiency:     If you will be studying on an F-1 or J-1 visa, and English is not a native language for you (native language\u2026meaning spoken at home and from birth), we are required to formally evaluate your English proficiency. We require applicants who will be studying on an F-1 or J-1 visa, and for whom English is not a native language, to demonstrate English proficiency via one of these standardized tests: TOEFL (preferred), IELTS, or Duolingo. We discourage the use of the \"TOEFL ITP Plus for China,\" since speaking is not scored.      We do not issue waivers for non-native speakers of English. In particular, we do not issue waivers based on previous study at a U.S. high school, college, or university. We also do not issue waivers based on previous study at an English-language high school, college, or university outside of the United States. No amount of educational experience in English, regardless of which country it occurred in, will result in a test waiver.      Applicants applying to MCDS are required to submit scores from an English proficiency exam taken within the last two years. Scores taken before Sept. 1, 2021, will not be accepted regardless of whether you have previously studied in the U.S. For more information about their English proficiency score policies, visit the MCDS admission website.       Successful applicants will have a minimum TOEFL score of 100 (Reading, Listening, Speaking, Writing scores all 25 or above), IELTS score of 7.5 (Reading 7 or above, Listening 7 or above, Speaking 7.5 or above, Writing 6.5 or above), or DuoLingo score of 120 (Literacy 115 or above, Comprehension 125 or above, Production 100 or above, Conversation 105 or above). Our Institution Code is 4256; the Department Code is 78. Additional details about English proficiency requirements are provided on the FAQ page.      Official transcripts from each university you have attended, regardless of whether you received your degree there.     A short (1-3 minutes) video of yourself. Tell us about you and why you are interested in the MCDS program. This is not a required part of the application process, but it is STRONGLY suggested.       Current resume.     Statement of Purpose.     Three letters of recommendation.  For more details on these requirements, please see the SCS Master's Admissions page.  In addition to the SCS guidelines, the LTI requires:      Any outside funding you are receiving must be accompanied by an official award letter.  No incomplete applications will be eligible for consideration.  For specific application/admissions questions, please contact Jennifer Lucas or Caitlin Korpus.|Master of Science in Intelligent Information Systems Student Handbook 2023-2024 Revised: August 2023 Last revision date : September 1 , 2023 The information contained in this graduate handbook template focuses on the resources and locations available at the Carnegie Mellon Pittsburgh Campus|Master of Language Technologies Admission:   Carnegie Mellon's School of Computer Science has a centralized online application process. Applications and all supporting documentation for fall admission to any of the LTI's graduate programs must be received by the application deadline. Incomplete applications will not be considered. The application period for Fall 2024 will open on September 6, 2023.  *Please note, we no longer require mailed, hard versions of transcripts or test scores at the time of application. Do not mail anything to the admissions office. If you are accepted to a program, you will be given instruction to then mail your materials.  Final Application Deadline  December 13, 2023 at 3 p.m. EST.  Cost      $100 per program, $80 for applications submitted before November 29, 2023 at 3PM EST (early deadline).  Fee Waivers  Fee waivers may be available in cases of financial hardship, or for participants in select \"pipeline\" programs. For more information, please refer to the School of Computer Science Fee Waiver page.  Requirements  The School of Computer Science requires the following for all graduate program applications:      GRE scores: GREs are now optional, but if you want to submit GRE scores:     These must be less than five years old. A GRE subject test in science, engineering, computer science, math, etc. is not required, but you may complete one and submit the scores if you wish. Our Institution Code is 2074; Department Code is 0402.     If you will be studying on an F-1 or J-1 visa, and English is not a native language for you (native language\u2026meaning spoken at home and from birth), an official copy of an English proficiency score report is required. The English proficiency requirement cannot be waived for any reason. Find more information under \"Test Scores\" on our FAQ page.     Successful applicants will have a minimum TOEFL score of 100. Our Institution Code is 4256; the Department Code is 78.     Official transcripts from each university you have attended, regardless of whether you received your degree there.     Current resume.     Statement of Purpose.     Three letters of recommendation.  For more details on these requirements, please see the SCS Master's Admissions page.  In addition to the SCS guidelines, the LTI requires:      A short (1-3 minute) video of yourself. There will be a prompt question that you will respond to. You will have three attempts. This is not a required part of the application process, but it's strongly suggested.      Any outside funding you are receiving must be accompanied by an official award letter.  No incomplete applications will be eligible for consideration.  For specific application/admissions questions, please contact Kate Schaich.  Tuition Rates  Tuition is set by the School of Computer Science and can vary by year. Current tuition rates can be found on the Graduate Tuition section of the Student Financial Services website.  Financial Aid Resources  Research Assistant-ships are occasionally offered by research advisors to current MLT students. These are not guaranteed and vary from semester-to-semester. They fluctuate and are dependent on the funding source, research advisor and MLT student.  Student Financial Services has additional information on financial aid and billing / payments. They have a detailed outline of how to apply for financial aid on the Graduate Financial Aid Process page.  Enrollment & Finances has additional resource links to assist with financial aid and tuition payments.  Graduate Education \u2013 Financial Assistance provides resources for current students regarding emergency loans and conference travel grants.",
        "retrieved_relevant_part": false,
        "model_answer": "September 6, 2023",
        "actual_answer": "The application period for Fall 2024 admission to the MIIS program at Carnegie Mellon University opens on September 6, 2023.",
        "exact_match": false,
        "f1_max_min_avg": [
            0.17,
            0.17,
            0.17
        ],
        "recall_max_min_avg": [
            0.1,
            0.1,
            0.1
        ]
    },
    {
        "question": "What standardized tests are required for MIIS applicants, and what are the English language proficiency requirements?",
        "context": " \nMaster of Science in Intelligent Information Systems (MIIS) Admission: \n\nCarnegie Mellon's School of Computer Science has a centralized online application process. Applications and all supporting documentation for fall admission to any of the LTI's graduate programs must be received by the application deadline. Incomplete applications will not be considered. The application period for Fall 2024 will open on September 6, 2023.\n\n*Please note, we no longer require mailed, hard versions of transcripts or test scores at the time of application. Do not mail anything to the admissions office. If you are accepted to a program, you will be given instruction to then mail your materials.\n\nFinal Application Deadline\n\nDecember 13, 2023 at 3:00 p.m. EST.\n\nCost\n\n    $100 per program, $80 for applications submitted before November 29, 2023 at 3:00 p.m. EST (early deadline).\n\nFee Waivers\n\nFee waivers may be available in cases of financial hardship, or for participants in select \"pipeline\" programs. For more information, please refer to the School of Computer Science Fee Waiver page.\n\nRequirements\n\nThe School of Computer Science requires the following for all Master's applications.\n\n    GRE scores: MIIS applicants must submit their GRE scores. The scores must be less than five years old. The GRE Subject Test is not required, but is recommended. Our Institution Code is 2074; Department Code is 0402.\n\n    Proof of English Language Proficiency:\n\nIf you will be studying on an F-1 or J-1 visa, and English is not a native language for you (native language\u2026meaning spoken at home and from birth), we are required to formally evaluate your English proficiency. We require applicants who will be studying on an F-1 or J-1 visa, and for whom English is not a native language, to demonstrate English proficiency via one of these standardized tests: TOEFL (preferred), IELTS, or Duolingo.  We discourage the use of the \"TOEFL ITP Plus for China,\" since speaking is not scored.\n\nWe do not issue waivers for non-native speakers of English.  In particular, we do not issue waivers based on previous study at a U.S. high school, college, or university.  We also do not issue waivers based on previous study at an English-language high school, college, or university outside of the United States.  No amount of educational experience in English, regardless of which country it occurred in, will result in a test waiver. Submit valid, recent scores: If as described above you are required to submit proof of English proficiency, your TOEFL, IELTS or Duolingo test scores will be considered valid as follows: If you have not received a bachelor\u2019s degree in the U.S., you will need to submit an English proficiency score no older than two years. (scores from exams taken before Sept. 1, 2021, will not be accepted.)\n\nIf you are currently working on or have received a bachelor's and/or a master's degree in the U.S., you may submit an expired test score up to five years old. (scores from exams taken before Sept. 1, 2018, will not be accepted.)Additional details about English proficiency requirements are provided on the FAQ page.\n\n    Official transcripts from each university you have attended, regardless of whether you received your degree there.\n    Current resume.\n    Statement of Purpose.\n    Three letters of recommendation.\n\nFor more details on these requirements, please see the SCS Master's Admissions page.\n\nIn addition to the SCS guidelines, the MIIS requires:\n\n    A short (1-3 minute) video of yourself. There will be a prompt question that you will respond to. You will have three attempts.\n\nNo incomplete applications will be eligible for consideration.\n\nFor specific application/admissions questions, please contact Brianna Eriksen.\n\n",
        "retrieved_doc": "MIIS Graduate Student Handbook Page 14 A MIIS student must complete the following curricular requirements: 1. Qualifying courses: MIIS-16 students must pass 72 units (typically 6 12-unit courses) and MIIS-21 students must complete 96 units (typically 8 12-unit courses) in qualifying master\u2019s courses. A qualifying master\u2019s course is defined as: a. Any graduate course (600-level or higher) offered by the Language Technologies Institute; and b. Any graduate course (600-level or higher) from the list of approved qualifying courses (Section 3. 2.4). 2. Free elective: Students must pass 12 units (typically 1 course) in elective master\u2019s course(s). A free elective is defined as: a. A graduate course (600-level or higher) with content relevant to the MIIS program objectives offered by the School of Computer Science ; and b. A course approved by the student's advisor and the degree Program Director. c. A student may not use the same course to satisfy both a qualifying course requirement and an elective course requirement. 3. Breadth requirements : Students must demonstrate breadth by passing one course in each of the following areas. In addition, MIIS-21 students must take two more LTI courses (24 units total) in one of the following areas of concentration: \u2022 Human language; \u2022 Machine learning; and \u2022 Language technology applications. The department maintains and publishes a list of courses that satisfy each of these requirements (Sections 3. 2.5 \u2013 3.2.7). Some c ourses used to satisfy a breadth requirement can also satisfy qualifying course requirements. A student should get approval from the director for the breadth courses , if not listed below. 4.4 Approved Qualifying Courses Any graduate course (600-level or higher) offered by the Language Technologies Institute is a qualifying course. Any two graduate courses (600-level or higher) offered by departments within the SCS relevant to the MIIS degree other than LTI (Machine Learning or Computer Science departments, etc.) may be counted as approved qualifying courses |MIIS Graduate Student Handbook Page 13 4 MIIS Degree Requirements and Related Policies/Protocols 4.1 Program Options The MIIS degree is offered in two options: Option 1. Standard MIIS degree (MIIS-16)-A 16-month track that is completed in three academic semesters (fall, spring, fall) and a summer internship. Option 2. MIIS: Advanced Study degree (MIIS-21)-A 21-month track that is completed in four academic semesters (fall, spring, fall, spring) and a summer internship. MIIS: Advanced Study track offers in depth degree in one of the following areas of concentration: \u2022 Human Language for Language Technologies \u2022 Language Technology Application \u2022 Machine Learning for Language Technologies Part-time options are available in some cases. 4.2 Required Units for Degree Attainment To complete the Master of Science in Intelligent Information Systems, a student must satisfy three types of requirements. Curricular requirements ensure that MIIS students receive instruction in core intelligent information systems technologies while also allowing an opportunity to specialize in areas of personal interest. Practice requirements are opportunities to apply and hone new skills while building state-of-the-art systems. Grade requirements ensure that students have demonstrated a certain level of sk ill while completing degree requirements. All three types of requirements are described below. MIIS-16 students must take at least 84 units (typically 7 12-unit courses) of qualifying and elective courses that satisfy human language, machine learning, and language technology applications breadth requirements and 66 practice units for a total of 150 units to attain the Standard MIIS degree. MIIS-21 students must take at least 108 units (typically 9 12-unit courses) of qualifying and elective courses and 66 practice units to satisfy their degree requirements, making it a total of 174 units to attain the MIIS: Advanced Study degree. 4.3 Core Requirements|Master of Science in Intelligent Information Systems (MIIS) Requirements:   The Intelligent Information Systems degree offers students the flexibility to create their own course of study in consultation with their advisor.   MIIS students gain three types of practical experience: software development supervised by their advisor (24 units equivalent to two courses); a summer internship (which can be waived for students that have sufficient prior professional experience); and a capstone project executed in a group of peers (42 units equivalent to three 12-unit courses and one 6-unit course). This combination is proven to help IIS students to broaden their skills quickly. The MIIS degree is offered in two options:  Option 1. Standard MIIS degree (MIIS-16) - A 16-month track that is completed in three academic semesters (fall, spring, fall) and a summer internship.    Option 2. MIIS: Advanced Study degree (MIIS-21) - A 21-month track that is completed in four academic semesters (fall, spring, fall, spring) and a summer internship.  MIIS: Advanced Study track offers indepth degree in one of the following areas of concentration:      Human Language for Language Technologies     Language Technology Application     Machine Learning for Language Technologies  Part-time education option is available in some cases.   MIIS-16 students must take at least 84 units (typically 7 courses) of qualifying and elective courses that satisfy human language, machine learning, and language technology applications breadth requirements. MIIS-21 students have to take at least two more courses from the selected concentration area to satisfy their degree requirements, making it total of 108 units (typically 9 courses) of qualifying and elective courses, that also satisfy breadth requirements.  For a full list of requirements, read the MIIS Handbook.|MIIS Graduate Student Handbook Page 25 Director. Typically , the student will provide the Program Director with the syllabus of the external course, and the Program Director will use that and the student\u2019s transcript to make the decision. Satisfying a breadth requirement with a course from another institution does not reduce the number of CMU course units that must be taken to attain the MIIS degree. See the section on \u201cDefinition of transfer credit versus course exemption\u201d on page 2 5. 6.1.6 Transferring into the MIIS Program Transfers into the MIIS program are not permitted during a student\u2019s first semester at CMU. Students must begin their study at CMU in the program that admitted them. Students may request to transfer into the MIIS program after completing their first semester and before the add/drop deadline of the spring semester. The student must make the request in writing (or email) to the MIIS Program Director. The MIIS Program D irector will inform the student about what application materials are required, for example, an explanation of why a transfer is desired, a proposed plan of study, a proposed advisor, and CMU transcripts. Students that are already enrolled in an LTI degree program are not required to retake GRE and TOEFL /IELTS/Duolingo exams or to produce new transcripts from other universities. The MIIS program will conduct an expedited admissions process after receiving such a request. The program will explicitly consider whether the coursework done prior to the transfer will allow the student to be \u201con schedule\u201d by the end of the spring semest er, so that the student can participate in a capstone project with other MIIS students during the next fall semester. MIIS students are allowed to switch tracks (MIIS-16 to MIIS-21 and vice versa) after beginning their first semester at CMU. Ideally, all switch requests must be filed within the first semester of the program. It is highly recommended to not switch tracks more than once! Though not forbidden, multiple track switching may negatively impact immigration records of international students. Students also must understand that extension of their stay in the program will lead to additional financial obligations. U.S. citizens, virtually, have no restrictions on how many times they can switch if it is done for a legitimate reason. To confirm legitimacy of the reason to switch tracks ALL students must seek their advisor's approval and the approval of the Director of the MIIS program. 6.1.7 Transferring Out of the MIIS Program The MIIS program does not prevent students from transferring to another degree program. Each degree program has its own rules about whether and when transfers into the program are permitted. A student that is interested in transferring out of the MIIS de gree program should consult the handbook and Program Director of the desired degree program to learn whether transfers are permitted, and if so, how, and when to request such a transfer|MIIS Graduate Student Handbook Page 16 \u2022 11-785, Introduction to Deep Learning \u2022 10-601, Introduction to Machine Learning (Master\u2019s) \u2022 10-605, Machine Learning with Large Datasets \u2022 10-701, Introduction to Machine Learning (PhD) \u2022 10-707, Advanced Deep Learning \u2022 10-708, Probabilistic Graphical Models \u2022 10-714, Deep Learning Systems \u2022 10-715, Advanced Introduction to Machine Learning 4.5 Practice Requirements A student must complete at least 66 practice-oriented course units and satisfy the following practice-oriented requirements for both MIIS-16 and MIIS-21 programs. 1. Directed study requirement: Students must pass 24 units (typically 12 units x 2 semesters) in directed study under the supervision of their advisor. Directed study is a structured, task-oriented form of independent study that provides deep, hands-on experience in a particular technology area and an opportunity to work closely with a member of the faculty. 2. Internship requirement: Students must complete a one-semester (typically summer) internship at an organization (typically a company or government agency) approved by the MIIS Program Director. Internships are an opportunity to apply new skills in a professional setting and to le arn about software development in a \u2018real world\u2019 organization. Students with prior professional experience may petition the MIIS Program Director to waive this requirement. MIIS students that do an internship during the summer semester are required to present their internship at a poster session at the beginning of the following Fall semester. The poster and the student\u2019s participation in the poster session are part of the internship requirement. Participation is required unless waived in writing by the MIIS Program Director. 3. Capstone requirements: Students must complete a capstone project (36 units) and a capstone planning seminar (6 units). The capstone requirement gives students experience with collaborative, team-oriented software development; significant hands-on experience with the techniques studied in the classroom; and an opportunity to work on a large software application. a. The capstone project (36 units) is a large, group-oriented demonstration of student skill in one or more areas covered by the degree. Typically, the result of the capstone project is a major software application. The capstone project is supervised by a member of the faculty who meets with students on a weekly basis to monitor progress and provide guidance|Master of Science in Intelligent Information Systems (MIIS) Admission:   Carnegie Mellon's School of Computer Science has a centralized online application process. Applications and all supporting documentation for fall admission to any of the LTI's graduate programs must be received by the application deadline. Incomplete applications will not be considered. The application period for Fall 2024 will open on September 6, 2023.  *Please note, we no longer require mailed, hard versions of transcripts or test scores at the time of application. Do not mail anything to the admissions office. If you are accepted to a program, you will be given instruction to then mail your materials.  Final Application Deadline  December 13, 2023 at 3:00 p.m. EST.  Cost      $100 per program, $80 for applications submitted before November 29, 2023 at 3:00 p.m. EST (early deadline).  Fee Waivers  Fee waivers may be available in cases of financial hardship, or for participants in select \"pipeline\" programs. For more information, please refer to the School of Computer Science Fee Waiver page.  Requirements  The School of Computer Science requires the following for all Master's applications.      GRE scores: MIIS applicants must submit their GRE scores. The scores must be less than five years old. The GRE Subject Test is not required, but is recommended. Our Institution Code is 2074; Department Code is 0402.      Proof of English Language Proficiency:  If you will be studying on an F-1 or J-1 visa, and English is not a native language for you (native language\u2026meaning spoken at home and from birth), we are required to formally evaluate your English proficiency. We require applicants who will be studying on an F-1 or J-1 visa, and for whom English is not a native language, to demonstrate English proficiency via one of these standardized tests: TOEFL (preferred), IELTS, or Duolingo.  We discourage the use of the \"TOEFL ITP Plus for China,\" since speaking is not scored.  We do not issue waivers for non-native speakers of English.  In particular, we do not issue waivers based on previous study at a U.S. high school, college, or university.  We also do not issue waivers based on previous study at an English-language high school, college, or university outside of the United States.  No amount of educational experience in English, regardless of which country it occurred in, will result in a test waiver. Submit valid, recent scores: If as described above you are required to submit proof of English proficiency, your TOEFL, IELTS or Duolingo test scores will be considered valid as follows: If you have not received a bachelor\u2019s degree in the U.S., you will need to submit an English proficiency score no older than two years. (scores from exams taken before Sept. 1, 2021, will not be accepted.)  If you are currently working on or have received a bachelor's and/or a master's degree in the U.S., you may submit an expired test score up to five years old. (scores from exams taken before Sept. 1, 2018, will not be accepted.)Additional details about English proficiency requirements are provided on the FAQ page.      Official transcripts from each university you have attended, regardless of whether you received your degree there.     Current resume.     Statement of Purpose.     Three letters of recommendation.  For more details on these requirements, please see the SCS Master's Admissions page.  In addition to the SCS guidelines, the MIIS requires:      A short (1-3 minute) video of yourself. There will be a prompt question that you will respond to. You will have three attempts.  No incomplete applications will be eligible for consideration.  For specific application/admissions questions, please contact Brianna Eriksen.",
        "retrieved_relevant_part": false,
        "model_answer": "MIIS applicants must submit their GRE scores, which must be less than five years old, and proof of English proficiency if they are currently working on or have received a bachelor's degree in the U.S",
        "actual_answer": "MIIS applicants must submit GRE scores, and if English is not their native language and they will be studying on an F-1 or J-1 visa, they must demonstrate English proficiency through tests such as TOEFL, IELTS, or Duolingo. Valid test scores should be recent, typically no older than two years for applicants without a U.S. bachelor's degree and up to five years old for applicants with a U.S. degree.",
        "exact_match": false,
        "f1_max_min_avg": [
            0.4,
            0.4,
            0.4
        ],
        "recall_max_min_avg": [
            0.3,
            0.3,
            0.3
        ]
    },
    {
        "question": "What is the structure of the dual-degree Ph.D. program in Language and Information Technologies (Portugal Partnership)?",
        "context": "\nDual-Degree Ph.D. in Language and Information Technologies (Portugal Partnership) Requirments: Students participating in the dual-degree program will spend their first year in Portugal, followed by two years in Pittsburgh to complete their coursework. They will complete a maximum of eight courses with a proper balance of focus areas (linguistics, computer science, statistical/learning and task orientation). After that, they will return to Portugal for their last two years, pursuing research and completing their dissertation. For more, see the Carnegie Mellon | Portugal page.\n",
        "retrieved_doc": "Dual-Degree Ph.D. in Language and Information Technologies (Portugal Partnership) Requirments: Students participating in the dual-degree program will spend their first year in Portugal, followed by two years in Pittsburgh to complete their coursework. They will complete a maximum of eight courses with a proper balance of focus areas (linguistics, computer science, statistical/learning and task orientation). After that, they will return to Portugal for their last two years, pursuing research and completing their dissertation. For more, see the Carnegie Mellon | Portugal page.|Dual-Degree Ph.D. in Language and Information Technologies (Portugal Partnership): The LTI offers a dual-degree Ph.D. in Language and Information Technologies in cooperation with:      Universidade de Aveiro (Ph.D. in Computer Engineering), Universidade do Minho (Ph.D. in Informatics)  and the Universidade do Porto (FCUP, Ph.D. in Computer Science and FEUP, Ph.D. in Computer Science) as part of MAPi;     Universidade de Lisboa, Faculdade de Ci\u00eancias \u2013 FCUL (Ph.D. in Informatics)       Universidade de Lisboa, Instituto Superior T\u00e9cnico \u2013 IST  (Ph.D. in Computer Science and Engineering, Ph.D. in Electrical and Computer Engineering, Ph.D. in Information Security)      Universidade Nova de Lisboa, Faculdade de Ci\u00eancias e Tecnologia \u2013 FCTUNL (Ph.D. in Computer Science)      Universidade de Coimbra, Faculdade de Ci\u00eancias e Tecnologia \u2013 FCTUC (Ph.D. in Information Science and Technology)  Students jointly enrolled in the LTI Ph.D program spend a year in Portugal, then two years at Carnegie Mellon taking classes in linguistics, computer science, statistical learning and task orientation.  After completing the majority of their academic requirements, students return to Portugal for the next two years to conduct extensive research, ultimately leading to a dissertation topic that will be publicly defended. One adviser from each institution co-supervises their student\u2019s progress and helps to define their final thesis topic.|Dual-Degree Ph.D. in Language and Information Technologies (Portugal Partnership) Admission:   Students applying to the dual degree program must apply through Carnegie Mellon's online application. In addition to the requirements listed below, prospective students must also contact Stacey Young when applying.  Carnegie Mellon's School of Computer Science has a centralized online application process. Applications and all supporting documentation for fall admission to any of the LTI's graduate programs must be received by the application deadline. Incomplete applications will not be considered. The application period for Fall 2024 will open on September 6, 2023.  Final Application Deadline  December 13, 2023 3:00 p.m. EST.  Cost      $100 per program, $80 for applications submitted by November 29, 2023 at 3:00 p.m. EST (early deadline).  Fee Waivers  Fee waivers may be available in cases of financial hardship, or for participants in select programs. For more information, please refer to the School of Computer Science Fee Waiver page.  Requirements  The School of Computer Science requires the following for all Ph.D. applications.      GRE scores: These must be less than five years old. The GRE Subject Test is not required, but is recommended. Our Institution Code is 2074; Department Code is 0402.     English Proficiency Requirement: If you will be studying on an F-1 or J-1 visa, and English is not a native language for you (native language\u2026meaning spoken at home and from birth), an official copy of an English proficiency score report is required. The English proficiency requirement cannot be waived for any reason. Find more information under \"Test Scores\" on our FAQ page.     Successful applicants will have a minimum TOEFL score of 100. Our Institution Code is 4256; the Department Code is 78.     Official transcripts from each university you have attended, regardless of whether you received your degree there.     Current resume.     Statement of Purpose.     Three letters of recommendation.  For more details on these requirements, please see the SCS Doctoral Admissions page.  In addition to the SCS guidelines, the LTI requires:      A short (1-3 minute) video of yourself. There will be a prompt question that you will respond to. You will have three attempts. This is not a required part of the application process, but it's strongly suggested.      Any outside funding you are receiving must be accompanied by an official award letter.  No incomplete applications will be eligible for consideration.  For specific application/admissions questions, please contact Stacey Young.|Ph.D. in Language and Information Technology Requirements: In general, students pursuing a Ph.D. in Language and Information Technologies must      Pass at least 96 units of graduate-level courses.     Satisfy proficiencies in writing, presentation, programming and teaching; and     Propose, write and defend a Ph.D. dissertation (thesis).  Students must also attend the LTI Colloquium each semester and satisfy our Research Speaking Requirement.  For a detailed breakdown of the above requirements, download and read the PhD Handbook.|Ph.D. in Language and Information Technology Curriculum: In order to obtain your Ph.D. in Language and Information Technologies, you need to pass 96 units (generally, eight courses) of graduate courses that fulfill these requirements:      At least 72 units of LTI courses: Must include one class in each LTI focus area.     At least 24 units of SCS courses.     At least two lab courses in two different research areas.|Ph.D. in Language and Information Technology: The Ph.D. in LTI focuses on developing the next generation of scientific and entrepreneurial leaders. The first two years of the Ph.D. program are similar to our MLT program. After the second year, you will spend most of your time working closely with your faculty advisor on research that advances the state-of-the-art in computer science.  Ph.D. students are expected to publish papers about original research in the most competitive scientific journals and international conference proceedings, and to present their research at conferences and workshops. Most of our Ph.D. graduates become professors and research scientists, while a few have started their own companies.",
        "retrieved_relevant_part": true,
        "model_answer": "The dual-degree Ph.D. program in Language and Information Technologies (Ordergy Partnership) is structured by years and months",
        "actual_answer": "Students in the dual-degree Ph.D. program spend their first year in Portugal, followed by two years in Pittsburgh to complete coursework. They then return to Portugal for their last two years to conduct research and complete their dissertation.",
        "exact_match": false,
        "f1_max_min_avg": [
            0.25,
            0.25,
            0.25
        ],
        "recall_max_min_avg": [
            0.18,
            0.18,
            0.18
        ]
    },
    {
        "question": "Are fee waivers available for the dual-degree Ph.D. program application, and under what circumstances?",
        "context": "\nDual-Degree Ph.D. in Language and Information Technologies (Portugal Partnership) Admission: \n\nStudents applying to the dual degree program must apply through Carnegie Mellon's online application. In addition to the requirements listed below, prospective students must also contact Stacey Young when applying.\n\nCarnegie Mellon's School of Computer Science has a centralized online application process. Applications and all supporting documentation for fall admission to any of the LTI's graduate programs must be received by the application deadline. Incomplete applications will not be considered. The application period for Fall 2024 will open on September 6, 2023.\n\nFinal Application Deadline\n\nDecember 13, 2023 3:00 p.m. EST.\n\nCost\n\n    $100 per program, $80 for applications submitted by November 29, 2023 at 3:00 p.m. EST (early deadline).\n\nFee Waivers\n\nFee waivers may be available in cases of financial hardship, or for participants in select programs. For more information, please refer to the School of Computer Science Fee Waiver page.\n\nRequirements\n\nThe School of Computer Science requires the following for all Ph.D. applications.\n\n    GRE scores: These must be less than five years old. The GRE Subject Test is not required, but is recommended. Our Institution Code is 2074; Department Code is 0402.\n    English Proficiency Requirement: If you will be studying on an F-1 or J-1 visa, and English is not a native language for you (native language\u2026meaning spoken at home and from birth), an official copy of an English proficiency score report is required. The English proficiency requirement cannot be waived for any reason. Find more information under Test Scores",
        "retrieved_doc": "Dual-Degree Ph.D. in Language and Information Technologies (Portugal Partnership) Admission:   Students applying to the dual degree program must apply through Carnegie Mellon's online application. In addition to the requirements listed below, prospective students must also contact Stacey Young when applying.  Carnegie Mellon's School of Computer Science has a centralized online application process. Applications and all supporting documentation for fall admission to any of the LTI's graduate programs must be received by the application deadline. Incomplete applications will not be considered. The application period for Fall 2024 will open on September 6, 2023.  Final Application Deadline  December 13, 2023 3:00 p.m. EST.  Cost      $100 per program, $80 for applications submitted by November 29, 2023 at 3:00 p.m. EST (early deadline).  Fee Waivers  Fee waivers may be available in cases of financial hardship, or for participants in select programs. For more information, please refer to the School of Computer Science Fee Waiver page.  Requirements  The School of Computer Science requires the following for all Ph.D. applications.      GRE scores: These must be less than five years old. The GRE Subject Test is not required, but is recommended. Our Institution Code is 2074; Department Code is 0402.     English Proficiency Requirement: If you will be studying on an F-1 or J-1 visa, and English is not a native language for you (native language\u2026meaning spoken at home and from birth), an official copy of an English proficiency score report is required. The English proficiency requirement cannot be waived for any reason. Find more information under \"Test Scores\" on our FAQ page.     Successful applicants will have a minimum TOEFL score of 100. Our Institution Code is 4256; the Department Code is 78.     Official transcripts from each university you have attended, regardless of whether you received your degree there.     Current resume.     Statement of Purpose.     Three letters of recommendation.  For more details on these requirements, please see the SCS Doctoral Admissions page.  In addition to the SCS guidelines, the LTI requires:      A short (1-3 minute) video of yourself. There will be a prompt question that you will respond to. You will have three attempts. This is not a required part of the application process, but it's strongly suggested.      Any outside funding you are receiving must be accompanied by an official award letter.  No incomplete applications will be eligible for consideration.  For specific application/admissions questions, please contact Stacey Young.|LTI Ph.D. Graduate Student Handbook Page 26 4.1.7 Transferring Into the Ph.D. Program The LTI does not allow direct transfers from its master\u2019s programs into its Ph.D. program . The student must apply for the Ph.D. at the usual time . However, students that are already enrolled in an LTI degree program are not required to retake GRE and TOEFL exams or to produce new transcripts from other universities. 4.1.8 Transferring Out of the Ph.D. Program The Ph.D. program doe s not prevent students from transferring to another degree program . A student who is interested in transferring out of the Ph.D. degree program should consult the handbook and Program Director of the desired degree program to learn whether transfers are permitted, and if so, how, and when to request such a transfer. 4.2 LTI Academic Policies 4.2.1 \u201cGrandfather\u201d Policy A student can graduate under the policies in effect at the time that the student entered the program; or, at the student's choice, the student can graduate under policies that are adopted after the student entered the program. If it is not realistic to follow a particular policy exactly, the department may approximate the policy as closely as possible; this situation is rare and typically arises only when a student is enrolled in the program for an extended period of time. 4.2.2 Definition of Transfer Credit vs. Course Exemption The LT I may grant transfer credit or issue an exemption for equivalent graduate courses previously completed at another institution. This decision rests with the director of the particular program. If a student is exempt from a required course due to prior cour ses or experience, the student can replace that course with an open elective. The student does not receive credit for the external course but can take any course that could normally count toward the degree in its place. If a student receives credit for pr ior coursework completed at CMU or elsewhere, the student receives that many units of credit, and the total amount of required coursework is reduced by that amount. 4.2.3 External Employment/Consulting Students funded by LTI research projects are expected to wor k primarily for those projects. Since consulting provides useful experience, students are generally permitted to consult at most one day per seven-day week, with the advisor's consent . International students must also have approval in advance from the Office of International Education (OIE) ; otherwise, they may be in violation of their visa status. See also External Internships|Dual-Degree Ph.D. in Language and Information Technologies (Portugal Partnership) Requirments: Students participating in the dual-degree program will spend their first year in Portugal, followed by two years in Pittsburgh to complete their coursework. They will complete a maximum of eight courses with a proper balance of focus areas (linguistics, computer science, statistical/learning and task orientation). After that, they will return to Portugal for their last two years, pursuing research and completing their dissertation. For more, see the Carnegie Mellon | Portugal page.|LTI Ph.D. Graduate Student Handbook Page 5 4.1.8 Transferring Out of the Ph.D. Program ............................................................................. 26 4.2 LTI Academic Policies .................................................................................................................... 26 4.2.1 \u201cGrandfather\u201d Policy .............................................................................................................. 26 4.2.2 Definition of Transfer Credit vs. Course Exemption ...................................................... 26 4.2.3 External Employment/Consulting ...................................................................................... 26 4.2.4 Leave of Absence ..................................................................................................................... 27 4.2.5 Satisfactory Progress .............................................................................................................. 27 4.2.6 Time Away from Academic Responsibilities ................................................................... 27 4.3 CMU Academic Policies ................................................................................................................ 27 4.3.1 Drop/Add/Withdraw Procedures ....................................................................................... 27 4.3.2 Doctoral Student Status ........................................................................................................ 28 4.3.3 ABD versus ABD in Absentia (ABS) ................................................................................... 28 4.3.4 Statute of Limitations: Time to Degree .............................................................................. 28 4.3.5 University Financial Aid ....................................................................................................... 29 4.3.6 Assistance for Individuals with Disabilities ..................................................................... 29 4.3.7 Summary of Graduate Student Appeal and Grievance Procedures ............................ 29 4.3.8 Sexual Misconduct Policy ..................................................................................................... 29 4.3.9 Gestational and Parental Accommodations ..................................................................... 30 4.3.10 Accommodations for Gestational Parents ........................................................................ 30 4.3.11 Parental Accommodation for Doctoral Students ............................................................. 31 4.3.12 Financial Assistance for Student Parents .......................................................................... 31 4.3.13 Consensual Intimate Relationship Policy Regarding Undergraduate Students .... 32 5 Financial Support ............................................................................................................................. 32|LTI Ph.D. Graduate Student Handbook Page 25 Note that self-funded Ph.D. students (e.g., those registered for five units while on semester interns hip) are not permitted to receive a partial stipend for the semester of their internship, while full-time LTI-sponsored students are eligible for a partial stipend. All students are caution ed to be aware of potential intellectual property (IP) problems with internships, and to review any IP agreements with their advisors before signing them. It is possible to lose ownership of your ideas. If the student is to receive academic credit for the internship, it must have deliverables from the student commensurate with the number of units, they are taking. This can be in the form of interim and final reports on the experience, presentations in the following semester regarding the experience, assessments of their experience as it relates to their course of study, etc. 4.1.3 Maximum Courseload Ph.D. students are permitted to register for a maximum of 54 units of coursework per semester. 4.1.4 Pass/Fail Grades Pass/fail grades are not permitted for courses used to satisfy a degree requirement. Graduate students who are required to take additional undergraduate courses to build up the core foundations of computer science may not elect the pass/fail option for th ese courses. 4.1.5 Transfer Credit An equivalent graduate course previously completed at another institution may be permitted to satisfy one of the Ph.D. course requirements. The decision on whether a course may be transferred is made by the Ph.D. Program Direct or. Typically, the student will provide the Program Director with the syllabus of the external course, and the Program Director will use that and the student\u2019s transcript to make the decision. See the section on \u201cDefinition of transfer credit versus cour se exemption .\u201d A student may not receive transfer credit for more than four courses. 4.1.6 Residency Requirements The university requires Ph.D. s to spend at least one year of residency at Carnegie Mellon. The SCS requires that all Ph.D. students must take at Carnegie Mellon a minimum of 48 units of the total coursework required by their respective programs|Ph.D. in Language and Information Technology Admission:   Carnegie Mellon's School of Computer Science has a centralized online application process. Applications and all supporting documentation for fall admission to any of the LTI's graduate programs must be received by the application deadline. Incomplete applications will not be considered. The application period for Fall 2024 will open on September 6, 2023.  Final Application Deadline  December 13, 2023 at 3 p.m. EST.  Cost      $100 per program and $80 if the applicant applies before November 29, 2023 at 3 p.m. EST (early deadline).  Fee Waivers  Fee waivers may be available in cases of financial hardship. For more information, please refer to the School of Computer Science Fee Waiver page.  Requirements  The School of Computer Science requires the following for all Ph.D. applications.      GRE scores: GREs are now optional, but if you want to submit GRE scores:     These must be less than five years old. The GRE Subject Test is not required, but is recommended. Our Institution Code is 2074; Department Code is 0402.     English Proficiency Requirement: If you will be studying on an F-1 or J-1 visa, and English is not a native language for you (native language\u2026meaning spoken at home and from birth), an official copy of an English proficiency score report is required. The English proficiency requirement cannot be waived for any reason. Find more information under \"Test Scores\" on our FAQ page.     Successful applicants will have a minimum TOEFL score of 100. Our Institution Code is 4256; the Department Code is 78.     Official transcripts from each university you have attended, regardless of whether you received your degree there.     Current resume.     Statement of Purpose.     Three letters of recommendation.  For more details on these requirements, please see the SCS Doctoral Admissions page.  In addition to the SCS guidelines, the LTI requires:      A short (1-3 minute) video of yourself. There will be a prompt question that you will respond to. You will have three attempts. This is not a required part of the application process, but it's strongly suggested.     Any outside funding you are receiving must be accompanied by an official award letter.  No incomplete applications will be eligible for consideration.  For specific application/admissions questions, please contact Stacey Young.",
        "retrieved_relevant_part": false,
        "model_answer": "Yes, fee waivers may be available for the dual-degree Ph.D. program application in cases of financial hardship",
        "actual_answer": "Fee waivers for the dual-degree Ph.D. program application may be available in cases of financial hardship or for participants in select programs.",
        "exact_match": false,
        "f1_max_min_avg": [
            0.77,
            0.77,
            0.77
        ],
        "recall_max_min_avg": [
            0.68,
            0.68,
            0.68
        ]
    },
    {
        "question": "Who were the individuals involved in creating the first artificial intelligence program, Logic Theorist?",
        "context": "1. Artificial intelligence, 1955-56\u00a0Can you write a working computer program without a computer? Herb Simon (H\u201990), at left, Allen Newell (IA\u201957), at right, and Cliff Shaw did. The team created the first artificial intelligence program, Logic Theorist, which could solve logic puzzles in the same way that a human might solve them. Newell demonstrated that it worked by writing the instructions on 3-by-5 index cards that were manipulated on the kitchen table by Newell, his wife, and a group of Carnegie Tech grad students.",
        "retrieved_doc": "\nFirst freshman-level computer science course\n\nIn 1956 and 1957, Simon, Allen Newell (IA'57) and Cliff Shaw of RAND designed the Logic Theorist, a computer program that could develop proofs for theorems in much the same way a human would work. They also developed linked-list data structures, the foundation of computer programming. Perlis, Simon and Newell are credited with defining the term \u201ccomputer science\u201d as \u201cthe theory and design of computers,\u201d as well as (in Newell\u2019s words) \u201cthe study of the phenomena arising from them.\u201d In 1958, Perlis began teaching the first freshman-level computer programming course in the United States at Carnegie Tech.\n|What\u2019s so great about computer science at Carnegie Mellon?We're glad you asked! Here are 25 great ideas from CMU computer scientists to think about as we celebrate the birthday of the School of Computer Science.1. Artificial intelligence, 1955-56\u00a0Can you write a working computer program without a computer? Herb Simon (H\u201990), at left, Allen Newell (IA\u201957), at right, and Cliff Shaw did. The team created the first artificial intelligence program, Logic Theorist, which could solve logic puzzles in the same way that a human might solve them. Newell demonstrated that it worked by writing the instructions on 3-by-5 index cards that were manipulated on the kitchen table by Newell, his wife, and a group of Carnegie Tech grad students.| \nTuring Awards and a Nobel Prize\n\nIn 1975, Simon and Newell were awarded the A.M. Turing Award for their work in artificial intelligence. (As of 2014, 12 CMU alumni or faculty have been awarded Turings, sometimes considered the Nobel Prize of computing.) Three years later, Simon received the Nobel Prize in Economics for his work on decision-making theory. As the 1970s progressed, Newell became interested in human-computer interaction, and began a long relationship with Xerox\u2019s Palo Alto Research Center, or PARC, which released the Xerox Alto in 1973. Considered a forerunner to many of the computing environments that followed, Alto featured a graphical-user interface and was among the first commercially available workstations controlled with a mouse. Inspired by Alto, Reddy launched a drive for development of CMU\u2019s own \u201cthree-M\u201d machine\u2014a personal workstation with a megabyte of memory, a megapixel display and at least one million instructions per second of processing power.\n|Author: Graham Neubig Title: Program-Aided Reasoners (better) Know What They Know Publication year: 2023 Coauthors: Anubha Kabra, Sanketh Rangreji, Yash Mathur, Aman Madaan, Emmy Liu, Graham Neubig Abstract: Prior work shows that program-aided reasoning, in which large language models (LLMs) are combined with programs written in programming languages such as Python, can significantly improve accuracy on various reasoning tasks. However, while accuracy is essential, it is also important for such reasoners to\"know what they know\", which can be quantified through the calibration of the model. In this paper, we compare the calibration of Program Aided Language Models (PAL) and text-based Chain-of-thought (COT) prompting techniques over 5 datasets and 2 model types: LLaMA models and OpenAI models. Our results indicate that PAL leads to improved calibration in 75% of the instances. Our analysis uncovers that prompting styles that produce lesser diversity in generations also have more calibrated results, and thus we also experiment with inducing lower generation diversity using temperature scaling and find that for certain temperatures, PAL is not only more accurate but is also more calibrated than COT. Overall, we demonstrate that, in the majority of cases, program-aided reasoners better know what they know than text-based counterparts.|Author: Eric P. Xing Title: Improved Logical Reasoning of Language Models via Differentiable Symbolic Programming Publication year: 2023 Coauthors: Hanlin Zhang, Jiani Huang, Ziyang Li, M. Naik, Eric P. Xing Abstract: Pre-trained large language models (LMs) struggle to perform logical reasoning reliably despite advances in scale and compositionality. In this work, we tackle this challenge through the lens of symbolic programming. We propose DSR-LM, a Differentiable Symbolic Reasoning framework where pre-trained LMs govern the perception of factual knowledge, and a symbolic module performs deductive reasoning. In contrast to works that rely on hand-crafted logic rules, our differentiable symbolic reasoning framework efficiently learns weighted rules and applies semantic loss to further improve LMs. DSR-LM is scalable, interpretable, and allows easy integration of prior knowledge, thereby supporting extensive symbolic programming to robustly derive a logical conclusion. The results of our experiments suggest that DSR-LM improves the logical reasoning abilities of pre-trained language models, resulting in a significant increase in accuracy of over 20% on deductive reasoning benchmarks. Furthermore, DSR-LM outperforms a variety of competitive baselines when faced with systematic changes in sequence length.|Author: Eric P. Xing Title: Improved Logical Reasoning of Language Models via Differentiable Symbolic Programming Publication year: 2023 Coauthors: Hanlin Zhang, Jiani Huang, Ziyang Li, M. Naik, Eric P. Xing Abstract: Pre-trained large language models (LMs) struggle to perform logical reasoning reliably despite advances in scale and compositionality. In this work, we tackle this challenge through the lens of symbolic programming. We propose DSR-LM, a Differentiable Symbolic Reasoning framework where pre-trained LMs govern the perception of factual knowledge, and a symbolic module performs deductive reasoning. In contrast to works that rely on hand-crafted logic rules, our differentiable symbolic reasoning framework efficiently learns weighted rules and applies semantic loss to further improve LMs. DSR-LM is scalable, interpretable, and allows easy integration of prior knowledge, thereby supporting extensive symbolic programming to robustly derive a logical conclusion. The results of our experiments suggest that DSR-LM improves the logical reasoning abilities of pre-trained language models, resulting in a significant increase in accuracy of over 20% on deductive reasoning benchmarks. Furthermore, DSR-LM outperforms a variety of competitive baselines when faced with systematic changes in sequence length.",
        "retrieved_relevant_part": false,
        "model_answer": "The first artificial intelligence program, Logic Theorist, was created by Eric P. Xing, Hanlin Zhang, Jiani Huang, Ziyang Li, and M. Naik",
        "actual_answer": "Herb Simon (H'90), Allen Newell (IA'57), and Cliff Shaw.",
        "exact_match": false,
        "f1_max_min_avg": [
            0.06,
            0.06,
            0.06
        ],
        "recall_max_min_avg": [
            0.11,
            0.11,
            0.11
        ]
    },
    {
        "question": "Who developed the first computer system capable of continuous speech recognition, known as ,Hearsay I?",
        "context": "4. Speech recognition, 1976If you have an iPhone, ask Siri to look up \u201cHearsay I,\u201d the first computer system capable of continuous speech recognition. It was developed by future Turing Award winner and future SCS dean Raj Reddy along with his students. Their work on subsequent systems established many of the principles that still underlie speech recognition software.",
        "retrieved_doc": "4. Speech recognition, 1976If you have an iPhone, ask Siri to look up \u201cHearsay I,\u201d the first computer system capable of continuous speech recognition. It was developed by future Turing Award winner and future SCS dean Raj Reddy along with his students. Their work on subsequent systems established many of the principles that still underlie speech recognition software.|Author: A. Waibel Title: Convoifilter: A case study of doing cocktail party speech recognition Publication year: 2023 Coauthors: T. Nguyen, A. Waibel Abstract: This paper presents an end-to-end model designed to improve automatic speech recognition (ASR) for a particular speaker in a crowded, noisy environment. The model utilizes a single-channel speech enhancement module that isolates the speaker's voice from background noise (ConVoiFilter) and an ASR module. The model can decrease ASR's word error rate (WER) from 80% to 26.4% through this approach. Typically, these two components are adjusted independently due to variations in data requirements. However, speech enhancement can create anomalies that decrease ASR efficiency. By implementing a joint fine-tuning strategy, the model can reduce the WER from 26.4% in separate tuning to 14.5% in joint tuning. We openly share our pre-trained model to foster further research hf.co/nguyenvulebinh/voice-filter.|23. Question-answering computers, 2011 Searching the Web for information is rarely as simple as asking a question in plain English. So-called \u201cquestion-answering\u201d machines moved from laboratories to TV screens when an IBM computer called \u201cWatson\u201d defeated two human champions on the game show \u201cJeopardy!\u201d At the heart of Watson was computer architecture developed by CMU\u2019s Eric Nyberg and his students.|Author: Alexander Waibel Title: Continuously Learning New Words in Automatic Speech Recognition Publication year: 2024 Coauthors: Christian Huber, Alexander Waibel Abstract: Despite recent advances, Automatic Speech Recognition (ASR) systems are still far from perfect. Typical errors include acronyms, named entities and domain-specific special words for which little or no data is available. To address the problem of recognizing these words, we propose an self-supervised continual learning approach. Given the audio of a lecture talk with corresponding slides, we bias the model towards decoding new words from the slides by using a memory-enhanced ASR model from previous work. Then, we perform inference on the talk, collecting utterances that contain detected new words into an adaptation dataset. Continual learning is then performed on this set by adapting low-rank matrix weights added to each weight matrix of the model. The whole procedure is iterated for many talks. We show that with this approach, we obtain increasing performance on the new words when they occur more frequently (more than 80% recall) while preserving the general performance of the model.|Author: Shinji Watanabe Title: Decoder-only Architecture for Speech Recognition with CTC Prompts and Text Data Augmentation Publication year: 2023 Coauthors: E. Tsunoo, Hayato Futami, Yosuke Kashiwagi, Siddhant Arora, Shinji Watanabe Abstract: Collecting audio-text pairs is expensive; however, it is much easier to access text-only data. Unless using shallow fusion, end-to-end automatic speech recognition (ASR) models require architecture modifications or additional training schemes to use text-only data. Inspired by recent advances in decoder-only language models (LMs), such as GPT-3 and PaLM adopted for speech-processing tasks, we propose using a decoder-only architecture for ASR with simple text augmentation. To provide audio information, encoder features compressed by CTC prediction are used as prompts for the decoder, which can be regarded as refining CTC prediction using the decoder-only model. Because the decoder architecture is the same as an autoregressive LM, it is simple to enhance the model by leveraging external text data with LM training. An experimental comparison using LibriSpeech and Switchboard shows that our proposed models with text augmentation training reduced word error rates from ordinary CTC by 0.3% and 1.4% on LibriSpeech test-clean and testother set, respectively, and 2.9% and 5.0% on Switchboard and CallHome. The proposed model had advantage on computational efficiency compared with conventional encoder-decoder ASR models with a similar parameter setup, and outperformed them on the LibriSpeech 100h and Switchboard training scenarios.|Author: Alexander I. Rudnicky Title: A Vector Quantized Approach for Text to Speech Synthesis on Real-World Spontaneous Speech Publication year: 2023 Coauthors: Li-Wei Chen, Shinji Watanabe, Alexander I. Rudnicky Abstract: Recent Text-to-Speech (TTS) systems trained on reading or acted corpora have achieved near human-level naturalness. The diversity of human speech, however, often goes beyond the coverage of these corpora. We believe the ability to handle such diversity is crucial for AI systems to achieve human-level communication. Our work explores the use of more abundant real-world data for building speech synthesizers. We train TTS systems using real-world speech from YouTube and podcasts. We observe the mismatch between training and inference alignments in mel-spectrogram based autoregressive models, leading to unintelligible synthesis, and demonstrate that learned discrete codes within multiple code groups effectively resolves this issue. We introduce our MQTTS system whose architecture is designed for multiple code generation and monotonic alignment, along with the use of a clean silence prompt to improve synthesis quality. We conduct ablation analyses to identify the efficacy of our methods. We show that MQTTS outperforms existing TTS systems in several objective and subjective measures.",
        "retrieved_relevant_part": true,
        "model_answer": "A. Waibel",
        "actual_answer": "Raj Reddy and his students",
        "exact_match": false,
        "f1_max_min_avg": [
            0,
            0,
            0.0
        ],
        "recall_max_min_avg": [
            0,
            0,
            0.0
        ]
    },
    {
        "question": "Question: What institute is involved in pioneering systems for machine translation?",
        "context": "9. Machine translation, 1984Every \u201cStar Trek\u201d fan knows about the universal translator. Scientists in the Language Technologies Institute are moving those gadgets from science fiction to real life. Their pioneering systems include handheld, portable speech-to-speech translators, just like those depicted on the USS Enterprise",
        "retrieved_doc": "9. Machine translation, 1984Every \u201cStar Trek\u201d fan knows about the universal translator. Scientists in the Language Technologies Institute are moving those gadgets from science fiction to real life. Their pioneering systems include handheld, portable speech-to-speech translators, just like those depicted on the USS Enterprise.|9 University Professor GHC 6105 412-268-5704 hebert@cs.cmu.edu https://www.cs.cmu.edu/~hebert/ David Garlan Associate Dean for Master\u2019s Programs, SCS Professor TCS 420 garlan@cs.cmu.edu http://www.cs.cmu.edu/~garlan/academics.htm C a r o l y n R o s \u00e9 Interim Director, Language Technologies Institute Professor GHC 5415 412-268-7130 cprose@cs.cmu.edu 8 MSAII Policies The Language Technologies Institute (LTI) ha s prepared this statement of policies, program requirements, guidance, process a nd procedures for students in the M.S. in Artificial Intelligence and Innovation (MSAII) program. A copy of this handbook is also available online at the program website . The University Student guide, The Word, which details university-wide policies, is also available online at www.cmu.edu/student-affairs/theword . Additional resources specific to gr aduate students can be found at www.cmu.edu/graduate/policies/ 8.1 The MSAII Degree The M.S. in Artificial Intelli gence and Innovation (MSAII) is a professional master's program offered by the Language Technologies Institute (LTI) in the School of Computer Science at Carnegie Mellon University. This program seeks to educate students in the innovative use of artificial intelligence to create practical soluti ons in a wide variety of application areas. As artificial intelligence matures, th ere is a great need for students who can envision, design, plan and deliver solutions that integrate AI technolo gies such as deep learning, natural language processing, robotics and big data analytics into new applications. The program stresses both|Author: Graham Neubig Title: ChatGPT MT: Competitive for High- (but Not Low-) Resource Languages Publication year: 2023 Coauthors: Nathaniel R. Robinson, Perez Ogayo, David R. Mortensen, Graham Neubig Abstract: Large language models (LLMs) implicitly learn to perform a range of language tasks, including machine translation (MT). Previous studies explore aspects of LLMs\u2019 MT capabilities. However, there exist a wide variety of languages for which recent LLM MT performance has never before been evaluated. Without published experimental evidence on the matter, it is difficult for speakers of the world\u2019s diverse languages to know how and whether they can use LLMs for their languages. We present the first experimental evidence for an expansive set of 204 languages, along with MT cost analysis, using the FLORES-200 benchmark. Trends reveal that GPT models approach or exceed traditional MT model performance for some high-resource languages (HRLs) but consistently lag for low-resource languages (LRLs), under-performing traditional MT for 84.1% of languages we covered. Our analysis reveals that a language\u2019s resource level is the most important feature in determining ChatGPT\u2019s relative ability to translate it, and suggests that ChatGPT is especially disadvantaged for LRLs and African languages.|Author: David R. Mortensen Title: ChatGPT MT: Competitive for High- (but Not Low-) Resource Languages Publication year: 2023 Coauthors: Nathaniel R. Robinson, Perez Ogayo, David R. Mortensen, Graham Neubig Abstract: Large language models (LLMs) implicitly learn to perform a range of language tasks, including machine translation (MT). Previous studies explore aspects of LLMs\u2019 MT capabilities. However, there exist a wide variety of languages for which recent LLM MT performance has never before been evaluated. Without published experimental evidence on the matter, it is difficult for speakers of the world\u2019s diverse languages to know how and whether they can use LLMs for their languages. We present the first experimental evidence for an expansive set of 204 languages, along with MT cost analysis, using the FLORES-200 benchmark. Trends reveal that GPT models approach or exceed traditional MT model performance for some high-resource languages (HRLs) but consistently lag for low-resource languages (LRLs), under-performing traditional MT for 84.1% of languages we covered. Our analysis reveals that a language\u2019s resource level is the most important feature in determining ChatGPT\u2019s relative ability to translate it, and suggests that ChatGPT is especially disadvantaged for LRLs and African languages.|LTI Ph.D. Graduate Student Handbook Page 9 1 Introduction Welcome to the Language Technologies Institute, a graduate department in the School of Computer Science at Carnegie Mellon University. You have joined a Ph.D. program that focuses on excellence, creativity, and training the next generation of research leaders. While the next few years will be a time of hard work and intense concentration, we hope that your time at the LTI will also be rewarding professionally and personally. Obtaining a Ph.D. is a long and often intense journey. A healthy work-life balance helps to keep it in perspective. Carnegie Mellon is located in Pittsburgh, a city with a rich industrial and labor heritage. In the past, it was the heart of the U.S. steel industry, a source for quality packaged foods, an important financial hub, and an early pioneer in railroads, radio, and nuclear power. This is a city where people worked hard and made things that changed the world. Today, Pittsburgh has reinvented itself as a leader in Computer Science and medicine, but it is still a place where people work hard and make things that change the world . It is also an informal city, where people don\u2019t take themselves too seriously and remember to have fun. It is home to excellent museums, competitive professional sports teams, inexpensive magic shows, and free music during the summer, with skiing and magnificent state parks nearby. Your stay here will be more rewarding if you make time for e xploring the many activities that Pittsburgh and Southwest Pennsylvania have to offer. There are significant differences between CMU's different departments and degree programs in philosophical approach, procedures, policies, and regulations. Each department issues a handbook that informs graduate students of their program requirements and procedures and ensures that students have written access to standard information. This handbook describes the policies, procedures, and requirements for the Ph.D. in Language and Information Technologies. All policies not explicitly described in this document conform to School of Computer Science (SCS) policies and university policies. For information about Carnegie Mellon requirements and policies, please see the university\u2019s handbook The Word , the Office of Graduate and Postdoctoral Affairs web page , the Office of the Dean of Students web page , and other resources contained in Appendix A of this handbook. Welcome! We hope that your time here is a life-changing experience. 1.1 Degrees Offered The Language Technologies Institute offers two Ph.D. programs and four Master degrees. \u2022 Ph.D. in Language and Information Technologies (LTI Ph.D. ) \u2022 Dual-Degree Ph.D. in Language and Information Technologies (CMU-PT Ph.D.) \u2022 Masters in Language Technologies (MLT) \u2022 Master of Science in Intelligent Information Systems (MIIS) \u2022 Master of Computational Data Science (MCDS) \u2022 Master of Science in Artificial Intelligence and Innovation (MSAII)|MLT Graduate Student Handbook Page 6 1 Introduction 1.1 Welcome Welcome to the Language Technologies Institute. While this handbook (and your college graduate student handbook) is specific to your academic experience in the LTI, there are several other resources and offices that graduate students are encouraged to consult during their tenure at Carnegie Mellon University. Information about The Word, the student handbook, the Office of Graduate and Postdoc Affairs, the Office of the Dean of Student Affairs, and others, are included in Appendix A of this handbook. 1.2 The MLT Degree The Master of Language Technologies (MLT) is a research-oriented Master of Science degree offered by the Language Technologies Institute (LTI), a graduate department in the School of Computer Science at Carnegie Mellon University. The MLT program is a 24-month program consisting of courses, directed research, and an optional Masters ' Thesis. Typical research areas include speech processing, information retrieval, machine translation, natural language processing, machine learning, and computational biology. Many MLT graduates continue on to PhD programs in the LTI or other leading universities. Other graduates go on to work in the computer industry, many at major corporate research laboratories. There are significant differences between CMU's different departments and degree programs in philosophical approach, procedures, policies , and regulations. Each departm ent issues a handbook that informs graduate students of their program requirements and procedures and ensures that students have written access to the standard information outlined below. This handbook describes the policies, procedures, and requirements for the Master of Language Technologies (MLT) degree. While this handbook is specific to your academic experience in the department, there are several other resources and offices graduate students are encouraged to consult during their tenure at Carnegie Me llon University. Information about The Word, Carnegie Mellon University Student Handbook , the Office of the Assistant Vice Provost for Graduate Education, the Office of the Dean of Student Affairs and others are included in Appendix A of this handbook. All policies not explicitly described in this document conform to School of Computer Science (SCS) policies and university policies described in The Word, Carnegie Mellon University Student Handbook and at the University Policies website",
        "retrieved_relevant_part": false,
        "model_answer": "The Master of Language Technologies (MLT)",
        "actual_answer": "Language Technologies Institute",
        "exact_match": false,
        "f1_max_min_avg": [
            0.44,
            0.44,
            0.44
        ],
        "recall_max_min_avg": [
            0.67,
            0.67,
            0.67
        ]
    },
    {
        "question": "Question: What technological innovation related to video cameras was showcased during Super Bowl XXXV?",
        "context": "Robotic video cameras, 2001When Baltimore Ravens quarterback Trent Dilfer dropped back to pass, TV viewers of Super Bowl XXXV saw something they\u2019d never seen before --- the motion froze and the view suddenly rotated to show Dilfer\u2019s opposite side. CBS called it Eyevision. The synchronized system of robotic cameras and advanced image processing was the brainchild of CMU\u2019s Takeo Kanade, one of many advances he pioneered in computer vision",
        "retrieved_doc": "17. Robotic video cameras, 2001When Baltimore Ravens quarterback Trent Dilfer dropped back to pass, TV viewers of Super Bowl XXXV saw something they\u2019d never seen before --- the motion froze and the view suddenly rotated to show Dilfer\u2019s opposite side. CBS called it Eyevision. The synchronized system of robotic cameras and advanced image processing was the brainchild of CMU\u2019s Takeo Kanade, one of many advances he pioneered in computer vision.|Spring offering: Course: 54521 Title: Video Media Design Senior Thesis Units: VAR Lec/Sec: Section A Days: To be announced Begin: 02:00PM End: 04:50PM Bldg/Room: DNM DNM Location: Pittsburgh, Pennsylvania Instructor(s): Ross, Shea, Levin |Fall offering: Course: 54993 Title: Video and Media Thesis Units: 9-21 Lec/Sec: Section D Days: To be announced Begin: 01:00PM End: 03:50PM Bldg/Room: TBA Location: Pittsburgh, Pennsylvania Instructor(s): Ross, Shea |Fall offering: Course: 49744 Title: Visual Communication for Innovators: Units: 6.0 Lec/Sec: Section A2 Days: Tuesday, Thursday Begin: 04:00PM End: 05:50PM Bldg/Room: CA 115 Location: Pittsburgh, Pennsylvania Instructor(s): Abovyan |Fall offering: Course: 54623 Title: Video Media Units: VAR Lec/Sec: Section L Days: Saturday Begin: 11:00AM End: 03:00PM Bldg/Room: TBA Location: Pittsburgh, Pennsylvania Instructor(s): Instructor TBA |23. Question-answering computers, 2011 Searching the Web for information is rarely as simple as asking a question in plain English. So-called \u201cquestion-answering\u201d machines moved from laboratories to TV screens when an IBM computer called \u201cWatson\u201d defeated two human champions on the game show \u201cJeopardy!\u201d At the heart of Watson was computer architecture developed by CMU\u2019s Eric Nyberg and his students.",
        "retrieved_relevant_part": false,
        "model_answer": "The motion froze and the view rotated to show Dilfer's opposite side, which was a new technological innovation not seen before in Super Bowl broadcasts",
        "actual_answer": "a synchronized system of robotic cameras and advanced image processing",
        "exact_match": false,
        "f1_max_min_avg": [
            0.11,
            0.11,
            0.11
        ],
        "recall_max_min_avg": [
            0.2,
            0.2,
            0.2
        ]
    },
    {
        "question": "What was developed at CMU's Robotics Institute in 2012 to improve traffic efficiency and reduce pollution?",
        "context": "Smart, adaptable traffic signals, 2012 Smart traffic lights developed at CMU\u2019s Robotics Institute are saving time and energy, and cutting down on the amount of air pollution created by idling cars. First rolled out in Pittsburgh\u2019s East Liberty neighborhood, the new signals are being studied around the country.",
        "retrieved_doc": "25. Smart, adaptable traffic signals, 2012 Smart traffic lights developed at CMU\u2019s Robotics Institute are saving time and energy, and cutting down on the amount of air pollution created by idling cars. First rolled out in Pittsburgh\u2019s East Liberty neighborhood, the new signals are being studied around the country.|18. Self-driving vehicles, 2007Carnegie Mellon\u2019s early attempts at self-driving vehicles progressed slowly, creeping around Pittsburgh\u2019s Schenley Park in the late 1990s. But they were going full-throttle by the time CMU\u2019s self-driving SUV, named BOSS, won the 2007 DARPA Urban Challenge road race.|April 12, 2024: Event Name: Annual MOBOT Races 12:00 PM-2:00 PMET Open to entire CMU community The School of Computer Science welcomes all members of the Carnegie Mellon community to participate in the annual Carnegie Mellon Mobot Races (\"MObile roBOTs\") along a slalom course. The competition provides participants an opportunity to demonstrate their technological creativity, while encouraging interdisciplinary teams to attack the challenges in the race course. Note: No registration required. No event fee. This event is open to the entire CMU community and their guests. |Sweepstakes. \"Our team's philosophy is to teach everyone how to do everything,\" Girdhar said. \"But I came to CMU wanting to drive. I wanted to drive so badly.\"    Amy Chen demonstrates how a driver is positioned inside of Boson, a Fringe buggy built|Fall offering: Course: 16362 Title: Mobile Robot Algorithms Laboratory Units: 12.0 Lec/Sec: Section A Days: Tuesday, Thursday Begin: 09:30AM End: 10:50AM Bldg/Room: NSH 3002 Location: Pittsburgh, Pennsylvania Instructor(s): Tabib, Goel |Spring offering: Course: 16761 Title: Mobile Robots Units: 12.0 Lec/Sec: Section A Days: Tuesday, Thursday Begin: 11:00AM End: 12:20PM Bldg/Room: TEP 1403 Location: Pittsburgh, Pennsylvania Instructor(s): Tabib ",
        "retrieved_relevant_part": false,
        "model_answer": "CMU's Robotics Institute in 2012 developed smart traffic lights to improve traffic efficiency and reduce pollution",
        "actual_answer": "Smart traffic lights",
        "exact_match": false,
        "f1_max_min_avg": [
            0.21,
            0.21,
            0.21
        ],
        "recall_max_min_avg": [
            0.67,
            0.67,
            0.67
        ]
    },
    {
        "question": "Who developed an encryption scheme that contributes to the safety of credit card numbers and other online data?",
        "context": "24. Encrypting online information, 2012 Credit card numbers and other data used online is safer thanks to an encryption scheme developed by CMU alumna Shafi Goldwasser (S\u201979). She shared the 2012 Turing Award for her role in developing practical encoding schemes that are difficult to break.",
        "retrieved_doc": "24. Encrypting online information, 2012 Credit card numbers and other data used online is safer thanks to an encryption scheme developed by CMU alumna Shafi Goldwasser (S\u201979). She shared the 2012 Turing Award for her role in developing practical encoding schemes that are difficult to break.|Spring offering: Course: 17606 Title: Privacy by Design Project Workshop Units: 6.0 Lec/Sec: Section A Days: To be announced Begin: 12:30PM End: 01:50PM Bldg/Room: DNM DNM Location: Pittsburgh, Pennsylvania Instructor(s): Habib |16. CAPTCHAs, 2000 \u201cSpam\u201d and malicious attacks were a growing problem on the Internet when hackers developed automated \u201cbots\u201d that could sign up for email and other Web services without human intervention. Luis von Ahn (CS\u201903,\u201905), Nick Hopper (CS\u201904), John Langford (CS\u201902) and CMU professor Manuel Blum invented a \u201cCompletely Automated Public Turing Test to tell Computers and Humans Apart,\u201d or CAPTCHA, to help foil the bots. A later variation, reCAPTCHA, is helping digitize old books and newspapers.|Spring offering: Course: 17735 Title: Engineering Privacy in Software Units: 12.0 Lec/Sec: Section B Days: Tuesday, Thursday Begin: 11:00AM End: 12:20PM Bldg/Room: DNM DNM Location: Pittsburgh, Pennsylvania Instructor(s): Habib |Spring offering: Course: 94806 Title: Privacy in the Digital Age Units: 6.0 Lec/Sec: Section Z3 Days: To be announced Begin: 02:00PM End: 03:20PM Bldg/Room: DNM DNM Location: Pittsburgh, Pennsylvania Instructor(s): Acquisti |Fall offering: Course: 17606 Title: Privacy by Design Project Workshop Units: 6.0 Lec/Sec: Section A Days: Tuesday Begin: 11:00AM End: 12:20PM Bldg/Room: POS 147 Location: Pittsburgh, Pennsylvania Instructor(s): Habib ",
        "retrieved_relevant_part": true,
        "model_answer": "CMU alumnna Shafi Goldwaser developed an encryption scheme for online data",
        "actual_answer": "CMU alumna Shafi Goldwasser",
        "exact_match": false,
        "f1_max_min_avg": [
            0.27,
            0.27,
            0.27
        ],
        "recall_max_min_avg": [
            0.5,
            0.5,
            0.5
        ]
    },
    {
        "question": "Who developed the computer architecture at the heart of IBM's Watson?",
        "context": "23. Question-answering computers, 2011 Searching the Web for information is rarely as simple as asking a question in plain English. So-called \u201cquestion-answering\u201d machines moved from laboratories to TV screens when an IBM computer called \u201cWatson\u201d defeated two human champions on the game show \u201cJeopardy!\u201d At the heart of Watson was computer architecture developed by CMU\u2019s Eric Nyberg and his students",
        "retrieved_doc": "23. Question-answering computers, 2011 Searching the Web for information is rarely as simple as asking a question in plain English. So-called \u201cquestion-answering\u201d machines moved from laboratories to TV screens when an IBM computer called \u201cWatson\u201d defeated two human champions on the game show \u201cJeopardy!\u201d At the heart of Watson was computer architecture developed by CMU\u2019s Eric Nyberg and his students.|11. Computer chess, 1990Could a computer play chess at the level of the world\u2019s best players? For many years, it was considered the \u201choly grail\u201d of artificial intelligence. Hitech, developed by CMU researcher Hans Berliner (CS\u201974), was the first computer to achieve grandmaster status. CMU alumni played key roles in developing \u201cDeep Blue,\u201d the IBM machine that beat human chess champion Garry Kasparov in 1997.|2. Multi-core processors, 1971\u00a0Multi-core processors are common in today\u2019s computers, but they were still science fiction in the early 1970s. But when CMU researchers found their existing machines too slow to keep pace with the advance of speech and graphics programs, they knew they had to do something. They solved the problem by ganging together 16 processors to build a pioneering computer called C.mmp\u2014then topped the feat by linking 50 processors into Cm*.|What\u2019s so great about computer science at Carnegie Mellon?We're glad you asked! Here are 25 great ideas from CMU computer scientists to think about as we celebrate the birthday of the School of Computer Science.1. Artificial intelligence, 1955-56\u00a0Can you write a working computer program without a computer? Herb Simon (H\u201990), at left, Allen Newell (IA\u201957), at right, and Cliff Shaw did. The team created the first artificial intelligence program, Logic Theorist, which could solve logic puzzles in the same way that a human might solve them. Newell demonstrated that it worked by writing the instructions on 3-by-5 index cards that were manipulated on the kitchen table by Newell, his wife, and a group of Carnegie Tech grad students.|Author: Emma Strubell Title: Power Hungry Processing: Watts Driving the Cost of AI Deployment? Publication year: 2023 Coauthors: A. Luccioni, Yacine Jernite, Emma Strubell Abstract: Recent years have seen a surge in the popularity of commercial AI products based on generative, multi-purpose AI systems promising a unified approach to building machine learning (ML) models into technology. However, this ambition of\"generality\"comes at a steep cost to the environment, given the amount of energy these systems require and the amount of carbon that they emit. In this work, we propose the first systematic comparison of the ongoing inference cost of various categories of ML systems, covering both task-specific (i.e. finetuned models that carry out a single task) and `general-purpose' models, (i.e. those trained for multiple tasks). We measure deployment cost as the amount of energy and carbon required to perform 1,000 inferences on representative benchmark dataset using these models. We find that multi-purpose, generative architectures are orders of magnitude more expensive than task-specific systems for a variety of tasks, even when controlling for the number of model parameters. We conclude with a discussion around the current trend of deploying multi-purpose generative ML systems, and caution that their utility should be more intentionally weighed against increased costs in terms of energy and emissions. All the data from our study can be accessed via an interactive demo to carry out further exploration and analysis.|6. Andrew project, 1982It was long the dream of computer scientists to put a workstation in every home and office, but no one had actually tried to accomplish it until researchers from Carnegie Mellon University and IBM launched the Andrew Project. Soon, every student, faculty member and employee had access to email, word processing, file-transfer services and graphics programs, and CMU was the most-wired campus in the world.",
        "retrieved_relevant_part": false,
        "model_answer": "Carnegie Mellon University (CMU)",
        "actual_answer": "Eric Nyberg and his students",
        "exact_match": false,
        "f1_max_min_avg": [
            0,
            0,
            0.0
        ],
        "recall_max_min_avg": [
            0,
            0,
            0.0
        ]
    },
    {
        "question": "Which institutions were involved in developing the videogame EteRNA?",
        "context": "21. RNA sequencing via videogames, 2010 Thanks to crowdsourcing, science isn\u2019t just for scientists any more. People without formal training in molecular biology are producing new insights into genetic encoding through a videogame called EteRNA, developed by researchers at CMU and Stanford, that allows players to fold and shift RNA molecules to solve on-screen puzzles.",
        "retrieved_doc": "21. RNA sequencing via videogames, 2010 Thanks to crowdsourcing, science isn\u2019t just for scientists any more. People without formal training in molecular biology are producing new insights into genetic encoding through a videogame called EteRNA, developed by researchers at CMU and Stanford, that allows players to fold and shift RNA molecules to solve on-screen puzzles.|Fall offering: Course: 60418 Title: Advanced ETB: Experimental Game Design: Units: 10.0 Lec/Sec: Section A Days: Tuesday, Thursday Begin: 02:00PM End: 04:50PM Bldg/Room: CFA 318 Location: Pittsburgh, Pennsylvania Instructor(s): Washko |Fall offering: Course: 53741 Title: Distributed Game Studio - Game Art Pipeline Units: 12.0 Lec/Sec: Section A Days: Tuesday, Thursday Begin: 11:00AM End: 12:20PM Bldg/Room: HL 106C Location: Pittsburgh, Pennsylvania Instructor(s): Corbett, Washington |Fall offering: Course: 53341 Title: Distributed Game Studio - Game Art Pipeline Units: 12.0 Lec/Sec: Section A Days: Tuesday, Thursday Begin: 11:00AM End: 12:20PM Bldg/Room: HL 106C Location: Pittsburgh, Pennsylvania Instructor(s): Washington, Corbett |Fall offering: Course: 53751 Title: Research Issues in Game Development: Designing for XR Units: 12.0 Lec/Sec: Section A Days: Monday, Wednesday, Friday Begin: 09:30AM End: 10:50AM Bldg/Room: HL 106B Location: Pittsburgh, Pennsylvania Instructor(s): Corbett |Spring offering: Course: 93860 Title: What Makes Us Play: The Craft of the Video Game Units: 4.0 Lec/Sec: Section L Days: To be announced Begin: 12:30PM End: 01:50PM Bldg/Room: DNM DNM Location: Los Angeles, California Instructor(s): Platz ",
        "retrieved_relevant_part": true,
        "model_answer": "The game was developed by researchers at Carnegie Mellon University and Stanford",
        "actual_answer": "CMU and Stanford University",
        "exact_match": false,
        "f1_max_min_avg": [
            0.38,
            0.38,
            0.38
        ],
        "recall_max_min_avg": [
            0.75,
            0.75,
            0.75
        ]
    },
    {
        "question": "What does CAPTCHA stand for?",
        "context": "16. CAPTCHAs, 2000 \u201cSpam\u201d and malicious attacks were a growing problem on the Internet when hackers developed automated \u201cbots\u201d that could sign up for email and other Web services without human intervention. Luis von Ahn (CS\u201903,\u201905), Nick Hopper (CS\u201904), John Langford (CS\u201902) and CMU professor Manuel Blum invented a \u201cCompletely Automated Public Turing Test to tell Computers and Humans Apart,\u201d or CAPTCHA, to help foil the bots. A later variation, reCAPTCHA, is helping digitize old books and newspapers.",
        "retrieved_doc": "16. CAPTCHAs, 2000 \u201cSpam\u201d and malicious attacks were a growing problem on the Internet when hackers developed automated \u201cbots\u201d that could sign up for email and other Web services without human intervention. Luis von Ahn (CS\u201903,\u201905), Nick Hopper (CS\u201904), John Langford (CS\u201902) and CMU professor Manuel Blum invented a \u201cCompletely Automated Public Turing Test to tell Computers and Humans Apart,\u201d or CAPTCHA, to help foil the bots. A later variation, reCAPTCHA, is helping digitize old books and newspapers.|Author: Daphne Ippolito Title: Effective Prompt Extraction from Language Models Publication year: 2023 Coauthors: Yiming Zhang, Daphne Ippolito Abstract: The text generated by large language models is commonly controlled by prompting, where a prompt prepended to a user's query guides the model's output. The prompts used by companies to guide their models are often treated as secrets, to be hidden from the user making the query. They have even been treated as commodities to be bought and sold. However, anecdotal reports have shown adversarial users employing prompt extraction attacks to recover these prompts. In this paper, we present a framework for systematically measuring the effectiveness of these attacks. In experiments with 3 different sources of prompts and 11 underlying large language models, we find that simple text-based attacks can in fact reveal prompts with high probability. Our framework determines with high precision whether an extracted prompt is the actual secret prompt, rather than a model hallucination. Prompt extraction experiments on real systems such as Bing Chat and ChatGPT suggest that system prompts can be revealed by an adversary despite existing defenses in place.|Author: A. Waibel Title: AdapITN: A Fast, Reliable, and Dynamic Adaptive Inverse Text Normalization Publication year: 2023 Coauthors: T. Nguyen, Le Duc Minh Nhat, Quang Minh Nguyen, Quoc Truong Do, C. Luong, A. Waibel Abstract: Inverse text normalization (ITN) is the task that transforms text in spoken-form into written-form. While automatic speech recognition (ASR) produces text in spoken-form, human and natural language understanding systems prefer to consume text in written-form. ITN generally deals with semiotic phrases (e.g., numbers, date, time). However, lack of studies to deal with phonetization phrases, which is ASR\u2019s output when it handles unseen data (e.g., foreign-named entities, domain names), although these exist in the same form in the spoken-form text. The reason is that phonetization phrases are infinite patterns and language-dependent. In this study, we introduce a novel end2end model that can handle both semiotic phrases (SEP) and phonetization phrases (PHP), named AdapITN. We call it \"Adap\" because it allows for handling unseen PHP. The model performs only when necessary by providing a mechanism to narrow normalized regions and external query knowledge, reducing the runtime significantly.|Author: Daniel Fried Title: SantaCoder: don't reach for the stars! Publication year: 2023 Coauthors: Loubna Ben Allal, Raymond Li, Denis Kocetkov, Chenghao Mou, Christopher Akiki, Carlos Mu\u00f1oz Ferrandis, Niklas Muennighoff, Mayank Mishra, A. Gu, Manan Dey, Logesh Kumar Umapathi, Carolyn Jane Anderson, Yangtian Zi, J. Poirier, Hailey Schoelkopf, S. Troshin, Dmitry Abulkhanov, M. Romero, M. Lappert, F. Toni, Bernardo Garc'ia del R'io, Qian Liu, Shamik Bose, Urvashi Bhattacharyya, Terry Yue Zhuo, I. Yu, Paulo Villegas, Marco Zocca, Sourab Mangrulkar, D. Lansky, Huu Nguyen, Danish Contractor, Luisa Villa, Jia Li, Dzmitry Bahdanau, Yacine Jernite, S. Hughes, Daniel Fried, Arjun Guha, Harm de Vries, Leandro von Werra Abstract: The BigCode project is an open-scientific collaboration working on the responsible development of large language models for code. This tech report describes the progress of the collaboration until December 2022, outlining the current state of the Personally Identifiable Information (PII) redaction pipeline, the experiments conducted to de-risk the model architecture, and the experiments investigating better preprocessing methods for the training data. We train 1.1B parameter models on the Java, JavaScript, and Python subsets of The Stack and evaluate them on the MultiPL-E text-to-code benchmark. We find that more aggressive filtering of near-duplicates can further boost performance and, surprisingly, that selecting files from repositories with 5+ GitHub stars deteriorates performance significantly. Our best model outperforms previous open-source multilingual code generation models (InCoder-6.7B and CodeGen-Multi-2.7B) in both left-to-right generation and infilling on the Java, JavaScript, and Python portions of MultiPL-E, despite being a substantially smaller model. All models are released under an OpenRAIL license at https://hf.co/bigcode.|Author: Chenyan Xiong Title: MARVEL: Unlocking the Multi-Modal Capability of Dense Retrieval via Visual Module Plugin Publication year: 2023 Coauthors: Tianshuo Zhou, Senkun Mei, Xinze Li, Zhenghao Liu, Chenyan Xiong, Zhiyuan Liu, Yu Gu, Ge Yu Abstract: This paper proposes Multi-modAl Retrieval model via Visual modulE pLugin (MARVEL), which learns an embedding space for queries and multi-modal documents to conduct retrieval. MARVEL encodes queries and multi-modal documents with a unified encoder model, which helps to alleviate the modality gap between images and texts. Specifically, we enable the image understanding ability of the well-trained dense retriever, T5-ANCE, by incorporating the visual module's encoded image features as its inputs. To facilitate the multi-modal retrieval tasks, we build the ClueWeb22-MM dataset based on the ClueWeb22 dataset, which regards anchor texts as queries, and exacts the related text and image documents from anchor-linked web pages. Our experiments show that MARVEL significantly outperforms the state-of-the-art methods on the multi-modal retrieval dataset WebQA and ClueWeb22-MM. MARVEL provides an opportunity to broaden the advantages of text retrieval to the multi-model scenario. Besides, we also illustrate that the language model has the ability to extract image semantics and partly map the image features to the input word embedding space. All codes are available at https://github.com/OpenMatch/MARVEL.|Author: Daniel Fried Title: AutoReply: Detecting Nonsense in Dialogue with Discriminative Replies Publication year: 2023 Coauthors: Weiyan Shi, Emily Dinan, Adi Renduchintala, Daniel Fried, Athul Paul Jacob, Zhou Yu, Mike Lewis ",
        "retrieved_relevant_part": true,
        "model_answer": "CAPTCHA stands for \"Computer and Human.\"",
        "actual_answer": "Completely Automated Public Turing test to tell Computers and Humans Apart",
        "exact_match": false,
        "f1_max_min_avg": [
            0.12,
            0.12,
            0.12
        ],
        "recall_max_min_avg": [
            0.09,
            0.09,
            0.09
        ]
    },
    {
        "question": "What was considered the holy grail of artificial intelligence in the context of chess?",
        "context": "11. Computer chess, 1990Could a computer play chess at the level of the world\u2019s best players? For many years, it was considered the \u201choly grail\u201d of artificial intelligence. Hitech, developed by CMU researcher Hans Berliner (CS\u201974), was the first computer to achieve grandmaster status. CMU alumni played key roles in developing \u201cDeep Blue,\u201d the IBM machine that beat human chess champion Garry Kasparov in 1997.",
        "retrieved_doc": "11. Computer chess, 1990Could a computer play chess at the level of the world\u2019s best players? For many years, it was considered the \u201choly grail\u201d of artificial intelligence. Hitech, developed by CMU researcher Hans Berliner (CS\u201974), was the first computer to achieve grandmaster status. CMU alumni played key roles in developing \u201cDeep Blue,\u201d the IBM machine that beat human chess champion Garry Kasparov in 1997.|Author: Yonatan Bisk Title: SPRING: Studying the Paper and Reasoning to Play Games Publication year: 2023 Coauthors: Yue Wu, So Yeon Min, Shrimai Prabhumoye, Yonatan Bisk, R. Salakhutdinov, A. Azaria, Tom M. Mitchell, Yuan-Fang Li Abstract: Open-world survival games pose significant challenges for AI algorithms due to their multi-tasking, deep exploration, and goal prioritization requirements. Despite reinforcement learning (RL) being popular for solving games, its high sample complexity limits its effectiveness in complex open-world games like Crafter or Minecraft. We propose a novel approach, SPRING, to read the game's original academic paper and use the knowledge learned to reason and play the game through a large language model (LLM). Prompted with the LaTeX source as game context and a description of the agent's current observation, our SPRING framework employs a directed acyclic graph (DAG) with game-related questions as nodes and dependencies as edges. We identify the optimal action to take in the environment by traversing the DAG and calculating LLM responses for each node in topological order, with the LLM's answer to final node directly translating to environment actions. In our experiments, we study the quality of in-context\"reasoning\"induced by different forms of prompts under the setting of the Crafter open-world environment. Our experiments suggest that LLMs, when prompted with consistent chain-of-thought, have great potential in completing sophisticated high-level trajectories. Quantitatively, SPRING with GPT-4 outperforms all state-of-the-art RL baselines, trained for 1M steps, without any training. Finally, we show the potential of games as a test bed for LLMs.|Author: Graham Neubig Title: SOTOPIA: Interactive Evaluation for Social Intelligence in Language Agents Publication year: 2023 Coauthors: Xuhui Zhou, Hao Zhu, Leena Mathur, Ruohong Zhang, Haofei Yu, Zhengyang Qi, Louis-Philippe Morency, Yonatan Bisk, Daniel Fried, Graham Neubig, Maarten Sap Abstract: Humans are social beings; we pursue social goals in our daily interactions, which is a crucial aspect of social intelligence. Yet, AI systems' abilities in this realm remain elusive. We present SOTOPIA, an open-ended environment to simulate complex social interactions between artificial agents and evaluate their social intelligence. In our environment, agents role-play and interact under a wide variety of scenarios; they coordinate, collaborate, exchange, and compete with each other to achieve complex social goals. We simulate the role-play interaction between LLM-based agents and humans within this task space and evaluate their performance with a holistic evaluation framework called SOTOPIA-Eval. With SOTOPIA, we find significant differences between these models in terms of their social intelligence, and we identify a subset of SOTOPIA scenarios, SOTOPIA-hard, that is generally challenging for all models. We find that on this subset, GPT-4 achieves a significantly lower goal completion rate than humans and struggles to exhibit social commonsense reasoning and strategic communication skills. These findings demonstrate SOTOPIA's promise as a general platform for research on evaluating and improving social intelligence in artificial agents.|Author: Graham Neubig Title: EXCALIBUR: Encouraging and Evaluating Embodied Exploration Publication year: 2023 Coauthors: Hao Zhu, Raghav Kapoor, So Yeon Min, Winson Han, Jiatai Li, Kaiwen Geng, Graham Neubig, Yonatan Bisk, Aniruddha Kembhavi, Luca Weihs Abstract: Experience precedes understanding. Humans constantly explore and learn about their environment out of curiosity, gather information, and update their models of the world. On the other hand, machines are either trained to learn passively from static and fixed datasets, or taught to complete specific goal-conditioned tasks. To encourage the development of exploratory interactive agents, we present the EXCALIBUR benchmark. EXCALIBUR allows agents to explore their environment for long durations and then query their understanding of the physical world via inquiries like: \u201cis the small heavy red bowl made from glass?\u201d or \u201cis there a silver spoon heavier than the egg?\u201d. This design encourages agents to perform free-form home exploration without myopia induced by goal conditioning. Once the agents have answered a series of questions, they can renter the scene to refine their knowledge, update their beliefs, and improve their performance on the questions. Our experiments demonstrate the challenges posed by this dataset for the present-day state-of-the-art embodied systems and the headroom afforded to develop new innovative methods. Finally, we present a virtual reality interface that enables humans to seamlessly interact within the simulated world and use it to gather human performance measures. EXCALIBUR affords unique challenges in comparison to presentday benchmarks and represents the next frontier for embodied AI research.|Author: Graham Neubig Title: WebArena: A Realistic Web Environment for Building Autonomous Agents Publication year: 2023 Coauthors: Shuyan Zhou, Frank F. Xu, Hao Zhu, Xuhui Zhou, Robert Lo, Abishek Sridhar, Xianyi Cheng, Yonatan Bisk, Daniel Fried, Uri Alon, Graham Neubig Abstract: With advances in generative AI, there is now potential for autonomous agents to manage daily tasks via natural language commands. However, current agents are primarily created and tested in simplified synthetic environments, leading to a disconnect with real-world scenarios. In this paper, we build an environment for language-guided agents that is highly realistic and reproducible. Specifically, we focus on agents that perform tasks on the web, and create an environment with fully functional websites from four common domains: e-commerce, social forum discussions, collaborative software development, and content management. Our environment is enriched with tools (e.g., a map) and external knowledge bases (e.g., user manuals) to encourage human-like task-solving. Building upon our environment, we release a set of benchmark tasks focusing on evaluating the functional correctness of task completions. The tasks in our benchmark are diverse, long-horizon, and designed to emulate tasks that humans routinely perform on the internet. We experiment with several baseline agents, integrating recent techniques such as reasoning before acting. The results demonstrate that solving complex tasks is challenging: our best GPT-4-based agent only achieves an end-to-end task success rate of 14.41%, significantly lower than the human performance of 78.24%. These results highlight the need for further development of robust agents, that current state-of-the-art large language models are far from perfect performance in these real-life tasks, and that WebArena can be used to measure such progress.|What\u2019s so great about computer science at Carnegie Mellon?We're glad you asked! Here are 25 great ideas from CMU computer scientists to think about as we celebrate the birthday of the School of Computer Science.1. Artificial intelligence, 1955-56\u00a0Can you write a working computer program without a computer? Herb Simon (H\u201990), at left, Allen Newell (IA\u201957), at right, and Cliff Shaw did. The team created the first artificial intelligence program, Logic Theorist, which could solve logic puzzles in the same way that a human might solve them. Newell demonstrated that it worked by writing the instructions on 3-by-5 index cards that were manipulated on the kitchen table by Newell, his wife, and a group of Carnegie Tech grad students.",
        "retrieved_relevant_part": true,
        "model_answer": "Achieving grandmaster-level performance improvements in computer chess",
        "actual_answer": "computer play chess at the level of the world's best players",
        "exact_match": false,
        "f1_max_min_avg": [
            0.22,
            0.22,
            0.22
        ],
        "recall_max_min_avg": [
            0.18,
            0.18,
            0.18
        ]
    },
    {
        "question": "Who developed Hitech, the first computer to achieve grandmaster status in chess?",
        "context": "11. Computer chess, 1990Could a computer play chess at the level of the world\u2019s best players? For many years, it was considered the \u201choly grail\u201d of artificial intelligence. Hitech, developed by CMU researcher Hans Berliner (CS\u201974), was the first computer to achieve grandmaster status. CMU alumni played key roles in developing \u201cDeep Blue,\u201d the IBM machine that beat human chess champion Garry Kasparov in 1997.",
        "retrieved_doc": "11. Computer chess, 1990Could a computer play chess at the level of the world\u2019s best players? For many years, it was considered the \u201choly grail\u201d of artificial intelligence. Hitech, developed by CMU researcher Hans Berliner (CS\u201974), was the first computer to achieve grandmaster status. CMU alumni played key roles in developing \u201cDeep Blue,\u201d the IBM machine that beat human chess champion Garry Kasparov in 1997.| \nTuring Awards and a Nobel Prize\n\nIn 1975, Simon and Newell were awarded the A.M. Turing Award for their work in artificial intelligence. (As of 2014, 12 CMU alumni or faculty have been awarded Turings, sometimes considered the Nobel Prize of computing.) Three years later, Simon received the Nobel Prize in Economics for his work on decision-making theory. As the 1970s progressed, Newell became interested in human-computer interaction, and began a long relationship with Xerox\u2019s Palo Alto Research Center, or PARC, which released the Xerox Alto in 1973. Considered a forerunner to many of the computing environments that followed, Alto featured a graphical-user interface and was among the first commercially available workstations controlled with a mouse. Inspired by Alto, Reddy launched a drive for development of CMU\u2019s own \u201cthree-M\u201d machine\u2014a personal workstation with a megabyte of memory, a megapixel display and at least one million instructions per second of processing power.\n|23. Question-answering computers, 2011 Searching the Web for information is rarely as simple as asking a question in plain English. So-called \u201cquestion-answering\u201d machines moved from laboratories to TV screens when an IBM computer called \u201cWatson\u201d defeated two human champions on the game show \u201cJeopardy!\u201d At the heart of Watson was computer architecture developed by CMU\u2019s Eric Nyberg and his students.|What\u2019s so great about computer science at Carnegie Mellon?We're glad you asked! Here are 25 great ideas from CMU computer scientists to think about as we celebrate the birthday of the School of Computer Science.1. Artificial intelligence, 1955-56\u00a0Can you write a working computer program without a computer? Herb Simon (H\u201990), at left, Allen Newell (IA\u201957), at right, and Cliff Shaw did. The team created the first artificial intelligence program, Logic Theorist, which could solve logic puzzles in the same way that a human might solve them. Newell demonstrated that it worked by writing the instructions on 3-by-5 index cards that were manipulated on the kitchen table by Newell, his wife, and a group of Carnegie Tech grad students.|the 20th century brought unprecedented growth to Carnegie Tech. In 1956, the arrival of the first IBM computer to campus was revolutionary, initiating a university culture where information technology pervaded virtually all areas of study.|public sector. 1986:\u00a0School of Computer Science, pioneering computing and artificial intelligence, led by interdisciplinary efforts of Allen Newell and Herbert Simon.    Carnegie Mellon University  In 1967, Carnegie Tech merged with the Mellon",
        "retrieved_relevant_part": true,
        "model_answer": "Hitech was developed by Carnegie Mellon University researcher Hans Berliner",
        "actual_answer": "CMU researcher Hans Berliner",
        "exact_match": false,
        "f1_max_min_avg": [
            0.43,
            0.43,
            0.43
        ],
        "recall_max_min_avg": [
            0.75,
            0.75,
            0.75
        ]
    },
    {
        "question": "Who developed Java?",
        "context": "12. Java, 1991 As a CMU grad student, James Gosling (CS\u201983) worked on the Andrew project, which stressed interoperability between computers, whether they were Macs, IBMs or Unix machines. Those lessons served Gosling well when he developed Java, the first programming language able to run on almost any platform.",
        "retrieved_doc": "12. Java, 1991 As a CMU grad student, James Gosling (CS\u201983) worked on the Andrew project, which stressed interoperability between computers, whether they were Macs, IBMs or Unix machines. Those lessons served Gosling well when he developed Java, the first programming language able to run on almost any platform.|Fall offering: Course: 17681 Title: Java for Application Programmers Units: 6.0 Lec/Sec: Section A1 Days: Tuesday, Thursday Begin: 03:30PM End: 04:50PM Bldg/Room: WEH 7500 Location: Pittsburgh, Pennsylvania Instructor(s): Lee |11. Computer chess, 1990Could a computer play chess at the level of the world\u2019s best players? For many years, it was considered the \u201choly grail\u201d of artificial intelligence. Hitech, developed by CMU researcher Hans Berliner (CS\u201974), was the first computer to achieve grandmaster status. CMU alumni played key roles in developing \u201cDeep Blue,\u201d the IBM machine that beat human chess champion Garry Kasparov in 1997.|What\u2019s so great about computer science at Carnegie Mellon?We're glad you asked! Here are 25 great ideas from CMU computer scientists to think about as we celebrate the birthday of the School of Computer Science.1. Artificial intelligence, 1955-56\u00a0Can you write a working computer program without a computer? Herb Simon (H\u201990), at left, Allen Newell (IA\u201957), at right, and Cliff Shaw did. The team created the first artificial intelligence program, Logic Theorist, which could solve logic puzzles in the same way that a human might solve them. Newell demonstrated that it worked by writing the instructions on 3-by-5 index cards that were manipulated on the kitchen table by Newell, his wife, and a group of Carnegie Tech grad students.|Author: Daniel Fried Title: SantaCoder: don't reach for the stars! Publication year: 2023 Coauthors: Loubna Ben Allal, Raymond Li, Denis Kocetkov, Chenghao Mou, Christopher Akiki, Carlos Mu\u00f1oz Ferrandis, Niklas Muennighoff, Mayank Mishra, A. Gu, Manan Dey, Logesh Kumar Umapathi, Carolyn Jane Anderson, Yangtian Zi, J. Poirier, Hailey Schoelkopf, S. Troshin, Dmitry Abulkhanov, M. Romero, M. Lappert, F. Toni, Bernardo Garc'ia del R'io, Qian Liu, Shamik Bose, Urvashi Bhattacharyya, Terry Yue Zhuo, I. Yu, Paulo Villegas, Marco Zocca, Sourab Mangrulkar, D. Lansky, Huu Nguyen, Danish Contractor, Luisa Villa, Jia Li, Dzmitry Bahdanau, Yacine Jernite, S. Hughes, Daniel Fried, Arjun Guha, Harm de Vries, Leandro von Werra Abstract: The BigCode project is an open-scientific collaboration working on the responsible development of large language models for code. This tech report describes the progress of the collaboration until December 2022, outlining the current state of the Personally Identifiable Information (PII) redaction pipeline, the experiments conducted to de-risk the model architecture, and the experiments investigating better preprocessing methods for the training data. We train 1.1B parameter models on the Java, JavaScript, and Python subsets of The Stack and evaluate them on the MultiPL-E text-to-code benchmark. We find that more aggressive filtering of near-duplicates can further boost performance and, surprisingly, that selecting files from repositories with 5+ GitHub stars deteriorates performance significantly. Our best model outperforms previous open-source multilingual code generation models (InCoder-6.7B and CodeGen-Multi-2.7B) in both left-to-right generation and infilling on the Java, JavaScript, and Python portions of MultiPL-E, despite being a substantially smaller model. All models are released under an OpenRAIL license at https://hf.co/bigcode.|Author: Jamie Callan Title: Multi-Objective Improvement of Android Applications Publication year: 2023 Coauthors: Jamie Callan, J. Petke Abstract: Non-functional properties, such as runtime or memory use, are important to mobile app users and developers, as they affect user experience. Previous work on automated improvement of non-functional properties in mobile apps failed to address the inherent trade-offs between such properties. We propose a practical approach and the first open-source tool, GIDroid (2023), for multi-objective automated improvement of Android apps. In particular, we use Genetic improvement, a search-based technique that navigates the space of software variants to find improved software. We use a simulation-based testing framework to greatly improve the speed of search. GIDroid contains three state-of-the-art multi-objective algorithms, and two new mutation operators, which cache the results of method calls. Genetic improvement relies on testing to validate patches. Previous work showed that tests in open-source Android applications are scarce. We thus wrote tests for 21 versions of 7 Android apps, creating a new benchmark for performance improvements. We used GIDroid to improve versions of mobile apps where developers had previously found improvements to runtime, memory, and bandwidth use. Our technique automatically re-discovers 64% of existing improvements. We then applied our approach to current versions of software in which there were no known improvements. We were able to improve execution time by up to 35%, and memory use by up to 33% in these apps.",
        "retrieved_relevant_part": true,
        "model_answer": "Jamie Callan developed Java",
        "actual_answer": "James Gosling",
        "exact_match": false,
        "f1_max_min_avg": [
            0,
            0,
            0.0
        ],
        "recall_max_min_avg": [
            0,
            0,
            0.0
        ]
    },
    {
        "question": "What was the name of the computer that CMU researchers built by linking 50 processors?",
        "context": "2. Multi-core processors, 1971\u00a0Multi-core processors are common in today\u2019s computers, but they were still science fiction in the early 1970s. But when CMU researchers found their existing machines too slow to keep pace with the advance of speech and graphics programs, they knew they had to do something. They solved the problem by ganging together 16 processors to build a pioneering computer called C.mmp\u2014then topped the feat by linking 50 processors into Cm*.",
        "retrieved_doc": "2. Multi-core processors, 1971\u00a0Multi-core processors are common in today\u2019s computers, but they were still science fiction in the early 1970s. But when CMU researchers found their existing machines too slow to keep pace with the advance of speech and graphics programs, they knew they had to do something. They solved the problem by ganging together 16 processors to build a pioneering computer called C.mmp\u2014then topped the feat by linking 50 processors into Cm*.| \nMulti-processor machines emerge\n\nCSD emerged from the brief crisis as a highly agile, interdisciplinary entity, with many new faculty members taking joint appointments with other CMU departments. Several large projects emerged in the Computer Science Department, including C.mmp, the first shared-memory multiprocessor computer, with 16 processing units, and Cm*, a 50-processor computer. These computers were the forerunners of today\u2019s ubiquitous multi-core desktops and laptops.\n|6. Andrew project, 1982It was long the dream of computer scientists to put a workstation in every home and office, but no one had actually tried to accomplish it until researchers from Carnegie Mellon University and IBM launched the Andrew Project. Soon, every student, faculty member and employee had access to email, word processing, file-transfer services and graphics programs, and CMU was the most-wired campus in the world.| \nThe best-wired campus in the world\n\nWorking with IBM in the early 1980s, the university and the Computer Science Department established another new research frontier: Development of a high-speed computer network that would reach virtually every room on campus, along with a GUI-based computing environment, and providing networked PCs or workstations for 7,000 students, faculty members and employees. Called the Andrew Project, it turned Carnegie Mellon into the best-connected, most-wired university in the world\u2014a process Newell called \u201cgreening up the campus with computer science.\u201d CMU also became home to a new Software Engineering Institute, funded by the Defense Department, to study computer security and develop best practices in the design of operating systems. Between 1982 and 1985, the amount of sponsored research in the Computer Science Department doubled, from $7.2 million to $15.3 million\u2014more than the other four departments in the Mellon College of Science combined\n|What\u2019s so great about computer science at Carnegie Mellon?We're glad you asked! Here are 25 great ideas from CMU computer scientists to think about as we celebrate the birthday of the School of Computer Science.1. Artificial intelligence, 1955-56\u00a0Can you write a working computer program without a computer? Herb Simon (H\u201990), at left, Allen Newell (IA\u201957), at right, and Cliff Shaw did. The team created the first artificial intelligence program, Logic Theorist, which could solve logic puzzles in the same way that a human might solve them. Newell demonstrated that it worked by writing the instructions on 3-by-5 index cards that were manipulated on the kitchen table by Newell, his wife, and a group of Carnegie Tech grad students.|Carnegie Mellon University has been a birthplace  of innovation since its founding in 1900. Today, CMU is a global leader bringing groundbreaking  ideas to market and creating successful startup  businesses. Our award-winning faculty are renowned for  working closely with students to solve major scientific,  technological and societal challenges. We put a strong  emphasis on creating things \u2014 from art to robots. We  have become a model for economic development in  forming partnerships with companies such as Uber,  Google and Disney. Our students are recruited by some  of the world\u2019s most innovative companies. MANAGEMENT  INFORMATION  SYSTEMS U.S. News & World Report, 2022#1 ARTIFICIAL  INTELLIGENCE U.S. News & World Report, 2022#1 AMONG U.S.   UNIVERSITIES Times Higher Education   World University  Ranking, 2023#19SOFTWARE  ENGINEERING U.S. News & World Report, 2022COLLEGE OF  ENGINEERING U.S. News & World Report, 2022#1 #4#1SCHOOL OF  COMPUTER  SCIENCE U.S. News & World Report, 2022 UNIVERSITY   IN THE WORLD Times Higher Education   World University   Ranking, 2023#28TIME-BASED/   NEW MEDIA U.S. News & World Report, 2019#11,529   FACULTY16,779   STUDENTSGraduate Undergraduate 117,257  ALUMNI (LIVING) 85%  U.S. 15%  International35%  U.S. 65%  International 76%  U.S. 24%  InternationalGLOBAL COMMUNITY Students representing 126 countries Faculty representing 56 countries Alumni representing  148 countries OF COMPUTER  SCIENCE\u2019S FIRST- YEAR STUDENTS   WERE WOMEN   IN 2019 Nearly triple the   national average\u201c My Heart is in the Work. \u201d    Andrew Carnegie, Founder    November 15, 1900 49.8 % 87%  U.S. 13%  InternationalSCHOOLS AND COLLEGES College of Engineering  College of Fine Arts Dietrich College of Humanities   and Social Sciences Heinz College of Information Systems  and Public Policy Mellon College of Science School of Computer Science Tepper School of Business cmu.edu/assets/pdfs/cmu-fact-sheet.pdf    |   cmu.edu/about/awards.htmlMarch 2020BIG IDEAS THAT SHAPE YOUR WORLD START HERE 1,000+ companies greenlighted  across the U.S. and internationally  Cognitive tutors,  which improve  the math skills of 500,000+  students each year  The first U.S. school to award   a degree in drama  in 1914 James Gosling (SCS 1983)  invented the Java computer  programming language . The first exclusive higher  education partner of the Tony  Awards\u00ae , co-creating the first,  national recognition program  honoring K-12 theatre educators The first smile in an email , created  in 1982 by professor Scott Fahlman Kevlar Fiber , invented by alumna  Stephanie Kwolek (MM 1946) The Last Lecture , written   by alumni Randy Pausch (SCS 1988)   and Jeffrey Zaslow (DC 1980) In 1919, CMU\u2019s first Ph.D.  was  awarded to Mao Yisheng, father   of Chinese bridge construction.  Duolingo , invented by professor   Luis von Ahn (CS 2003, 2005), had   10 million downloads in 12 months  and was named Apple\u2019s 2013 app   of the year. :-) LEADERSHIP Farnam Jahanian    President David Coulter   Chair, Board of Trustees James H. Garrett Jr.   Provost2 National Academy of Engineering       3 National Academy of Sciences        4 National Academy of Medicine  Won by alumni and current/former faculty The leading university center  for cybersecurity , providing  support to more than 110  centers around the world  The world\u2019s first university  robotics department ,   founded in 1979 Alumnus Andy Warhol    (CFA1949), pop artist pioneer   and cultural icon One of only 29 universities   invited to be a member of the  World Economic Forum\u2019s  Global University   Leaders Forum CMU.EDU ECONOMIC IMPACT \u2022 Attracting major companies  \u2014   including Google, Intel, Uber and GE \u2014   to locate operations and create new   jobs in Pittsburgh \u2022 To date, the CMU community has  launched more than 400 startups   and created more than 152 spinoff  companies . \u2022 Contributing to the cultural and civic life of   the city with performances , exhibitions   and research collaborations 13 ACADEMY   AWARDS65 MEMBERS   OF NAE2 146 EMMY   AWARDS20 MEMBERS   OF NAS3 6 MEMBERS   OF NAM4 13 TURING   AWARDS 20 NOBEL   LAUREATES 58 TONY   AWARDS May 2023",
        "retrieved_relevant_part": true,
        "model_answer": "C.mmp",
        "actual_answer": "Cm*",
        "exact_match": false,
        "f1_max_min_avg": [
            0,
            0,
            0.0
        ],
        "recall_max_min_avg": [
            0,
            0,
            0.0
        ]
    },
    {
        "question": "When did Carnegie Mellon begin developing cognitive tutoring programs?",
        "context": "3. Tutoring machines, 1973Games and drills, such as flash cards, have long been used to help students learn tough subjects. But the cognitive tutoring programs developed at Carnegie Mellon, beginning in the 1970s, did more than simply drill students on math problems. Cognitive tutors were able to adapt, presenting harder or easier problems as students learned or stumbled. Today, cognitive tutors teach subjects such as algebra to hundreds of thousands of students every year.",
        "retrieved_doc": "3. Tutoring machines, 1973Games and drills, such as flash cards, have long been used to help students learn tough subjects. But the cognitive tutoring programs developed at Carnegie Mellon, beginning in the 1970s, did more than simply drill students on math problems. Cognitive tutors were able to adapt, presenting harder or easier problems as students learned or stumbled. Today, cognitive tutors teach subjects such as algebra to hundreds of thousands of students every year.|of Carnegie Mellon research. It initiated the 'Carnegie Plan' in 1938, a new curriculum that required science and engineer students to take courses in humanities and social sciences in order to better understand the needs of society. Carnegie died|What\u2019s so great about computer science at Carnegie Mellon?We're glad you asked! Here are 25 great ideas from CMU computer scientists to think about as we celebrate the birthday of the School of Computer Science.1. Artificial intelligence, 1955-56\u00a0Can you write a working computer program without a computer? Herb Simon (H\u201990), at left, Allen Newell (IA\u201957), at right, and Cliff Shaw did. The team created the first artificial intelligence program, Logic Theorist, which could solve logic puzzles in the same way that a human might solve them. Newell demonstrated that it worked by writing the instructions on 3-by-5 index cards that were manipulated on the kitchen table by Newell, his wife, and a group of Carnegie Tech grad students.|Carnegie Mellon University has been a birthplace  of innovation since its founding in 1900. Today, CMU is a global leader bringing groundbreaking  ideas to market and creating successful startup  businesses. Our award-winning faculty are renowned for  working closely with students to solve major scientific,  technological and societal challenges. We put a strong  emphasis on creating things \u2014 from art to robots. We  have become a model for economic development in  forming partnerships with companies such as Uber,  Google and Disney. Our students are recruited by some  of the world\u2019s most innovative companies. MANAGEMENT  INFORMATION  SYSTEMS U.S. News & World Report, 2022#1 ARTIFICIAL  INTELLIGENCE U.S. News & World Report, 2022#1 AMONG U.S.   UNIVERSITIES Times Higher Education   World University  Ranking, 2023#19SOFTWARE  ENGINEERING U.S. News & World Report, 2022COLLEGE OF  ENGINEERING U.S. News & World Report, 2022#1 #4#1SCHOOL OF  COMPUTER  SCIENCE U.S. News & World Report, 2022 UNIVERSITY   IN THE WORLD Times Higher Education   World University   Ranking, 2023#28TIME-BASED/   NEW MEDIA U.S. News & World Report, 2019#11,529   FACULTY16,779   STUDENTSGraduate Undergraduate 117,257  ALUMNI (LIVING) 85%  U.S. 15%  International35%  U.S. 65%  International 76%  U.S. 24%  InternationalGLOBAL COMMUNITY Students representing 126 countries Faculty representing 56 countries Alumni representing  148 countries OF COMPUTER  SCIENCE\u2019S FIRST- YEAR STUDENTS   WERE WOMEN   IN 2019 Nearly triple the   national average\u201c My Heart is in the Work. \u201d    Andrew Carnegie, Founder    November 15, 1900 49.8 % 87%  U.S. 13%  InternationalSCHOOLS AND COLLEGES College of Engineering  College of Fine Arts Dietrich College of Humanities   and Social Sciences Heinz College of Information Systems  and Public Policy Mellon College of Science School of Computer Science Tepper School of Business cmu.edu/assets/pdfs/cmu-fact-sheet.pdf    |   cmu.edu/about/awards.htmlMarch 2020BIG IDEAS THAT SHAPE YOUR WORLD START HERE 1,000+ companies greenlighted  across the U.S. and internationally  Cognitive tutors,  which improve  the math skills of 500,000+  students each year  The first U.S. school to award   a degree in drama  in 1914 James Gosling (SCS 1983)  invented the Java computer  programming language . The first exclusive higher  education partner of the Tony  Awards\u00ae , co-creating the first,  national recognition program  honoring K-12 theatre educators The first smile in an email , created  in 1982 by professor Scott Fahlman Kevlar Fiber , invented by alumna  Stephanie Kwolek (MM 1946) The Last Lecture , written   by alumni Randy Pausch (SCS 1988)   and Jeffrey Zaslow (DC 1980) In 1919, CMU\u2019s first Ph.D.  was  awarded to Mao Yisheng, father   of Chinese bridge construction.  Duolingo , invented by professor   Luis von Ahn (CS 2003, 2005), had   10 million downloads in 12 months  and was named Apple\u2019s 2013 app   of the year. :-) LEADERSHIP Farnam Jahanian    President David Coulter   Chair, Board of Trustees James H. Garrett Jr.   Provost2 National Academy of Engineering       3 National Academy of Sciences        4 National Academy of Medicine  Won by alumni and current/former faculty The leading university center  for cybersecurity , providing  support to more than 110  centers around the world  The world\u2019s first university  robotics department ,   founded in 1979 Alumnus Andy Warhol    (CFA1949), pop artist pioneer   and cultural icon One of only 29 universities   invited to be a member of the  World Economic Forum\u2019s  Global University   Leaders Forum CMU.EDU ECONOMIC IMPACT \u2022 Attracting major companies  \u2014   including Google, Intel, Uber and GE \u2014   to locate operations and create new   jobs in Pittsburgh \u2022 To date, the CMU community has  launched more than 400 startups   and created more than 152 spinoff  companies . \u2022 Contributing to the cultural and civic life of   the city with performances , exhibitions   and research collaborations 13 ACADEMY   AWARDS65 MEMBERS   OF NAE2 146 EMMY   AWARDS20 MEMBERS   OF NAS3 6 MEMBERS   OF NAM4 13 TURING   AWARDS 20 NOBEL   LAUREATES 58 TONY   AWARDS May 2023|47 of concepts. Students can register online thro ugh the Student Academic Success website. \uf0b7 Academic Coaching: Academic Coaching provides holistic one-on-one peer support and group workshops to help stu dents find and implement their conditions for success. We assist students in improving time management , productive habits, organization, stress management, and study skills. Students wi ll request support through the Academic Success Center website and attend in-person meetings or meet using video and audio conferencing technology to provid e all students with support. \uf0b7 \u201cJust in Time\u201d Workshops: The Student Academic Success team is available to partner with instructors and departments to identify sk ills or concepts that would benefit from supplemental offerings (workshops, boot cam ps) to support students\u2019 academic success and learning. We are eager to help convene and coordinate outside of the classroom skill-building opportunities that can be open to any student interested in building skill or reinforcing course concept mastery. \uf0b7 Study Partners: Support for students to create and benefit from their own study groups: The Student Academic Success team assists student s in forming and benefiting from peer study groups, whereby all students can reap the benefits of peer-to-peer learning, student agency, and collaboration skill devel opment. Staff from the Student Academic Success Center will be made available to in structors and students to assist with the formation of peer-led study groups. This le vel of support is open to any course where the instructor requests or agrees such support is appropriate and students are interested in both leading and participating. Language and Cross-cultural Support More than 60% of graduate students at Carnegie Mellon are international students, and others are nonnative speakers of English who have atten ded high school or undergraduate programs in the US. Many of these students want to hone their language and cross-cultural skills for academic and professional success. Stud ents can choose from sessions on \uf0b7 how to give a strong presentation, \uf0b7 writing academic emails, \uf0b7 expectations and strategies for clear academic writing, \uf0b7 how to talk about yourself as a professional in the U.S., \uf0b7 developing clearer pronunciation, \uf0b7 using accurate grammar, \uf0b7 building fluency, and more. \uf0b7 Students can make an appointment with a La nguage Development Specialist to get individualized coaching on langua ge or cross-cultural issues. The Student Academic Success Center is also charged with certifying the language of International Teaching Assistants (ITAs), ensuring that nonnati ve English speakers have the language proficiency needed to succeed as teaching assistants in the Carnegie Mellon classroom|\nA history of SCS\n\nFor an expanded history of the School of Computer Science and its predecessors at CMU, read \"Institutional Memories\" in the Summer 2014 issue of The Link magazine.\n\nIn 2014, the School of Computer Science celebrated its 25th year as a stand-alone college within Carnegie Mellon University. It was arguably the first college devoted solely to computer science in the United States, and a model for others that followed. But CMU\u2019s computer science era begins much earlier\u2014in 1956, with the arrival of an IBM 650 computer on the campus of what was then known as Carnegie Institute of Technology. The IBM 650 had magnetic-drum memory and a processing speed of approximately 60 instructions per second. Herb Simon (H\u201990), associate dean of the Graduate School of Industrial Administration\u2014now known as CMU\u2019s Tepper School of Business\u2014established Carnegie Tech\u2019s first Computation Center with the help of its first director, Alan Perlis (S\u201942).\n",
        "retrieved_relevant_part": true,
        "model_answer": "Carnegie Mellon began developing cognitive tutoring programs in 1956",
        "actual_answer": "1970s",
        "exact_match": false,
        "f1_max_min_avg": [
            0,
            0,
            0.0
        ],
        "recall_max_min_avg": [
            0,
            0,
            0.0
        ]
    },
    {
        "question": "How do cognitive tutors differ from traditional games and drills used for learning?",
        "context": "3. Tutoring machines, 1973Games and drills, such as flash cards, have long been used to help students learn tough subjects. But the cognitive tutoring programs developed at Carnegie Mellon, beginning in the 1970s, did more than simply drill students on math problems. Cognitive tutors were able to adapt, presenting harder or easier problems as students learned or stumbled. Today, cognitive tutors teach subjects such as algebra to hundreds of thousands of students every year.",
        "retrieved_doc": "3. Tutoring machines, 1973Games and drills, such as flash cards, have long been used to help students learn tough subjects. But the cognitive tutoring programs developed at Carnegie Mellon, beginning in the 1970s, did more than simply drill students on math problems. Cognitive tutors were able to adapt, presenting harder or easier problems as students learned or stumbled. Today, cognitive tutors teach subjects such as algebra to hundreds of thousands of students every year.|Author: Yonatan Bisk Title: SPRING: Studying the Paper and Reasoning to Play Games Publication year: 2023 Coauthors: Yue Wu, So Yeon Min, Shrimai Prabhumoye, Yonatan Bisk, R. Salakhutdinov, A. Azaria, Tom M. Mitchell, Yuan-Fang Li Abstract: Open-world survival games pose significant challenges for AI algorithms due to their multi-tasking, deep exploration, and goal prioritization requirements. Despite reinforcement learning (RL) being popular for solving games, its high sample complexity limits its effectiveness in complex open-world games like Crafter or Minecraft. We propose a novel approach, SPRING, to read the game's original academic paper and use the knowledge learned to reason and play the game through a large language model (LLM). Prompted with the LaTeX source as game context and a description of the agent's current observation, our SPRING framework employs a directed acyclic graph (DAG) with game-related questions as nodes and dependencies as edges. We identify the optimal action to take in the environment by traversing the DAG and calculating LLM responses for each node in topological order, with the LLM's answer to final node directly translating to environment actions. In our experiments, we study the quality of in-context\"reasoning\"induced by different forms of prompts under the setting of the Crafter open-world environment. Our experiments suggest that LLMs, when prompted with consistent chain-of-thought, have great potential in completing sophisticated high-level trajectories. Quantitatively, SPRING with GPT-4 outperforms all state-of-the-art RL baselines, trained for 1M steps, without any training. Finally, we show the potential of games as a test bed for LLMs.|Author: Mona T. Diab Title: OPT-R: Exploring the Role of Explanations in Finetuning and Prompting for Reasoning Skills of Large Language Models Publication year: 2023 Coauthors: Badr AlKhamissi, Siddharth Verma, Ping Yu, Zhijing Jin, Asli Celikyilmaz, Mona T. Diab Abstract: We conduct a thorough investigation into the reasoning capabilities of Large Language Models (LLMs), focusing specifically on the Open Pretrained Transformers (OPT) models as a representative of such models. Our study entails finetuning three different sizes of OPT on a carefully curated reasoning corpus, resulting in two sets of finetuned models: OPT-R, finetuned without explanations, and OPT-RE, finetuned with explanations. We then evaluate all models on 57 out-of-domain tasks drawn from the Super-NaturalInstructions benchmark, covering 26 distinct reasoning skills, utilizing three prompting techniques. Through a comprehensive grid of 27 configurations and 6,156 test evaluations, we investigate the dimensions of finetuning, prompting, and scale to understand the role of explanations on different reasoning skills. Our findings reveal that having explanations in the fewshot exemplar has no significant impact on the model\u2019s performance when the model is finetuned, while positively affecting the non-finetuned counterpart. Moreover, we observe a slight yet consistent increase in classification accuracy as we incorporate explanations during prompting and finetuning, respectively. Finally, we offer insights on which reasoning skills benefit the most from incorporating explanations during finetuning and prompting, such as Numerical (+20.4%) and Analogical (+13.9%) reasoning, as well as skills that exhibit negligible or negative effects.|Author: Yiming Yang Title: In-Context Principle Learning from Mistakes Publication year: 2024 Coauthors: Tianjun Zhang, Aman Madaan, Luyu Gao, Steven Zheng, Swaroop Mishra, Yiming Yang, Niket Tandon, Uri Alon Abstract: In-context learning (ICL, also known as few-shot prompting) has been the standard method of adapting LLMs to downstream tasks, by learning from a few input-output examples. Nonetheless, all ICL-based approaches only learn from correct input-output pairs. In this paper, we revisit this paradigm, by learning more from the few given input-output examples. We introduce Learning Principles (LEAP): First, we intentionally induce the model to make mistakes on these few examples; then we reflect on these mistakes, and learn explicit task-specific\"principles\"from them, which help solve similar problems and avoid common mistakes; finally, we prompt the model to answer unseen test questions using the original few-shot examples and these learned general principles. We evaluate LEAP on a wide range of benchmarks, including multi-hop question answering (Hotpot QA), textual QA (DROP), Big-Bench Hard reasoning, and math problems (GSM8K and MATH); in all these benchmarks, LEAP improves the strongest available LLMs such as GPT-3.5-turbo, GPT-4, GPT-4 turbo and Claude-2.1. For example, LEAP improves over the standard few-shot prompting using GPT-4 by 7.5% in DROP, and by 3.3% in HotpotQA. Importantly, LEAP does not require any more input or examples than the standard few-shot prompting settings.|Author: Yonatan Bisk Title: Computational Language Acquisition with Theory of Mind Publication year: 2023 Coauthors: Andy T. Liu, Hao Zhu, Emmy Liu, Yonatan Bisk, Graham Neubig Abstract: Unlike current state-of-the-art language models, young children actively acquire language through interactions with their surrounding environment and caretakers. One mechanism that has been argued to be critical to language learning is the ability to infer the mental states of other agents in social environments, coined Theory of Mind (ToM) by Premack&Woodruff (1978). Drawing inspiration from the modern operationalized versions of ToM implemented in Rabinowitz et al. (2018) and Zhu et al. (2021), we build language-learning agents equipped with ToM, and measure its effects on the learning process. We model ToM by giving the speaker agent an internal listener model that is trained alongside the speaker and used to rerank potential utterances. We experiment with varying task difficulty, hypothesizing that models will acquire more complex language to adapt to stronger environmental pressures. We find that training speakers with a highly weighted ToM listener component leads to performance gains in our image referential game setting. We also find some evidence that increasing task difficulty in the training process results in more fluent and precise utterances in evaluation. This suggests the potential utility of further incorporating ToM, as well as other insights from child language acquisition, into computational models of language acquisition.|Author: Graham Neubig Title: Computational Language Acquisition with Theory of Mind Publication year: 2023 Coauthors: Andy T. Liu, Hao Zhu, Emmy Liu, Yonatan Bisk, Graham Neubig Abstract: Unlike current state-of-the-art language models, young children actively acquire language through interactions with their surrounding environment and caretakers. One mechanism that has been argued to be critical to language learning is the ability to infer the mental states of other agents in social environments, coined Theory of Mind (ToM) by Premack&Woodruff (1978). Drawing inspiration from the modern operationalized versions of ToM implemented in Rabinowitz et al. (2018) and Zhu et al. (2021), we build language-learning agents equipped with ToM, and measure its effects on the learning process. We model ToM by giving the speaker agent an internal listener model that is trained alongside the speaker and used to rerank potential utterances. We experiment with varying task difficulty, hypothesizing that models will acquire more complex language to adapt to stronger environmental pressures. We find that training speakers with a highly weighted ToM listener component leads to performance gains in our image referential game setting. We also find some evidence that increasing task difficulty in the training process results in more fluent and precise utterances in evaluation. This suggests the potential utility of further incorporating ToM, as well as other insights from child language acquisition, into computational models of language acquisition.",
        "retrieved_relevant_part": true,
        "model_answer": "They can adapt to students by presenting harder or easier problems",
        "actual_answer": "Cognitive tutors were able to adapt, presenting harder or easier problems as students learned or stumbled",
        "exact_match": false,
        "f1_max_min_avg": [
            0.52,
            0.52,
            0.52
        ],
        "recall_max_min_avg": [
            0.44,
            0.44,
            0.44
        ]
    },
    {
        "question": "Who created emoticons?",
        "context": "5. Emoticons, 1982Sure, it was just a joke, but (for better or worse) it\u2019s endured for more than three decades. CMU researcher Scott Fahlman created the emoticon to clear up misunderstandings on computer message boards. We\u2019ve been looking at the world sideways ever since. :-)",
        "retrieved_doc": "5. Emoticons, 1982Sure, it was just a joke, but (for better or worse) it\u2019s endured for more than three decades. CMU researcher Scott Fahlman created the emoticon to clear up misunderstandings on computer message boards. We\u2019ve been looking at the world sideways ever since. :-)|16. CAPTCHAs, 2000 \u201cSpam\u201d and malicious attacks were a growing problem on the Internet when hackers developed automated \u201cbots\u201d that could sign up for email and other Web services without human intervention. Luis von Ahn (CS\u201903,\u201905), Nick Hopper (CS\u201904), John Langford (CS\u201902) and CMU professor Manuel Blum invented a \u201cCompletely Automated Public Turing Test to tell Computers and Humans Apart,\u201d or CAPTCHA, to help foil the bots. A later variation, reCAPTCHA, is helping digitize old books and newspapers.|Author: Louis-Philippe Morency Title: MMOE: Mixture of Multimodal Interaction Experts Publication year: 2023 Coauthors: Haofei Yu, P. Liang, R. Salakhutdinov, Louis-Philippe Morency Abstract: Multimodal machine learning, which studies the information and interactions across various input modalities, has made significant advancements in understanding the relationship between images and descriptive text. However, this is just a portion of the potential multimodal interactions seen in the real world and does not include new interactions between conflicting utterances and gestures in predicting sarcasm, for example. Notably, the current methods for capturing shared information often do not extend well to these more nuanced interactions, sometimes performing as low as 50% in binary classification. In this paper, we address this problem via a new approach called MMOE, which stands for a mixture of multimodal interaction experts. Our method automatically classifies data points from unlabeled multimodal datasets by their interaction type and employs specialized models for each specific interaction. Based on our experiments, this approach improves performance on these challenging interactions by more than 10%, leading to an overall increase of 2% for tasks like sarcasm prediction. As a result, interaction quantification provides new insights for dataset analysis and yields simple approaches that obtain state-of-the-art performance.|Author: Louis-Philippe Morency Title: Continual Learning for Personalized Co-Speech Gesture Generation Publication year: 2023 Coauthors: Chaitanya Ahuja, Pratik Joshi, Ryo Ishii, Louis-Philippe Morency Abstract: Co-speech gestures are a key channel of human communication, making them important for personalized chat agents to generate. In the past, gesture generation models assumed that data for each speaker is available all at once, and in large amounts. However in practical scenarios, speaker data comes sequentially and in small amounts as the agent personalizes with more speakers, akin to a continual learning paradigm. While more recent works have shown progress in adapting to low-resource data, they catastrophically forget the gesture styles of initial speakers they were trained on. Also, prior generative continual learning works are not multimodal, making this space less studied. In this paper, we explore this new paradigm and propose C-DiffGAN: an approach that continually learns new speaker gesture styles with only a few minutes of per-speaker data, while retaining previously learnt styles. Inspired by prior continual learning works, C-DiffGAN encourages knowledge retention by 1) generating reminiscences of previous low-resource speaker data, then 2) crossmodally aligning to them to mitigate catastrophic forgetting. We quantitatively demonstrate improved performance and reduced forgetting over strong baselines through standard continual learning measures, reinforced by a qualitative user study that shows that our method produces more natural, style-preserving gestures. Code and videos can be found at https://chahuja.com/cdiffgan|Author: Maarten Sap Title: From Dogwhistles to Bullhorns: Unveiling Coded Rhetoric with Language Models Publication year: 2023 Coauthors: Julia Mendelsohn, Ronan Le Bras, Yejin Choi, Maarten Sap Abstract: Dogwhistles are coded expressions that simultaneously convey one meaning to a broad audience and a second, often hateful or provocative, meaning to a narrow in-group; they are deployed to evade both political repercussions and algorithmic content moderation. For example, the word \u201ccosmopolitan\u201d in a sentence such as \u201cwe need to end the cosmopolitan experiment\u201d can mean \u201cworldly\u201d to many but also secretly mean \u201cJewish\u201d to a select few. We present the first large-scale computational investigation of dogwhistles. We develop a typology of dogwhistles, curate the largest-to-date glossary of over 300 dogwhistles with rich contextual information and examples, and analyze their usage in historical U.S. politicians\u2019 speeches. We then assess whether a large language model (GPT-3) can identify dogwhistles and their meanings, and find that GPT-3\u2019s performance varies widely across types of dogwhistles and targeted groups. Finally, we show that harmful content containing dogwhistles avoids toxicity detection, highlighting online risks presented by such coded language. This work sheds light on the theoretical and applied importance of dogwhistles in both NLP and computational social science, and provides resources to facilitate future research in modeling dogwhistles and mitigating their online harms.|Author: Louis-Philippe Morency Title: Expanding the Role of Affective Phenomena in Multimodal Interaction Research Publication year: 2023 Coauthors: Leena Mathur, Maja J Matari'c, Louis-Philippe Morency Abstract: In recent decades, the field of affective computing has made substantial progress in advancing the ability of AI systems to recognize and express affective phenomena, such as affect and emotions, during human-human and human-machine interactions. This paper describes our examination of research at the intersection of multimodal interaction and affective computing, with the objective of observing trends and identifying understudied areas. We examined over 16,000 papers from selected conferences in multimodal interaction, affective computing, and natural language processing: ACM International Conference on Multimodal Interaction, AAAC International Conference on Affective Computing and Intelligent Interaction, Annual Meeting of the Association for Computational Linguistics, and Conference on Empirical Methods in Natural Language Processing. We identified 910 affect-related papers and present our analysis of the role of affective phenomena in these papers. We find that this body of research has primarily focused on enabling machines to recognize or express affect and emotion; there has been limited research on how affect and emotion predictions might, in turn, be used by AI systems to enhance machine understanding of human social behaviors and cognitive states. Based on our analysis, we discuss directions to expand the role of affective phenomena in multimodal interaction research.",
        "retrieved_relevant_part": true,
        "model_answer": "CMU researcher Scott Fahlman created emoticons",
        "actual_answer": "Scott Fahlman",
        "exact_match": false,
        "f1_max_min_avg": [
            0.5,
            0.5,
            0.5
        ],
        "recall_max_min_avg": [
            1.0,
            1.0,
            1.0
        ]
    },
    {
        "question": "Who lead the development of Mach kernel?",
        "context": "10. Mach kernel, 1985In computer parlance, a \u201ckernel\u201d is the heart of an operating system, passing input and output requests to and from the processor. At the core of all modern Apple devices --- including iPhones, iPads and MacBooks --- is the Mach kernel, developed at CMU under the leadership of then-professor Rick Rashid.",
        "retrieved_doc": "10. Mach kernel, 1985In computer parlance, a \u201ckernel\u201d is the heart of an operating system, passing input and output requests to and from the processor. At the core of all modern Apple devices --- including iPhones, iPads and MacBooks --- is the Mach kernel, developed at CMU under the leadership of then-professor Rick Rashid.|12. Java, 1991 As a CMU grad student, James Gosling (CS\u201983) worked on the Andrew project, which stressed interoperability between computers, whether they were Macs, IBMs or Unix machines. Those lessons served Gosling well when he developed Java, the first programming language able to run on almost any platform.|13. Email attachments, 1992Steve Jobs liked the email system built into CMU\u2019s Andrew so much that he tried to hire Nathaniel Borenstein (CS\u201981,\u201985) and the rest of his team to create a similar program for Apple. Borenstein didn\u2019t take the offer, but he did like Jobs\u2019 idea about attaching documents to email. Borenstein went on to develop the MIME standard that\u2019s used by all email programs to send photos and other files over the Internet.|6. Andrew project, 1982It was long the dream of computer scientists to put a workstation in every home and office, but no one had actually tried to accomplish it until researchers from Carnegie Mellon University and IBM launched the Andrew Project. Soon, every student, faculty member and employee had access to email, word processing, file-transfer services and graphics programs, and CMU was the most-wired campus in the world.|Spring offering: Course: 15410 Title: Operating System Design and Implementation Units: 15.0 Lec/Sec: Section A Days: Monday, Wednesday, Friday Begin: 11:00AM End: 11:50AM Bldg/Room: POS 153 Location: Pittsburgh, Pennsylvania Instructor(s): Eckhardt |Daniel Vosler LTI High Performance Cluster Administrator Email: dvosler@andrew.cmu.edu",
        "retrieved_relevant_part": true,
        "model_answer": "Rick Rashid",
        "actual_answer": "Rick Rashid",
        "exact_match": true,
        "f1_max_min_avg": [
            1.0,
            1.0,
            1.0
        ],
        "recall_max_min_avg": [
            1.0,
            1.0,
            1.0
        ]
    },
    {
        "question": "What is at the core of all modern Apple devices?",
        "context": "10. Mach kernel, 1985In computer parlance, a \u201ckernel\u201d is the heart of an operating system, passing input and output requests to and from the processor. At the core of all modern Apple devices --- including iPhones, iPads and MacBooks --- is the Mach kernel, developed at CMU under the leadership of then-professor Rick Rashid.",
        "retrieved_doc": "10. Mach kernel, 1985In computer parlance, a \u201ckernel\u201d is the heart of an operating system, passing input and output requests to and from the processor. At the core of all modern Apple devices --- including iPhones, iPads and MacBooks --- is the Mach kernel, developed at CMU under the leadership of then-professor Rick Rashid.|Fall offering: Course: 67443 Title: Mobile Application Development for IOS Units: 12.0 Lec/Sec: Section B Days: Tuesday Begin: 07:00PM End: 08:50PM Bldg/Room: WEH 5336 Location: Pittsburgh, Pennsylvania Instructor(s): Heimann |Fall offering: Course: 67443 Title: Mobile Application Development for IOS Units: 12.0 Lec/Sec: Section C Days: Wednesday Begin: 07:00PM End: 08:50PM Bldg/Room: WEH 8427 Location: Pittsburgh, Pennsylvania Instructor(s): Heimann |Fall offering: Course: 67443 Title: Mobile Application Development for IOS Units: 12.0 Lec/Sec: Section D Days: Thursday Begin: 07:00PM End: 08:50PM Bldg/Room: WEH 5336 Location: Pittsburgh, Pennsylvania Instructor(s): Heimann |2. Multi-core processors, 1971\u00a0Multi-core processors are common in today\u2019s computers, but they were still science fiction in the early 1970s. But when CMU researchers found their existing machines too slow to keep pace with the advance of speech and graphics programs, they knew they had to do something. They solved the problem by ganging together 16 processors to build a pioneering computer called C.mmp\u2014then topped the feat by linking 50 processors into Cm*.|Fall offering: Course: 67443 Title: Mobile Application Development for IOS Units: 12.0 Lec/Sec: Section W Days: Monday, Wednesday Begin: 10:00AM End: 11:15AM Bldg/Room: CMB 2062 Location: Doha, Qatar Instructor(s): AAZAM ",
        "retrieved_relevant_part": true,
        "model_answer": "The Mach kernel",
        "actual_answer": "Mach kernel",
        "exact_match": false,
        "f1_max_min_avg": [
            0.8,
            0.8,
            0.8
        ],
        "recall_max_min_avg": [
            1.0,
            1.0,
            1.0
        ]
    },
    {
        "question": "What did Steve Jobs attempt to do regarding Nathaniel Borenstein and his team?",
        "context": "Steve Jobs liked the email system built into CMU's Andrew so much that he tried to hire Nathaniel Borenstein (CS'81,'85) and the rest of his team to create a similar program for Apple. Borenstein didn't take the offer, but he did like Jobs' idea about attaching documents to email. Borenstein went on to develop the MIME standard that's used by all email programs to send photos and other files over the Internet.",
        "retrieved_doc": "13. Email attachments, 1992Steve Jobs liked the email system built into CMU\u2019s Andrew so much that he tried to hire Nathaniel Borenstein (CS\u201981,\u201985) and the rest of his team to create a similar program for Apple. Borenstein didn\u2019t take the offer, but he did like Jobs\u2019 idea about attaching documents to email. Borenstein went on to develop the MIME standard that\u2019s used by all email programs to send photos and other files over the Internet.|10. Mach kernel, 1985In computer parlance, a \u201ckernel\u201d is the heart of an operating system, passing input and output requests to and from the processor. At the core of all modern Apple devices --- including iPhones, iPads and MacBooks --- is the Mach kernel, developed at CMU under the leadership of then-professor Rick Rashid.|Bryan Burtner Associate Business Manager Email: bburtner@cs.cmu.edu Office: 6413 TCS Hall Phone: 412-268-2805|Robert Frederking Principal Systems Scientist/Associate Dean of Doctoral Programs/MLT Program Director Email: ref@cs.cmu.edu Office: 6515 Gates & Hillman Centers Phone: 412-268-6656|6. Andrew project, 1982It was long the dream of computer scientists to put a workstation in every home and office, but no one had actually tried to accomplish it until researchers from Carnegie Mellon University and IBM launched the Andrew Project. Soon, every student, faculty member and employee had access to email, word processing, file-transfer services and graphics programs, and CMU was the most-wired campus in the world.|Michael Shamos Distinguished Career Professor Email: shamos@cs.cmu.edu Office: 6707 Gates & Hillman Centers Phone: 412-268-8193",
        "retrieved_relevant_part": false,
        "model_answer": "Steve Jobs was impressed with the email system at CMU, which allowed his heart to make the decision to hire Borenstein and his team to create a similar system for Apple",
        "actual_answer": "He tried to hire Nathaniel Borenstein and the rest of his team to create an email program for Apple",
        "exact_match": false,
        "f1_max_min_avg": [
            0.44,
            0.44,
            0.44
        ],
        "recall_max_min_avg": [
            0.58,
            0.58,
            0.58
        ]
    },
    {
        "question": "What idea of Steve Jobs did Nathaniel Borenstein like?",
        "context": "Steve Jobs liked the email system built into CMU's Andrew so much that he tried to hire Nathaniel Borenstein (CS'81,'85) and the rest of his team to create a similar program for Apple. Borenstein didn't take the offer, but he did like Jobs' idea about attaching documents to email. Borenstein went on to develop the MIME standard that's used by all email programs to send photos and other files over the Internet.",
        "retrieved_doc": "13. Email attachments, 1992Steve Jobs liked the email system built into CMU\u2019s Andrew so much that he tried to hire Nathaniel Borenstein (CS\u201981,\u201985) and the rest of his team to create a similar program for Apple. Borenstein didn\u2019t take the offer, but he did like Jobs\u2019 idea about attaching documents to email. Borenstein went on to develop the MIME standard that\u2019s used by all email programs to send photos and other files over the Internet.|10. Mach kernel, 1985In computer parlance, a \u201ckernel\u201d is the heart of an operating system, passing input and output requests to and from the processor. At the core of all modern Apple devices --- including iPhones, iPads and MacBooks --- is the Mach kernel, developed at CMU under the leadership of then-professor Rick Rashid.|6. Andrew project, 1982It was long the dream of computer scientists to put a workstation in every home and office, but no one had actually tried to accomplish it until researchers from Carnegie Mellon University and IBM launched the Andrew Project. Soon, every student, faculty member and employee had access to email, word processing, file-transfer services and graphics programs, and CMU was the most-wired campus in the world.|Carnegie Mellon University has been a birthplace  of innovation since its founding in 1900. Today, CMU is a global leader bringing groundbreaking  ideas to market and creating successful startup  businesses. Our award-winning faculty are renowned for  working closely with students to solve major scientific,  technological and societal challenges. We put a strong  emphasis on creating things \u2014 from art to robots. We  have become a model for economic development in  forming partnerships with companies such as Uber,  Google and Disney. Our students are recruited by some  of the world\u2019s most innovative companies. MANAGEMENT  INFORMATION  SYSTEMS U.S. News & World Report, 2022#1 ARTIFICIAL  INTELLIGENCE U.S. News & World Report, 2022#1 AMONG U.S.   UNIVERSITIES Times Higher Education   World University  Ranking, 2023#19SOFTWARE  ENGINEERING U.S. News & World Report, 2022COLLEGE OF  ENGINEERING U.S. News & World Report, 2022#1 #4#1SCHOOL OF  COMPUTER  SCIENCE U.S. News & World Report, 2022 UNIVERSITY   IN THE WORLD Times Higher Education   World University   Ranking, 2023#28TIME-BASED/   NEW MEDIA U.S. News & World Report, 2019#11,529   FACULTY16,779   STUDENTSGraduate Undergraduate 117,257  ALUMNI (LIVING) 85%  U.S. 15%  International35%  U.S. 65%  International 76%  U.S. 24%  InternationalGLOBAL COMMUNITY Students representing 126 countries Faculty representing 56 countries Alumni representing  148 countries OF COMPUTER  SCIENCE\u2019S FIRST- YEAR STUDENTS   WERE WOMEN   IN 2019 Nearly triple the   national average\u201c My Heart is in the Work. \u201d    Andrew Carnegie, Founder    November 15, 1900 49.8 % 87%  U.S. 13%  InternationalSCHOOLS AND COLLEGES College of Engineering  College of Fine Arts Dietrich College of Humanities   and Social Sciences Heinz College of Information Systems  and Public Policy Mellon College of Science School of Computer Science Tepper School of Business cmu.edu/assets/pdfs/cmu-fact-sheet.pdf    |   cmu.edu/about/awards.htmlMarch 2020BIG IDEAS THAT SHAPE YOUR WORLD START HERE 1,000+ companies greenlighted  across the U.S. and internationally  Cognitive tutors,  which improve  the math skills of 500,000+  students each year  The first U.S. school to award   a degree in drama  in 1914 James Gosling (SCS 1983)  invented the Java computer  programming language . The first exclusive higher  education partner of the Tony  Awards\u00ae , co-creating the first,  national recognition program  honoring K-12 theatre educators The first smile in an email , created  in 1982 by professor Scott Fahlman Kevlar Fiber , invented by alumna  Stephanie Kwolek (MM 1946) The Last Lecture , written   by alumni Randy Pausch (SCS 1988)   and Jeffrey Zaslow (DC 1980) In 1919, CMU\u2019s first Ph.D.  was  awarded to Mao Yisheng, father   of Chinese bridge construction.  Duolingo , invented by professor   Luis von Ahn (CS 2003, 2005), had   10 million downloads in 12 months  and was named Apple\u2019s 2013 app   of the year. :-) LEADERSHIP Farnam Jahanian    President David Coulter   Chair, Board of Trustees James H. Garrett Jr.   Provost2 National Academy of Engineering       3 National Academy of Sciences        4 National Academy of Medicine  Won by alumni and current/former faculty The leading university center  for cybersecurity , providing  support to more than 110  centers around the world  The world\u2019s first university  robotics department ,   founded in 1979 Alumnus Andy Warhol    (CFA1949), pop artist pioneer   and cultural icon One of only 29 universities   invited to be a member of the  World Economic Forum\u2019s  Global University   Leaders Forum CMU.EDU ECONOMIC IMPACT \u2022 Attracting major companies  \u2014   including Google, Intel, Uber and GE \u2014   to locate operations and create new   jobs in Pittsburgh \u2022 To date, the CMU community has  launched more than 400 startups   and created more than 152 spinoff  companies . \u2022 Contributing to the cultural and civic life of   the city with performances , exhibitions   and research collaborations 13 ACADEMY   AWARDS65 MEMBERS   OF NAE2 146 EMMY   AWARDS20 MEMBERS   OF NAS3 6 MEMBERS   OF NAM4 13 TURING   AWARDS 20 NOBEL   LAUREATES 58 TONY   AWARDS May 2023| \nTuring Awards and a Nobel Prize\n\nIn 1975, Simon and Newell were awarded the A.M. Turing Award for their work in artificial intelligence. (As of 2014, 12 CMU alumni or faculty have been awarded Turings, sometimes considered the Nobel Prize of computing.) Three years later, Simon received the Nobel Prize in Economics for his work on decision-making theory. As the 1970s progressed, Newell became interested in human-computer interaction, and began a long relationship with Xerox\u2019s Palo Alto Research Center, or PARC, which released the Xerox Alto in 1973. Considered a forerunner to many of the computing environments that followed, Alto featured a graphical-user interface and was among the first commercially available workstations controlled with a mouse. Inspired by Alto, Reddy launched a drive for development of CMU\u2019s own \u201cthree-M\u201d machine\u2014a personal workstation with a megabyte of memory, a megapixel display and at least one million instructions per second of processing power.\n|10 intrapreneurship and entrepreneurship and enco urages students to develop ideas for startups and for introduction into established companies. The curriculum is designed for students who have a strong background in computer science with interest in in-depth study of AI to ena ble them to develop re al-world applications, especially in areas to which AI has not yet b een applied. The integrated curriculum includes coursework and team projects lead ing to a full-semester capstone project to produce a working prototype. 8.2 Program Contacts Michael I. Shamos Director, MSAII Distinguished Career Professor G H C 6 7 0 7 shamos@cs.cmu.edu Amber Vivis Academic Program Manager, MSAII TCS 357 412-268-9998 avivis@cs.cmu.edu Carolyn Penstein Ros\u00e9 Interim Director, Language Technologies Institute Professor GHC 5415 412-268-7130 cprose@cs.cmu.edu 8.3 The Reasonable Person Principle (RPP) It is a long-standing and revered principle of the School of Computer Science (SCS) that members of our community are expe cted to act reasonably, and ther efore we try to keep formal, written SCS policies to a minimum. The faculty do not burden the students with numerous rules, and, in return, we expect the students to not try to find technical loopholes that violate the clear intent of program policies. In any situa tion not covered by an ex plicit rule, you should ask yourself how reasonable people would behave in that situation. The RPP does not alter University-wide policies. 8.4 Academic Calendar",
        "retrieved_relevant_part": false,
        "model_answer": "Steve Jobs was impressed with the email system at CMU, which inspired him to build a similar system for Apple",
        "actual_answer": "attaching documents to email",
        "exact_match": false,
        "f1_max_min_avg": [
            0.17,
            0.17,
            0.17
        ],
        "recall_max_min_avg": [
            0.5,
            0.5,
            0.5
        ]
    },
    {
        "question": "Which CMU researchers are decoding brain scans and making progress at reading people's thoughts?",
        "context": "19. Thought reading programs, 2007Your brain reacts in different ways, depending on what words you\u2019re thinking about --- ways that are measurable with magnetic-resonance imaging, or MRI, machines. CMU researchers Tom Mitchell and Marcel Just are decoding those brain scans and are making progress at reading people\u2019s thoughts.",
        "retrieved_doc": "19. Thought reading programs, 2007Your brain reacts in different ways, depending on what words you\u2019re thinking about --- ways that are measurable with magnetic-resonance imaging, or MRI, machines. CMU researchers Tom Mitchell and Marcel Just are decoding those brain scans and are making progress at reading people\u2019s thoughts.|Author: Graham Neubig Title: Divergences between Language Models and Human Brains Publication year: 2023 Coauthors: Yuchen Zhou, Emmy Liu, Graham Neubig, Leila Wehbe Abstract: Do machines and humans process language in similar ways? Recent research has hinted in the affirmative, finding that brain signals can be effectively predicted using the internal representations of language models (LMs). Although such results are thought to reflect shared computational principles between LMs and human brains, there are also clear differences in how LMs and humans represent and use language. In this work, we systematically explore the divergences between human and machine language processing by examining the differences between LM representations and human brain responses to language as measured by Magnetoencephalography (MEG) across two datasets in which subjects read and listened to narrative stories. Using a data-driven approach, we identify two domains that are not captured well by LMs: social/emotional intelligence and physical commonsense. We then validate these domains with human behavioral experiments and show that fine-tuning LMs on these domains can improve their alignment with human brain responses.|Author: Maarten Sap Title: Clever Hans or Neural Theory of Mind? Stress Testing Social Reasoning in Large Language Models Publication year: 2023 Coauthors: Natalie Shapira, Mosh Levy, S. Alavi, Xuhui Zhou, Yejin Choi, Yoav Goldberg, Maarten Sap, Vered Shwartz Abstract: The escalating debate on AI's capabilities warrants developing reliable metrics to assess machine\"intelligence\". Recently, many anecdotal examples were used to suggest that newer large language models (LLMs) like ChatGPT and GPT-4 exhibit Neural Theory-of-Mind (N-ToM); however, prior work reached conflicting conclusions regarding those abilities. We investigate the extent of LLMs' N-ToM through an extensive evaluation on 6 tasks and find that while LLMs exhibit certain N-ToM abilities, this behavior is far from being robust. We further examine the factors impacting performance on N-ToM tasks and discover that LLMs struggle with adversarial examples, indicating reliance on shallow heuristics rather than robust ToM abilities. We caution against drawing conclusions from anecdotal examples, limited benchmark testing, and using human-designed psychological tests to evaluate models.|Yonatan Bisk Assistant Professor Email: ybisk@cs.cmu.edu Office: Gates & Hillman Centers Research Areas: Grounding, RoboNLP, Vision and Language, Embodiment, Unsupervised Learning|Ralf Brown Principal Systems Scientist Email: ralf@andrew.cmu.edu Office: 5711 Gates & Hillman Centers Phone: 412-268-8298 Research Areas: Information Extraction, Summarization and Question Answering, Information Retrieval, Text Mining and Analytics, Machine Translation, Natural Language Processing and Computational Linguistics|in neuroscience, is social chair for Fringe. She came to CMU wanting to drive, but first she had to get over being claustrophobic. She started as a mechanic and got behind the wheel for last year's Sweepstakes. \"Our team's philosophy is to teach",
        "retrieved_relevant_part": true,
        "model_answer": "Tom Mitchell and Marcel Just",
        "actual_answer": "Tom Mitchell and Marcel Just",
        "exact_match": true,
        "f1_max_min_avg": [
            1.0,
            1.0,
            1.0
        ],
        "recall_max_min_avg": [
            1.0,
            1.0,
            1.0
        ]
    },
    {
        "question": "What is the name of the vihecle that Red Whittaker developed to inspect and clean up the contaminated reactor building at the crippled Three Mile Island nuclear plant?",
        "context": "7. Autonomous robots, 1983Thanks to Red Whittaker (E'75,'79), robots moved off of the assembly lines and into places no human ever could go. His Robotic Reconnaissance Vehicle spent four years inspecting and cleaning up the contaminated reactor building at the crippled Three Mile Island nuclear plant.",
        "retrieved_doc": "7. Autonomous robots, 1983Thanks to Red Whittaker (E'75,'79), robots moved off of the assembly lines and into places no human ever could go. His Robotic Reconnaissance Vehicle spent four years inspecting and cleaning up the contaminated reactor building at the crippled Three Mile Island nuclear plant.|Fall offering: Course: 18873 Title: Spacecraft Design-Build-Fly Laboratory Units: 12.0 Lec/Sec: Section A Days: Monday, Wednesday Begin: 03:30PM End: 04:50PM Bldg/Room: NSH 1305 Location: Pittsburgh, Pennsylvania Instructor(s): Lucia, Manchester |Fall offering: Course: 27500 Title: Metal-Environment Reactions Units: 9.0 Lec/Sec: Section A Days: Tuesday, Thursday Begin: 10:00AM End: 11:50AM Bldg/Room: WEH 5421 Location: Pittsburgh, Pennsylvania Instructor(s): Webler |Fall offering: Course: 85735 Title: biologically intelligent exploration Units: 12.0 Lec/Sec: Section A Days: Tuesday, Thursday Begin: 02:00PM End: 03:20PM Bldg/Room: BH 336B Location: Pittsburgh, Pennsylvania Instructor(s): Verstynen |Spring offering: Course: 12728 Title: Remediation Engineering Units: 12.0 Lec/Sec: Section A Days: Monday Begin: 06:00PM End: 08:50PM Bldg/Room: GHC 4211 Location: Pittsburgh, Pennsylvania Instructor(s): Wice |17. Robotic video cameras, 2001When Baltimore Ravens quarterback Trent Dilfer dropped back to pass, TV viewers of Super Bowl XXXV saw something they\u2019d never seen before --- the motion froze and the view suddenly rotated to show Dilfer\u2019s opposite side. CBS called it Eyevision. The synchronized system of robotic cameras and advanced image processing was the brainchild of CMU\u2019s Takeo Kanade, one of many advances he pioneered in computer vision.",
        "retrieved_relevant_part": true,
        "model_answer": "The Robotic Reconnaissance Vehicle",
        "actual_answer": "The Remote Reconnaissance Vehicle",
        "exact_match": false,
        "f1_max_min_avg": [
            0.75,
            0.75,
            0.75
        ],
        "recall_max_min_avg": [
            0.75,
            0.75,
            0.75
        ]
    },
    {
        "question": "Who are credited with defining the term computer science",
        "context": "\nFirst freshman-level computer science course\n\nIn 1956 and 1957, Simon, Allen Newell (IA'57) and Cliff Shaw of RAND designed the Logic Theorist, a computer program that could develop proofs for theorems in much the same way a human would work. They also developed linked-list data structures, the foundation of computer programming. Perlis, Simon and Newell are credited with defining the term \u201ccomputer science\u201d as \u201cthe theory and design of computers,\u201d as well as (in Newell\u2019s words) \u201cthe study of the phenomena arising from them.\u201d In 1958, Perlis began teaching the first freshman-level computer programming course in the United States at Carnegie Tech.\n",
        "retrieved_doc": "\nFirst freshman-level computer science course\n\nIn 1956 and 1957, Simon, Allen Newell (IA'57) and Cliff Shaw of RAND designed the Logic Theorist, a computer program that could develop proofs for theorems in much the same way a human would work. They also developed linked-list data structures, the foundation of computer programming. Perlis, Simon and Newell are credited with defining the term \u201ccomputer science\u201d as \u201cthe theory and design of computers,\u201d as well as (in Newell\u2019s words) \u201cthe study of the phenomena arising from them.\u201d In 1958, Perlis began teaching the first freshman-level computer programming course in the United States at Carnegie Tech.\n|What\u2019s so great about computer science at Carnegie Mellon?We're glad you asked! Here are 25 great ideas from CMU computer scientists to think about as we celebrate the birthday of the School of Computer Science.1. Artificial intelligence, 1955-56\u00a0Can you write a working computer program without a computer? Herb Simon (H\u201990), at left, Allen Newell (IA\u201957), at right, and Cliff Shaw did. The team created the first artificial intelligence program, Logic Theorist, which could solve logic puzzles in the same way that a human might solve them. Newell demonstrated that it worked by writing the instructions on 3-by-5 index cards that were manipulated on the kitchen table by Newell, his wife, and a group of Carnegie Tech grad students.|public sector. 1986:\u00a0School of Computer Science, pioneering computing and artificial intelligence, led by interdisciplinary efforts of Allen Newell and Herbert Simon.    Carnegie Mellon University  In 1967, Carnegie Tech merged with the Mellon| \nComputer science Ph.D. program created\n\nIn 1961, the Computation Center and its newest computer, a Bendix G-20, were moved to recently completed Scaife Hall. That same year, Carnegie Tech created an interdisciplinary Ph.D. program called Systems and Communications Sciences, combining elements of computer science, mathematics, psychology, business and electrical engineering. The university\u2019s first computer science Ph.D.s were graduates of this program.\n|\nA history of SCS\n\nFor an expanded history of the School of Computer Science and its predecessors at CMU, read \"Institutional Memories\" in the Summer 2014 issue of The Link magazine.\n\nIn 2014, the School of Computer Science celebrated its 25th year as a stand-alone college within Carnegie Mellon University. It was arguably the first college devoted solely to computer science in the United States, and a model for others that followed. But CMU\u2019s computer science era begins much earlier\u2014in 1956, with the arrival of an IBM 650 computer on the campus of what was then known as Carnegie Institute of Technology. The IBM 650 had magnetic-drum memory and a processing speed of approximately 60 instructions per second. Herb Simon (H\u201990), associate dean of the Graduate School of Industrial Administration\u2014now known as CMU\u2019s Tepper School of Business\u2014established Carnegie Tech\u2019s first Computation Center with the help of its first director, Alan Perlis (S\u201942).\n| \nSCS is officially formed\n\nCMU\u2019s Faculty Senate in the fall of 1988 agreed to President Richard Cyert\u2019s plan to elevate the Department of Computer Science to college status. In addition to the Computer Science Department, SCS also incorporated the Robotics Institute, the Center for Machine Translation, and researchers from the Information Technology Center, which had developed Andrew. On Dec. 13, 1988, Cyert (H\u201989) told faculty and staff that Habermann had been appointed CMU\u2019s first Dean of Computer Science, effective Dec. 1, and that the School of Computer Science would soon begin operations. SCS made its formal debut on Dec. 22, 1988, with a reception in the Wherrett Room of Skibo Hall, CMU\u2019s student union. The official announcement of CMU\u2019s new \u201cgraduate School of Computer Science\u201d was made Jan. 3, 1989.\n",
        "retrieved_relevant_part": true,
        "model_answer": "Simon, Allen Newell (IA'57) and Cliff Shaw are credited with defining the term computer science",
        "actual_answer": "Perlis, Simon and Newell",
        "exact_match": false,
        "f1_max_min_avg": [
            0.21,
            0.21,
            0.21
        ],
        "recall_max_min_avg": [
            0.5,
            0.5,
            0.5
        ]
    },
    {
        "question": "How many faculty members did the School of Computer Science have in 2013?",
        "context": "\nCommitted to extending our founders\u2019 vision\n\nThe School of Computer Science at Carnegie Mellon University enters its second quarter century as a world-leading educational and research institution, embracing all facets of computing. Its graduate programs are consisted ranked with the best in the world by a leading U.S. magazine, while its undergraduate programs are also rated the best in the U.S. by corporate recruiters. In 2013, SCS had 284 faculty members and a total student enrollment of nearly 1,700, including undergraduate, master\u2019s and Ph.D. students, and conducted $124 million in research. Indeed, by itself, the Robotics Institute is the largest university robotics research group in the world, with more than 500 people and more than 100 ongoing research projects. A half-century ago, Perlis, Simon and Newell outlined a vision for computer science. The School of Computer Science at CMU remains committed to continuing and extending their vision in the context of big data and connected computing in the 21st century.\n",
        "retrieved_doc": " \nCommitted to extending our founders\u2019 vision\n\nThe School of Computer Science at Carnegie Mellon University enters its second quarter century as a world-leading educational and research institution, embracing all facets of computing. Its graduate programs are consisted ranked with the best in the world by a leading U.S. magazine, while its undergraduate programs are also rated the best in the U.S. by corporate recruiters. In 2013, SCS had 284 faculty members and a total student enrollment of nearly 1,700, including undergraduate, master\u2019s and Ph.D. students, and conducted $124 million in research. Indeed, by itself, the Robotics Institute is the largest university robotics research group in the world, with more than 500 people and more than 100 ongoing research projects. A half-century ago, Perlis, Simon and Newell outlined a vision for computer science. The School of Computer Science at CMU remains committed to continuing and extending their vision in the context of big data and connected computing in the 21st century.\n|public sector. 1986:\u00a0School of Computer Science, pioneering computing and artificial intelligence, led by interdisciplinary efforts of Allen Newell and Herbert Simon.    Carnegie Mellon University  In 1967, Carnegie Tech merged with the Mellon|\nA history of SCS\n\nFor an expanded history of the School of Computer Science and its predecessors at CMU, read \"Institutional Memories\" in the Summer 2014 issue of The Link magazine.\n\nIn 2014, the School of Computer Science celebrated its 25th year as a stand-alone college within Carnegie Mellon University. It was arguably the first college devoted solely to computer science in the United States, and a model for others that followed. But CMU\u2019s computer science era begins much earlier\u2014in 1956, with the arrival of an IBM 650 computer on the campus of what was then known as Carnegie Institute of Technology. The IBM 650 had magnetic-drum memory and a processing speed of approximately 60 instructions per second. Herb Simon (H\u201990), associate dean of the Graduate School of Industrial Administration\u2014now known as CMU\u2019s Tepper School of Business\u2014established Carnegie Tech\u2019s first Computation Center with the help of its first director, Alan Perlis (S\u201942).\n| \nSCS is officially formed\n\nCMU\u2019s Faculty Senate in the fall of 1988 agreed to President Richard Cyert\u2019s plan to elevate the Department of Computer Science to college status. In addition to the Computer Science Department, SCS also incorporated the Robotics Institute, the Center for Machine Translation, and researchers from the Information Technology Center, which had developed Andrew. On Dec. 13, 1988, Cyert (H\u201989) told faculty and staff that Habermann had been appointed CMU\u2019s first Dean of Computer Science, effective Dec. 1, and that the School of Computer Science would soon begin operations. SCS made its formal debut on Dec. 22, 1988, with a reception in the Wherrett Room of Skibo Hall, CMU\u2019s student union. The official announcement of CMU\u2019s new \u201cgraduate School of Computer Science\u201d was made Jan. 3, 1989.\n| \nUndergraduate degrees begin\n\nFor several years, undergraduates interested in computer science pursued an \u201capplied math/CS\u201d bachelor\u2019s degree offered by the Mathematics Department. CSD professor Mary Shaw (CS\u201972) led CMU\u2019s first effort to design an undergraduate curriculum solely in computer science. She and her colleagues were guided by the Carnegie Plan\u2014guidelines established in 1938 under Carnegie Tech President Robert Doherty (A\u201940, E\u201948, H\u201950), outlining the principles of a sound professional education. Drawing on Shaw\u2019s plan and also on the work of other faculty members, an undergraduate program in computer science was created during the 1989-90 academic year. Seven CS majors were admitted to the program as sophomores. Another 73 undergraduates were admitted in 1990\u201391. By 1995, there were 401 undergraduates in the School of Computer Science; in fall 2013, more than 600 undergraduates made up about 37 percent of student enrollment at SCS, along with more than 600 master\u2019s degree students.\n| \nNew departments, new areas of study\n\nAlong the way, the Center for Machine Translation became the Language Technologies Institute, and other new departments were formed, including the Human-Computer Interaction Institute (1993), the Institute for Software Research (1999), the Machine Learning Department (2006) and the Ray and Stephanie Lane Center for Computational Biology (2009). SCS\u2019s seven degree-granting departments draw faculty and students from a wide variety of disciplines, including engineering, mathematics, social sciences, linguistics and design.\n",
        "retrieved_relevant_part": false,
        "model_answer": "The School of Computer Science had 284 faculty members in 2013",
        "actual_answer": "284",
        "exact_match": false,
        "f1_max_min_avg": [
            0.17,
            0.17,
            0.17
        ],
        "recall_max_min_avg": [
            1.0,
            1.0,
            1.0
        ]
    },
    {
        "question": "Who received the A.M. Turing Award in 1975 for their work in artificial intelligence?",
        "context": "\nTuring Awards and a Nobel Prize\n\nIn 1975, Simon and Newell were awarded the A.M. Turing Award for their work in artificial intelligence. (As of 2014, 12 CMU alumni or faculty have been awarded Turings, sometimes considered the Nobel Prize of computing.) Three years later, Simon received the Nobel Prize in Economics for his work on decision-making theory. As the 1970s progressed, Newell became interested in human-computer interaction, and began a long relationship with Xerox\u2019s Palo Alto Research Center, or PARC, which released the Xerox Alto in 1973. Considered a forerunner to many of the computing environments that followed, Alto featured a graphical-user interface and was among the first commercially available workstations controlled with a mouse. Inspired by Alto, Reddy launched a drive for development of CMU\u2019s own \u201cthree-M\u201d machine\u2014a personal workstation with a megabyte of memory, a megapixel display and at least one million instructions per second of processing power.\n",
        "retrieved_doc": " \nTuring Awards and a Nobel Prize\n\nIn 1975, Simon and Newell were awarded the A.M. Turing Award for their work in artificial intelligence. (As of 2014, 12 CMU alumni or faculty have been awarded Turings, sometimes considered the Nobel Prize of computing.) Three years later, Simon received the Nobel Prize in Economics for his work on decision-making theory. As the 1970s progressed, Newell became interested in human-computer interaction, and began a long relationship with Xerox\u2019s Palo Alto Research Center, or PARC, which released the Xerox Alto in 1973. Considered a forerunner to many of the computing environments that followed, Alto featured a graphical-user interface and was among the first commercially available workstations controlled with a mouse. Inspired by Alto, Reddy launched a drive for development of CMU\u2019s own \u201cthree-M\u201d machine\u2014a personal workstation with a megabyte of memory, a megapixel display and at least one million instructions per second of processing power.\n|What\u2019s so great about computer science at Carnegie Mellon?We're glad you asked! Here are 25 great ideas from CMU computer scientists to think about as we celebrate the birthday of the School of Computer Science.1. Artificial intelligence, 1955-56\u00a0Can you write a working computer program without a computer? Herb Simon (H\u201990), at left, Allen Newell (IA\u201957), at right, and Cliff Shaw did. The team created the first artificial intelligence program, Logic Theorist, which could solve logic puzzles in the same way that a human might solve them. Newell demonstrated that it worked by writing the instructions on 3-by-5 index cards that were manipulated on the kitchen table by Newell, his wife, and a group of Carnegie Tech grad students.|15. Model checking, 1994CMU professor Edmund Clarke had long stressed the importance of verifying computer hardware and software through a formal problem-solving technique called \u201cmodel checking.\u201d In 1994, his arguments gained new weight with the discovery that Intel\u2019s amazing new Pentium chip made errors on certain math problems. Clarke would go on to receive the Turing Award for his role in the development of model checking.|public sector. 1986:\u00a0School of Computer Science, pioneering computing and artificial intelligence, led by interdisciplinary efforts of Allen Newell and Herbert Simon.    Carnegie Mellon University  In 1967, Carnegie Tech merged with the Mellon|9 University Professor GHC 6105 412-268-5704 hebert@cs.cmu.edu https://www.cs.cmu.edu/~hebert/ David Garlan Associate Dean for Master\u2019s Programs, SCS Professor TCS 420 garlan@cs.cmu.edu http://www.cs.cmu.edu/~garlan/academics.htm C a r o l y n R o s \u00e9 Interim Director, Language Technologies Institute Professor GHC 5415 412-268-7130 cprose@cs.cmu.edu 8 MSAII Policies The Language Technologies Institute (LTI) ha s prepared this statement of policies, program requirements, guidance, process a nd procedures for students in the M.S. in Artificial Intelligence and Innovation (MSAII) program. A copy of this handbook is also available online at the program website . The University Student guide, The Word, which details university-wide policies, is also available online at www.cmu.edu/student-affairs/theword . Additional resources specific to gr aduate students can be found at www.cmu.edu/graduate/policies/ 8.1 The MSAII Degree The M.S. in Artificial Intelli gence and Innovation (MSAII) is a professional master's program offered by the Language Technologies Institute (LTI) in the School of Computer Science at Carnegie Mellon University. This program seeks to educate students in the innovative use of artificial intelligence to create practical soluti ons in a wide variety of application areas. As artificial intelligence matures, th ere is a great need for students who can envision, design, plan and deliver solutions that integrate AI technolo gies such as deep learning, natural language processing, robotics and big data analytics into new applications. The program stresses both|11. Computer chess, 1990Could a computer play chess at the level of the world\u2019s best players? For many years, it was considered the \u201choly grail\u201d of artificial intelligence. Hitech, developed by CMU researcher Hans Berliner (CS\u201974), was the first computer to achieve grandmaster status. CMU alumni played key roles in developing \u201cDeep Blue,\u201d the IBM machine that beat human chess champion Garry Kasparov in 1997.",
        "retrieved_relevant_part": false,
        "model_answer": "Simon and Newell",
        "actual_answer": "Herbert Simon and Allen Newell",
        "exact_match": false,
        "f1_max_min_avg": [
            0.75,
            0.75,
            0.75
        ],
        "recall_max_min_avg": [
            0.6,
            0.6,
            0.6
        ]
    },
    {
        "question": "How many CMU alumni or faculty have been awarded the Turing Award as of 2014?",
        "context": "\nTuring Awards and a Nobel Prize\n\nIn 1975, Simon and Newell were awarded the A.M. Turing Award for their work in artificial intelligence. (As of 2014, 12 CMU alumni or faculty have been awarded Turings, sometimes considered the Nobel Prize of computing.) Three years later, Simon received the Nobel Prize in Economics for his work on decision-making theory. As the 1970s progressed, Newell became interested in human-computer interaction, and began a long relationship with Xerox\u2019s Palo Alto Research Center, or PARC, which released the Xerox Alto in 1973. Considered a forerunner to many of the computing environments that followed, Alto featured a graphical-user interface and was among the first commercially available workstations controlled with a mouse. Inspired by Alto, Reddy launched a drive for development of CMU\u2019s own \u201cthree-M\u201d machine\u2014a personal workstation with a megabyte of memory, a megapixel display and at least one million instructions per second of processing power.\n",
        "retrieved_doc": "Carnegie Mellon University has been a birthplace  of innovation since its founding in 1900. Today, CMU is a global leader bringing groundbreaking  ideas to market and creating successful startup  businesses. Our award-winning faculty are renowned for  working closely with students to solve major scientific,  technological and societal challenges. We put a strong  emphasis on creating things \u2014 from art to robots. We  have become a model for economic development in  forming partnerships with companies such as Uber,  Google and Disney. Our students are recruited by some  of the world\u2019s most innovative companies. MANAGEMENT  INFORMATION  SYSTEMS U.S. News & World Report, 2022#1 ARTIFICIAL  INTELLIGENCE U.S. News & World Report, 2022#1 AMONG U.S.   UNIVERSITIES Times Higher Education   World University  Ranking, 2023#19SOFTWARE  ENGINEERING U.S. News & World Report, 2022COLLEGE OF  ENGINEERING U.S. News & World Report, 2022#1 #4#1SCHOOL OF  COMPUTER  SCIENCE U.S. News & World Report, 2022 UNIVERSITY   IN THE WORLD Times Higher Education   World University   Ranking, 2023#28TIME-BASED/   NEW MEDIA U.S. News & World Report, 2019#11,529   FACULTY16,779   STUDENTSGraduate Undergraduate 117,257  ALUMNI (LIVING) 85%  U.S. 15%  International35%  U.S. 65%  International 76%  U.S. 24%  InternationalGLOBAL COMMUNITY Students representing 126 countries Faculty representing 56 countries Alumni representing  148 countries OF COMPUTER  SCIENCE\u2019S FIRST- YEAR STUDENTS   WERE WOMEN   IN 2019 Nearly triple the   national average\u201c My Heart is in the Work. \u201d    Andrew Carnegie, Founder    November 15, 1900 49.8 % 87%  U.S. 13%  InternationalSCHOOLS AND COLLEGES College of Engineering  College of Fine Arts Dietrich College of Humanities   and Social Sciences Heinz College of Information Systems  and Public Policy Mellon College of Science School of Computer Science Tepper School of Business cmu.edu/assets/pdfs/cmu-fact-sheet.pdf    |   cmu.edu/about/awards.htmlMarch 2020BIG IDEAS THAT SHAPE YOUR WORLD START HERE 1,000+ companies greenlighted  across the U.S. and internationally  Cognitive tutors,  which improve  the math skills of 500,000+  students each year  The first U.S. school to award   a degree in drama  in 1914 James Gosling (SCS 1983)  invented the Java computer  programming language . The first exclusive higher  education partner of the Tony  Awards\u00ae , co-creating the first,  national recognition program  honoring K-12 theatre educators The first smile in an email , created  in 1982 by professor Scott Fahlman Kevlar Fiber , invented by alumna  Stephanie Kwolek (MM 1946) The Last Lecture , written   by alumni Randy Pausch (SCS 1988)   and Jeffrey Zaslow (DC 1980) In 1919, CMU\u2019s first Ph.D.  was  awarded to Mao Yisheng, father   of Chinese bridge construction.  Duolingo , invented by professor   Luis von Ahn (CS 2003, 2005), had   10 million downloads in 12 months  and was named Apple\u2019s 2013 app   of the year. :-) LEADERSHIP Farnam Jahanian    President David Coulter   Chair, Board of Trustees James H. Garrett Jr.   Provost2 National Academy of Engineering       3 National Academy of Sciences        4 National Academy of Medicine  Won by alumni and current/former faculty The leading university center  for cybersecurity , providing  support to more than 110  centers around the world  The world\u2019s first university  robotics department ,   founded in 1979 Alumnus Andy Warhol    (CFA1949), pop artist pioneer   and cultural icon One of only 29 universities   invited to be a member of the  World Economic Forum\u2019s  Global University   Leaders Forum CMU.EDU ECONOMIC IMPACT \u2022 Attracting major companies  \u2014   including Google, Intel, Uber and GE \u2014   to locate operations and create new   jobs in Pittsburgh \u2022 To date, the CMU community has  launched more than 400 startups   and created more than 152 spinoff  companies . \u2022 Contributing to the cultural and civic life of   the city with performances , exhibitions   and research collaborations 13 ACADEMY   AWARDS65 MEMBERS   OF NAE2 146 EMMY   AWARDS20 MEMBERS   OF NAS3 6 MEMBERS   OF NAM4 13 TURING   AWARDS 20 NOBEL   LAUREATES 58 TONY   AWARDS May 2023| \nTuring Awards and a Nobel Prize\n\nIn 1975, Simon and Newell were awarded the A.M. Turing Award for their work in artificial intelligence. (As of 2014, 12 CMU alumni or faculty have been awarded Turings, sometimes considered the Nobel Prize of computing.) Three years later, Simon received the Nobel Prize in Economics for his work on decision-making theory. As the 1970s progressed, Newell became interested in human-computer interaction, and began a long relationship with Xerox\u2019s Palo Alto Research Center, or PARC, which released the Xerox Alto in 1973. Considered a forerunner to many of the computing environments that followed, Alto featured a graphical-user interface and was among the first commercially available workstations controlled with a mouse. Inspired by Alto, Reddy launched a drive for development of CMU\u2019s own \u201cthree-M\u201d machine\u2014a personal workstation with a megabyte of memory, a megapixel display and at least one million instructions per second of processing power.\n| \nCommitted to extending our founders\u2019 vision\n\nThe School of Computer Science at Carnegie Mellon University enters its second quarter century as a world-leading educational and research institution, embracing all facets of computing. Its graduate programs are consisted ranked with the best in the world by a leading U.S. magazine, while its undergraduate programs are also rated the best in the U.S. by corporate recruiters. In 2013, SCS had 284 faculty members and a total student enrollment of nearly 1,700, including undergraduate, master\u2019s and Ph.D. students, and conducted $124 million in research. Indeed, by itself, the Robotics Institute is the largest university robotics research group in the world, with more than 500 people and more than 100 ongoing research projects. A half-century ago, Perlis, Simon and Newell outlined a vision for computer science. The School of Computer Science at CMU remains committed to continuing and extending their vision in the context of big data and connected computing in the 21st century.\n|What\u2019s so great about computer science at Carnegie Mellon?We're glad you asked! Here are 25 great ideas from CMU computer scientists to think about as we celebrate the birthday of the School of Computer Science.1. Artificial intelligence, 1955-56\u00a0Can you write a working computer program without a computer? Herb Simon (H\u201990), at left, Allen Newell (IA\u201957), at right, and Cliff Shaw did. The team created the first artificial intelligence program, Logic Theorist, which could solve logic puzzles in the same way that a human might solve them. Newell demonstrated that it worked by writing the instructions on 3-by-5 index cards that were manipulated on the kitchen table by Newell, his wife, and a group of Carnegie Tech grad students.|9 University Professor GHC 6105 412-268-5704 hebert@cs.cmu.edu https://www.cs.cmu.edu/~hebert/ David Garlan Associate Dean for Master\u2019s Programs, SCS Professor TCS 420 garlan@cs.cmu.edu http://www.cs.cmu.edu/~garlan/academics.htm C a r o l y n R o s \u00e9 Interim Director, Language Technologies Institute Professor GHC 5415 412-268-7130 cprose@cs.cmu.edu 8 MSAII Policies The Language Technologies Institute (LTI) ha s prepared this statement of policies, program requirements, guidance, process a nd procedures for students in the M.S. in Artificial Intelligence and Innovation (MSAII) program. A copy of this handbook is also available online at the program website . The University Student guide, The Word, which details university-wide policies, is also available online at www.cmu.edu/student-affairs/theword . Additional resources specific to gr aduate students can be found at www.cmu.edu/graduate/policies/ 8.1 The MSAII Degree The M.S. in Artificial Intelli gence and Innovation (MSAII) is a professional master's program offered by the Language Technologies Institute (LTI) in the School of Computer Science at Carnegie Mellon University. This program seeks to educate students in the innovative use of artificial intelligence to create practical soluti ons in a wide variety of application areas. As artificial intelligence matures, th ere is a great need for students who can envision, design, plan and deliver solutions that integrate AI technolo gies such as deep learning, natural language processing, robotics and big data analytics into new applications. The program stresses both|\nA history of SCS\n\nFor an expanded history of the School of Computer Science and its predecessors at CMU, read \"Institutional Memories\" in the Summer 2014 issue of The Link magazine.\n\nIn 2014, the School of Computer Science celebrated its 25th year as a stand-alone college within Carnegie Mellon University. It was arguably the first college devoted solely to computer science in the United States, and a model for others that followed. But CMU\u2019s computer science era begins much earlier\u2014in 1956, with the arrival of an IBM 650 computer on the campus of what was then known as Carnegie Institute of Technology. The IBM 650 had magnetic-drum memory and a processing speed of approximately 60 instructions per second. Herb Simon (H\u201990), associate dean of the Graduate School of Industrial Administration\u2014now known as CMU\u2019s Tepper School of Business\u2014established Carnegie Tech\u2019s first Computation Center with the help of its first director, Alan Perlis (S\u201942).\n",
        "retrieved_relevant_part": false,
        "model_answer": "More than 400",
        "actual_answer": "12",
        "exact_match": false,
        "f1_max_min_avg": [
            0,
            0,
            0.0
        ],
        "recall_max_min_avg": [
            0,
            0,
            0.0
        ]
    },
    {
        "question": "What was the Center for Machine Translation renamed to?",
        "context": " \nNew departments, new areas of study\n\nAlong the way, the Center for Machine Translation became the Language Technologies Institute, and other new departments were formed, including the Human-Computer Interaction Institute (1993), the Institute for Software Research (1999), the Machine Learning Department (2006) and the Ray and Stephanie Lane Center for Computational Biology (2009). SCS\u2019s seven degree-granting departments draw faculty and students from a wide variety of disciplines, including engineering, mathematics, social sciences, linguistics and design.\n",
        "retrieved_doc": " \nNew departments, new areas of study\n\nAlong the way, the Center for Machine Translation became the Language Technologies Institute, and other new departments were formed, including the Human-Computer Interaction Institute (1993), the Institute for Software Research (1999), the Machine Learning Department (2006) and the Ray and Stephanie Lane Center for Computational Biology (2009). SCS\u2019s seven degree-granting departments draw faculty and students from a wide variety of disciplines, including engineering, mathematics, social sciences, linguistics and design.\n|Author: David R. Mortensen Title: ChatGPT MT: Competitive for High- (but Not Low-) Resource Languages Publication year: 2023 Coauthors: Nathaniel R. Robinson, Perez Ogayo, David R. Mortensen, Graham Neubig Abstract: Large language models (LLMs) implicitly learn to perform a range of language tasks, including machine translation (MT). Previous studies explore aspects of LLMs\u2019 MT capabilities. However, there exist a wide variety of languages for which recent LLM MT performance has never before been evaluated. Without published experimental evidence on the matter, it is difficult for speakers of the world\u2019s diverse languages to know how and whether they can use LLMs for their languages. We present the first experimental evidence for an expansive set of 204 languages, along with MT cost analysis, using the FLORES-200 benchmark. Trends reveal that GPT models approach or exceed traditional MT model performance for some high-resource languages (HRLs) but consistently lag for low-resource languages (LRLs), under-performing traditional MT for 84.1% of languages we covered. Our analysis reveals that a language\u2019s resource level is the most important feature in determining ChatGPT\u2019s relative ability to translate it, and suggests that ChatGPT is especially disadvantaged for LRLs and African languages.|Author: Graham Neubig Title: ChatGPT MT: Competitive for High- (but Not Low-) Resource Languages Publication year: 2023 Coauthors: Nathaniel R. Robinson, Perez Ogayo, David R. Mortensen, Graham Neubig Abstract: Large language models (LLMs) implicitly learn to perform a range of language tasks, including machine translation (MT). Previous studies explore aspects of LLMs\u2019 MT capabilities. However, there exist a wide variety of languages for which recent LLM MT performance has never before been evaluated. Without published experimental evidence on the matter, it is difficult for speakers of the world\u2019s diverse languages to know how and whether they can use LLMs for their languages. We present the first experimental evidence for an expansive set of 204 languages, along with MT cost analysis, using the FLORES-200 benchmark. Trends reveal that GPT models approach or exceed traditional MT model performance for some high-resource languages (HRLs) but consistently lag for low-resource languages (LRLs), under-performing traditional MT for 84.1% of languages we covered. Our analysis reveals that a language\u2019s resource level is the most important feature in determining ChatGPT\u2019s relative ability to translate it, and suggests that ChatGPT is especially disadvantaged for LRLs and African languages.|Author: Graham Neubig Title: Neural Machine Translation for the Indigenous Languages of the Americas: An Introduction Publication year: 2023 Coauthors: Manuel Mager, R. Bhatnagar, Graham Neubig, Ngoc Thang Vu, Katharina Kann Abstract: Neural models have drastically advanced state of the art for machine translation (MT) between high-resource languages. Traditionally, these models rely on large amounts of training data, but many language pairs lack these resources. However, an important part of the languages in the world do not have this amount of data. Most languages from the Americas are among them, having a limited amount of parallel and monolingual data, if any. Here, we present an introduction to the interested reader to the basic challenges, concepts, and techniques that involve the creation of MT systems for these languages. Finally, we discuss the recent advances and findings and open questions, product of an increased interest of the NLP community in these languages.|Author: Graham Neubig Title: The Devil Is in the Errors: Leveraging Large Language Models for Fine-grained Machine Translation Evaluation Publication year: 2023 Coauthors: Patrick Fernandes, Daniel Deutsch, M. Finkelstein, Parker Riley, Andr\u00e9 F. T. Martins, Graham Neubig, Ankush Garg, J. Clark, Markus Freitag, Orhan Firat Abstract: Automatic evaluation of machine translation (MT) is a critical tool driving the rapid iterative development of MT systems. While considerable progress has been made on estimating a single scalar quality score, current metrics lack the informativeness of more detailed schemes that annotate individual errors, such as Multidimensional Quality Metrics (MQM). In this paper, we help fill this gap by proposing AutoMQM, a prompting technique which leverages the reasoning and in-context learning capabilities of large language models (LLMs) and asks them to identify and categorize errors in translations. We start by evaluating recent LLMs, such as PaLM and PaLM-2, through simple score prediction prompting, and we study the impact of labeled data through in-context learning and finetuning. We then evaluate AutoMQM with PaLM-2 models, and we find that it improves performance compared to just prompting for scores (with particularly large gains for larger models) while providing interpretability through error spans that align with human annotations.|Lori Levin Research Professor Email: lsl@cs.cmu.edu Office: 5717 Gates & Hillman Centers Phone: 412-268-6193 Research Areas: Machine Translation, Natural Language Processing and Computational Linguistics, Corpus Annotation and Resources",
        "retrieved_relevant_part": true,
        "model_answer": "The Center for Machine Translation was renamed to David R. Mortensen in the year 2023",
        "actual_answer": "Language Technologies Institute",
        "exact_match": false,
        "f1_max_min_avg": [
            0,
            0,
            0.0
        ],
        "recall_max_min_avg": [
            0,
            0,
            0.0
        ]
    },
    {
        "question": "When was the Human-Computer Interaction Institute formed?",
        "context": " \nNew departments, new areas of study\n\nAlong the way, the Center for Machine Translation became the Language Technologies Institute, and other new departments were formed, including the Human-Computer Interaction Institute (1993), the Institute for Software Research (1999), the Machine Learning Department (2006) and the Ray and Stephanie Lane Center for Computational Biology (2009). SCS\u2019s seven degree-granting departments draw faculty and students from a wide variety of disciplines, including engineering, mathematics, social sciences, linguistics and design.\n",
        "retrieved_doc": "8. User interfaces, 1983Why should humans adapt to fit computers? Shouldn\u2019t computers adapt to fit humans? That was the attitude of CMU researchers, who applied design principles to computer science to develop better, easier-to-use interfaces. They called the new field \u201chuman-computer interaction.\u201d|Fall offering: Course: 05863 Title: Introduction to Human Computer Interaction for Technology Executives Units: 6.0 Lec/Sec: Section A1 Days: Tuesday, Thursday Begin: 12:30PM End: 01:50PM Bldg/Room: HH B131 Location: Pittsburgh, Pennsylvania Instructor(s): Pileggi |Spring offering: Course: 49780 Title: Human Computer Interaction & User Experience: Units: 6.0 Lec/Sec: Section R3 Days: Thursday Begin: 05:30PM End: 07:20PM Bldg/Room: TBA Location: San Jose, California Instructor(s): Dai | \nLaunching a Robotics Institute\n\nIn 1979, an executive at Pittsburgh\u2019s Westinghouse Electric Corp., Tom Murrin, collaborated with Jordan and Reddy to create the Robotics Institute, with Reddy as its first director. By 1982, the Computer Science Department included more than 30 faculty members and 100 graduate students.\n|Spring offering: Course: 49780 Title: Human Computer Interaction & User Experience: Units: 6.0 Lec/Sec: Section B4 Days: Thursday Begin: 07:30PM End: 09:20PM Bldg/Room: B23 109 Location: San Jose, California Instructor(s): Prayaga |Spring offering: Course: 05775 Title: Cognitive Perspectives in HCI Units: 6.0 Lec/Sec: Section A4 Days: Tuesday, Thursday Begin: 11:00AM End: 12:20PM Bldg/Room: WEH 5415 Location: Pittsburgh, Pennsylvania Instructor(s): Ogan ",
        "retrieved_relevant_part": false,
        "model_answer": "The Human-Computer Interaction Institute was formed in 1979",
        "actual_answer": "1993",
        "exact_match": false,
        "f1_max_min_avg": [
            0,
            0,
            0.0
        ],
        "recall_max_min_avg": [
            0,
            0,
            0.0
        ]
    },
    {
        "question": "When was the Ray and Stephanie Lane Center for Computational Biology established?",
        "context": " \nNew departments, new areas of study\n\nAlong the way, the Center for Machine Translation became the Language Technologies Institute, and other new departments were formed, including the Human-Computer Interaction Institute (1993), the Institute for Software Research (1999), the Machine Learning Department (2006) and the Ray and Stephanie Lane Center for Computational Biology (2009). SCS\u2019s seven degree-granting departments draw faculty and students from a wide variety of disciplines, including engineering, mathematics, social sciences, linguistics and design.\n",
        "retrieved_doc": "Spring offering: Course: 02702 Title: Computational Biology Seminar Units: 3.0 Lec/Sec: Section A Days: Friday Begin: 10:30AM End: 11:50AM Bldg/Room: TBA Location: Pittsburgh, Pennsylvania Instructor(s): Carja |Spring offering: Course: 02402 Title: Computational Biology Seminar Units: 3.0 Lec/Sec: Section A Days: Friday Begin: 10:30AM End: 11:50AM Bldg/Room: TBA Location: Pittsburgh, Pennsylvania Instructor(s): Carja | \nNew departments, new areas of study\n\nAlong the way, the Center for Machine Translation became the Language Technologies Institute, and other new departments were formed, including the Human-Computer Interaction Institute (1993), the Institute for Software Research (1999), the Machine Learning Department (2006) and the Ray and Stephanie Lane Center for Computational Biology (2009). SCS\u2019s seven degree-granting departments draw faculty and students from a wide variety of disciplines, including engineering, mathematics, social sciences, linguistics and design.\n|Fall offering: Course: 02702 Title: Computational Biology Seminar Units: 3.0 Lec/Sec: Section A Days: Friday Begin: 10:30AM End: 12:00PM Bldg/Room: OFF PITT Location: Pittsburgh, Pennsylvania Instructor(s): Carja |Spring offering: Course: 02250 Title: Introduction to Computational Biology Units: 12.0 Lec/Sec: Section Lec 1 Days: Monday, Wednesday, Friday Begin: 03:00PM End: 03:50PM Bldg/Room: DH 1212 Location: Pittsburgh, Pennsylvania Instructor(s): DeBlasio |Fall offering: Course: 03711 Title: Computational Molecular Biology and Genomics Units: 12.0 Lec/Sec: Section A Days: Tuesday, Thursday Begin: 09:30AM End: 10:50AM Bldg/Room: WEH 5409 Location: Pittsburgh, Pennsylvania Instructor(s): Durand ",
        "retrieved_relevant_part": true,
        "model_answer": "The Ray and Stephanie Lane Center for Computational Biology was established in 2009",
        "actual_answer": "2009",
        "exact_match": false,
        "f1_max_min_avg": [
            0.14,
            0.14,
            0.14
        ],
        "recall_max_min_avg": [
            1.0,
            1.0,
            1.0
        ]
    },
    {
        "question": "How did the Andrew Project transform Carnegie Mellon University?",
        "context": "The best-wired campus in the world: Working with IBM in the early 1980s, the university and the Computer Science Department established another new research frontier: Development of a high-speed computer network that would reach virtually every room on campus, along with a GUI-based computing environment, and providing networked PCs or workstations for 7,000 students, faculty members and employees. Called the Andrew Project, it turned Carnegie Mellon into the best-connected, most-wired university in the world\u2014a process Newell called \u201cgreening up the campus with computer science.\u201d CMU also became home to a new Software Engineering Institute, funded by the Defense Department, to study computer security and develop best practices in the design of operating systems. Between 1982 and 1985, the amount of sponsored research in the Computer Science Department doubled, from $7.2 million to $15.3 million\u2014more than the other four departments in the Mellon College of Science combined.",
        "retrieved_doc": "6. Andrew project, 1982It was long the dream of computer scientists to put a workstation in every home and office, but no one had actually tried to accomplish it until researchers from Carnegie Mellon University and IBM launched the Andrew Project. Soon, every student, faculty member and employee had access to email, word processing, file-transfer services and graphics programs, and CMU was the most-wired campus in the world.| \nThe best-wired campus in the world\n\nWorking with IBM in the early 1980s, the university and the Computer Science Department established another new research frontier: Development of a high-speed computer network that would reach virtually every room on campus, along with a GUI-based computing environment, and providing networked PCs or workstations for 7,000 students, faculty members and employees. Called the Andrew Project, it turned Carnegie Mellon into the best-connected, most-wired university in the world\u2014a process Newell called \u201cgreening up the campus with computer science.\u201d CMU also became home to a new Software Engineering Institute, funded by the Defense Department, to study computer security and develop best practices in the design of operating systems. Between 1982 and 1985, the amount of sponsored research in the Computer Science Department doubled, from $7.2 million to $15.3 million\u2014more than the other four departments in the Mellon College of Science combined\n|Carnegie Mellon University has been a birthplace  of innovation since its founding in 1900. Today, CMU is a global leader bringing groundbreaking  ideas to market and creating successful startup  businesses. Our award-winning faculty are renowned for  working closely with students to solve major scientific,  technological and societal challenges. We put a strong  emphasis on creating things \u2014 from art to robots. We  have become a model for economic development in  forming partnerships with companies such as Uber,  Google and Disney. Our students are recruited by some  of the world\u2019s most innovative companies. MANAGEMENT  INFORMATION  SYSTEMS U.S. News & World Report, 2022#1 ARTIFICIAL  INTELLIGENCE U.S. News & World Report, 2022#1 AMONG U.S.   UNIVERSITIES Times Higher Education   World University  Ranking, 2023#19SOFTWARE  ENGINEERING U.S. News & World Report, 2022COLLEGE OF  ENGINEERING U.S. News & World Report, 2022#1 #4#1SCHOOL OF  COMPUTER  SCIENCE U.S. News & World Report, 2022 UNIVERSITY   IN THE WORLD Times Higher Education   World University   Ranking, 2023#28TIME-BASED/   NEW MEDIA U.S. News & World Report, 2019#11,529   FACULTY16,779   STUDENTSGraduate Undergraduate 117,257  ALUMNI (LIVING) 85%  U.S. 15%  International35%  U.S. 65%  International 76%  U.S. 24%  InternationalGLOBAL COMMUNITY Students representing 126 countries Faculty representing 56 countries Alumni representing  148 countries OF COMPUTER  SCIENCE\u2019S FIRST- YEAR STUDENTS   WERE WOMEN   IN 2019 Nearly triple the   national average\u201c My Heart is in the Work. \u201d    Andrew Carnegie, Founder    November 15, 1900 49.8 % 87%  U.S. 13%  InternationalSCHOOLS AND COLLEGES College of Engineering  College of Fine Arts Dietrich College of Humanities   and Social Sciences Heinz College of Information Systems  and Public Policy Mellon College of Science School of Computer Science Tepper School of Business cmu.edu/assets/pdfs/cmu-fact-sheet.pdf    |   cmu.edu/about/awards.htmlMarch 2020BIG IDEAS THAT SHAPE YOUR WORLD START HERE 1,000+ companies greenlighted  across the U.S. and internationally  Cognitive tutors,  which improve  the math skills of 500,000+  students each year  The first U.S. school to award   a degree in drama  in 1914 James Gosling (SCS 1983)  invented the Java computer  programming language . The first exclusive higher  education partner of the Tony  Awards\u00ae , co-creating the first,  national recognition program  honoring K-12 theatre educators The first smile in an email , created  in 1982 by professor Scott Fahlman Kevlar Fiber , invented by alumna  Stephanie Kwolek (MM 1946) The Last Lecture , written   by alumni Randy Pausch (SCS 1988)   and Jeffrey Zaslow (DC 1980) In 1919, CMU\u2019s first Ph.D.  was  awarded to Mao Yisheng, father   of Chinese bridge construction.  Duolingo , invented by professor   Luis von Ahn (CS 2003, 2005), had   10 million downloads in 12 months  and was named Apple\u2019s 2013 app   of the year. :-) LEADERSHIP Farnam Jahanian    President David Coulter   Chair, Board of Trustees James H. Garrett Jr.   Provost2 National Academy of Engineering       3 National Academy of Sciences        4 National Academy of Medicine  Won by alumni and current/former faculty The leading university center  for cybersecurity , providing  support to more than 110  centers around the world  The world\u2019s first university  robotics department ,   founded in 1979 Alumnus Andy Warhol    (CFA1949), pop artist pioneer   and cultural icon One of only 29 universities   invited to be a member of the  World Economic Forum\u2019s  Global University   Leaders Forum CMU.EDU ECONOMIC IMPACT \u2022 Attracting major companies  \u2014   including Google, Intel, Uber and GE \u2014   to locate operations and create new   jobs in Pittsburgh \u2022 To date, the CMU community has  launched more than 400 startups   and created more than 152 spinoff  companies . \u2022 Contributing to the cultural and civic life of   the city with performances , exhibitions   and research collaborations 13 ACADEMY   AWARDS65 MEMBERS   OF NAE2 146 EMMY   AWARDS20 MEMBERS   OF NAS3 6 MEMBERS   OF NAM4 13 TURING   AWARDS 20 NOBEL   LAUREATES 58 TONY   AWARDS May 2023|In 1967, Carnegie Tech merged with the Mellon Institute, a science research center founded by the Mellon family of Pittsburgh, to become known as Carnegie Mellon University. The merger built upon a long history of support from the Mellons. It|Mellon has soared to national and international leadership in higher education and research. A birthplace of innovation since its founding, it continues to be known for innovation, for solving real-world problems and for interdisciplinary|shared vision of the founders and recognizing the impact it has had, and will continue to have, in the world of higher education, research and discovery.    A Global Impact  In its 115 years, Carnegie Mellon has soared to national and international",
        "retrieved_relevant_part": false,
        "model_answer": "The Andrew Project transformed Carnegie Mellon University by introducing a high-speed computer network and a Gui-based computing environment",
        "actual_answer": "It turned CMU into the best-connected, most-wired university in the world",
        "exact_match": false,
        "f1_max_min_avg": [
            0,
            0,
            0.0
        ],
        "recall_max_min_avg": [
            0,
            0,
            0.0
        ]
    },
    {
        "question": "When did Scotty's journey from popular icon to official mascot of the university begin?",
        "context": "Scotty's road from popular icon to official mascot of the university began in 2006. Carnegie Mellon formed a Mascot Identity Task Force in November 2006, which consisted of students, faculty, staff and alumni. The Task Force was co-chaired by Director of Athletics Susan Bassett and Dean of Student Affairs Jennifer Church.",
        "retrieved_doc": "Scotty's road from popular icon to official mascot of the university began in 2006. Carnegie Mellon formed a Mascot Identity Task Force in November 2006, which consisted of students, faculty, staff and alumni. The Task Force was co-chaired by|wasn't until 2007 that Carnegie Mellon officially welcomed the Scottish terrier as the university's first mascot.  In keeping with tradition, students, faculty, staff and alumni voted to name the new official mascot Scotty. But it's not just the|after Carnegie Mellon University opened its doors, an official mascot finally made its mark. Although students have dressed as a Scottish terrier \u2014 typically referred to as Scotty \u2014 for 50 years, it wasn't until 2007 that Carnegie Mellon officially|new official mascot Scotty. But it's not just the costumed mascot that voters named. The live dog is also known as Scotty to the Carnegie Mellon community.  About Scotty | Celebrating Scotty | Performer Requests     Department Quick Facts  Name of|Carnegie Mellon's official mascot debuted at the Nov. 10, 2007 home football game. The graphic features a profile of a distinguished, bold Scottish terrier sporting a plaid scarf around his neck. The dog is contained in a shield, representing|The mascot selection process included a series of surveys and a university Town Hall meeting. Nearly 78 percent of 2,370 students surveyed in February 2007 voted for the Scottish terrier, and approximately 25 percent of 400 alumni surveyed thought",
        "retrieved_relevant_part": true,
        "model_answer": "Scott's journey from popularicon to official mascot of the university began in 2006",
        "actual_answer": "2006",
        "exact_match": false,
        "f1_max_min_avg": [
            0.14,
            0.14,
            0.14
        ],
        "recall_max_min_avg": [
            1.0,
            1.0,
            1.0
        ]
    },
    {
        "question": "When was Carnegie Mellon's official mascot debut?",
        "context": "Carnegie Mellon's official mascot debuted at the Nov. 10, 2007 home football game. The graphic features a profile of a distinguished, bold Scottish terrier sporting a plaid scarf around his neck. The dog is contained in a shield, representing Carnegie Mellon's Scottish heritage.",
        "retrieved_doc": "Carnegie Mellon's official mascot debuted at the Nov. 10, 2007 home football game. The graphic features a profile of a distinguished, bold Scottish terrier sporting a plaid scarf around his neck. The dog is contained in a shield, representing|after Carnegie Mellon University opened its doors, an official mascot finally made its mark. Although students have dressed as a Scottish terrier \u2014 typically referred to as Scotty \u2014 for 50 years, it wasn't until 2007 that Carnegie Mellon officially|wasn't until 2007 that Carnegie Mellon officially welcomed the Scottish terrier as the university's first mascot.  In keeping with tradition, students, faculty, staff and alumni voted to name the new official mascot Scotty. But it's not just the|You can find our official tartan on various items in the University Store.  Source: \"Tartan: Romancing the Plaid,\" by Jeffrey Banks and Doria De La Chapelle      Official Mascot? More than a century after Carnegie Mellon University opened its|Scotty's road from popular icon to official mascot of the university began in 2006. Carnegie Mellon formed a Mascot Identity Task Force in November 2006, which consisted of students, faculty, staff and alumni. The Task Force was co-chaired by|new official mascot Scotty. But it's not just the costumed mascot that voters named. The live dog is also known as Scotty to the Carnegie Mellon community.  About Scotty | Celebrating Scotty | Performer Requests     Department Quick Facts  Name of",
        "retrieved_relevant_part": true,
        "model_answer": "November 10, 2007",
        "actual_answer": "Nov. 10, 2007",
        "exact_match": false,
        "f1_max_min_avg": [
            0.67,
            0.67,
            0.67
        ],
        "recall_max_min_avg": [
            0.67,
            0.67,
            0.67
        ]
    },
    {
        "question": "What is the graphic representation of Carnegie Mellon's official mascot?",
        "context": "Carnegie Mellon's official mascot debuted at the Nov. 10, 2007 home football game. The graphic features a profile of a distinguished, bold Scottish terrier sporting a plaid scarf around his neck. The dog is contained in a shield, representing Carnegie Mellon's Scottish heritage.",
        "retrieved_doc": "Carnegie Mellon's official mascot debuted at the Nov. 10, 2007 home football game. The graphic features a profile of a distinguished, bold Scottish terrier sporting a plaid scarf around his neck. The dog is contained in a shield, representing|after Carnegie Mellon University opened its doors, an official mascot finally made its mark. Although students have dressed as a Scottish terrier \u2014 typically referred to as Scotty \u2014 for 50 years, it wasn't until 2007 that Carnegie Mellon officially|You can find our official tartan on various items in the University Store.  Source: \"Tartan: Romancing the Plaid,\" by Jeffrey Banks and Doria De La Chapelle      Official Mascot? More than a century after Carnegie Mellon University opened its|The dog is contained in a shield, representing Carnegie Mellon's Scottish heritage.|wasn't until 2007 that Carnegie Mellon officially welcomed the Scottish terrier as the university's first mascot.  In keeping with tradition, students, faculty, staff and alumni voted to name the new official mascot Scotty. But it's not just the|power and agility in a small package. Many of these traits are also apparent throughout the university, making the Scottish terrier a natural choice for Carnegie Mellon's mascot.",
        "retrieved_relevant_part": true,
        "model_answer": "The Scottish terrier",
        "actual_answer": "The graphic features a profile of a distinguished, bold Scottish terrier sporting a plaid scarf around his neck.",
        "exact_match": false,
        "f1_max_min_avg": [
            0.29,
            0.29,
            0.29
        ],
        "recall_max_min_avg": [
            0.17,
            0.17,
            0.17
        ]
    },
    {
        "question": "When did the Kiltie Band begin?",
        "context": "The Kiltie Band began in 1908 with a group of just seven students dedicated to supporting Carnegie Tech football, and today's Kiltie Band continues a tradition of excellence originated over a century ago. The Band took the field for its first official performance on November 25th, 1922, on what would have been Andrew Carnegie's 87th birthday.",
        "retrieved_doc": "The Kiltie Band  The Kiltie Band began in 1908 with a group of just seven students dedicated to supporting Carnegie Tech football, and today's Kiltie Band continues a tradition of excellence originated over a century ago. The Band took the field for|over a century ago. The Band took the field for its first official performance on November 25th, 1922, on what would have been Andrew Carnegie's 87th birthday.  The Kiltie Marching Band consists of musicians and colorguard and plays at all Carnegie|and acts as a pep band for the basketball teams.  The Kiltie Band is a campus organization recognized by Student Senate and administered by the Department of Athletics, Physical Education and Recreation. Membership is open to all members of the|Q: What do they wear under those kilts? A: Join and you'll find out!  For more information, visit the Kiltie Band website.  Interested in Joining?  Please email the following information to Kiltie Band Director Jeremy Olisar.      Name     High|April 11, 2024: Event Name: Kiltie Band Alumni & Student Reception 4:30 PM-6:30 PMET Open to alumni and families of the Kiltie community After the Kiltie Band Spring Carnival kick-off concert, current and former Kilties are invited for food and fun! Note: Registration required. Walk-ins are welcome if space permits. No event fee. Open to the Kiltie community and guests. |the first practice.  Q: Are there auditions? A: No, any member of the campus community with music experience is able to join the Kiltie Band!  Q: Do I have to memorize music? A: No, the music is changed for every show. You should invest in a good",
        "retrieved_relevant_part": false,
        "model_answer": "The Kiltie Band began in 1908",
        "actual_answer": "1908",
        "exact_match": false,
        "f1_max_min_avg": [
            0.29,
            0.29,
            0.29
        ],
        "recall_max_min_avg": [
            1.0,
            1.0,
            1.0
        ]
    },
    {
        "question": "On whose birthday did the Kiltie Band have its first official performance?",
        "context": "The Kiltie Band began in 1908 with a group of just seven students dedicated to supporting Carnegie Tech football, and today's Kiltie Band continues a tradition of excellence originated over a century ago. The Band took the field for its first official performance on November 25th, 1922, on what would have been Andrew Carnegie's 87th birthday.",
        "retrieved_doc": "over a century ago. The Band took the field for its first official performance on November 25th, 1922, on what would have been Andrew Carnegie's 87th birthday.  The Kiltie Marching Band consists of musicians and colorguard and plays at all Carnegie|The Kiltie Band  The Kiltie Band began in 1908 with a group of just seven students dedicated to supporting Carnegie Tech football, and today's Kiltie Band continues a tradition of excellence originated over a century ago. The Band took the field for|April 11, 2024: Event Name: Kiltie Band Alumni & Student Reception 4:30 PM-6:30 PMET Open to alumni and families of the Kiltie community After the Kiltie Band Spring Carnival kick-off concert, current and former Kilties are invited for food and fun! Note: Registration required. Walk-ins are welcome if space permits. No event fee. Open to the Kiltie community and guests. |CUC Studio Theater.  Q: When are performances? A: The Kiltie Band performs at all home football games, a holiday concert, and two spring concerts. Times and dates for all performances are announced at the first practice.  Q: Are there auditions? A:|and acts as a pep band for the basketball teams.  The Kiltie Band is a campus organization recognized by Student Senate and administered by the Department of Athletics, Physical Education and Recreation. Membership is open to all members of the|April 11, 2024: Event Name: Kiltie Band Concert 3:30 PM-4:30 PMET Open to entire CMU community What better way to open Carnival than with the infamous \u201cBand without Pants\u201d? Note: No registration required. No event fee. This event is open to the entire CMU community and their guests. ",
        "retrieved_relevant_part": false,
        "model_answer": "Andrew Carnegie's 87th birthday",
        "actual_answer": "Andrew Carnegie's 87th birthday",
        "exact_match": true,
        "f1_max_min_avg": [
            1.0,
            1.0,
            1.0
        ],
        "recall_max_min_avg": [
            1.0,
            1.0,
            1.0
        ]
    },
    {
        "question": "when are kilite band rehersal?",
        "context": "Q: When are rehearsals? A: Football season: Mondays and Thursdays from 5:30 p.m.-7:30 p.m. and Game Day 9:30-11:00a.m. Concert Season: Mondays and Thursdays from 5:30-6:30 p.m. Location is the CUC Studio Theater.",
        "retrieved_doc": "CUC Studio Theater.  Q: When are performances? A: The Kiltie Band performs at all home football games, a holiday concert, and two spring concerts. Times and dates for all performances are announced at the first practice.  Q: Are there auditions? A:|The Kiltie Band  The Kiltie Band began in 1908 with a group of just seven students dedicated to supporting Carnegie Tech football, and today's Kiltie Band continues a tradition of excellence originated over a century ago. The Band took the field for|over a century ago. The Band took the field for its first official performance on November 25th, 1922, on what would have been Andrew Carnegie's 87th birthday.  The Kiltie Marching Band consists of musicians and colorguard and plays at all Carnegie|Q: What do they wear under those kilts? A: Join and you'll find out!  For more information, visit the Kiltie Band website.  Interested in Joining?  Please email the following information to Kiltie Band Director Jeremy Olisar.      Name     High|April 11, 2024: Event Name: Kiltie Band Alumni & Student Reception 4:30 PM-6:30 PMET Open to alumni and families of the Kiltie community After the Kiltie Band Spring Carnival kick-off concert, current and former Kilties are invited for food and fun! Note: Registration required. Walk-ins are welcome if space permits. No event fee. Open to the Kiltie community and guests. |football season, the Kiltie Concert Band plays a holiday concert and two spring concerts, including a performance at Carnegie Mellon's Spring Carnival. Additionally, a part of the band gets together and acts as a pep band for the basketball teams.",
        "retrieved_relevant_part": false,
        "model_answer": "Kiltie band rehearsal takes place on November 25, 1922",
        "actual_answer": "Football season: Mondays and Thursdays from 5:30 p.m.-7:30 p.m. and Game Day 9:30-11:00a.m. Concert Season: Mondays and Thursdays from 5:30-6:30 p.m.",
        "exact_match": false,
        "f1_max_min_avg": [
            0,
            0,
            0.0
        ],
        "recall_max_min_avg": [
            0,
            0,
            0.0
        ]
    },
    {
        "question": "Are there auditions for kilite band?",
        "context": "Q: Are there auditions? A: No, any member of the campus community with music experience is able to join the Kiltie Band!",
        "retrieved_doc": "the first practice.  Q: Are there auditions? A: No, any member of the campus community with music experience is able to join the Kiltie Band!  Q: Do I have to memorize music? A: No, the music is changed for every show. You should invest in a good|CUC Studio Theater.  Q: When are performances? A: The Kiltie Band performs at all home football games, a holiday concert, and two spring concerts. Times and dates for all performances are announced at the first practice.  Q: Are there auditions? A:|Membership is open to all members of the campus/community without audition. Participants must do their best to promote the success of the ensemble through attendance, attitude, and dependability. FAQs  Q: When are rehearsals? A: Football season:|Q: What do they wear under those kilts? A: Join and you'll find out!  For more information, visit the Kiltie Band website.  Interested in Joining?  Please email the following information to Kiltie Band Director Jeremy Olisar.      Name     High|email the Direcator at jolisar@andrew.cmu.edu.  Q: Can I borrow a school instrument? A: There are several Kiltie-owned instruments available for your use. Loans begin at 4:30 p.m. before the first rehearsal.   Q: What do they wear under those kilts?|and acts as a pep band for the basketball teams.  The Kiltie Band is a campus organization recognized by Student Senate and administered by the Department of Athletics, Physical Education and Recreation. Membership is open to all members of the",
        "retrieved_relevant_part": false,
        "model_answer": "No, membership is open to all members of the campus and community",
        "actual_answer": "No, any member of the campus community with music experience is able to join the Kiltie Band!",
        "exact_match": false,
        "f1_max_min_avg": [
            0.48,
            0.48,
            0.48
        ],
        "recall_max_min_avg": [
            0.41,
            0.41,
            0.41
        ]
    },
    {
        "question": "Why are Carnegie Mellon athletic teams nicknamed the 'Tartans'?",
        "context": "What is a Tartan? The Carnegie Mellon athletic teams are nicknamed the 'Tartans' as a nod to Andrew Carnegie's Scottish heritage. A tartan is often misrepresented as a fierce warrior from either the Asian tundra or Scottish highlands. In actuality, a Tartan is a twilled woolen fabric with a plaid design. It is of Scottish origin and consists of stripes of various colors and widths against a solid ground, denoting a particular family lineage. The school's founder, Andrew Carnegie, was born in Dunfermline, Scotland, in 1835. Carnegie came to the United States in 1848 and founded Carnegie Technical Schools in Pittsburgh in 1900. The Scottish terrier mascot performer sports Carnegie tartan attire, while the graphic mascot is wearing a plaid scarf around its neck. So what's the difference between tartan and plaid?",
        "retrieved_doc": "1967, the school merged with Mellon Institute and became what is known today as Carnegie Mellon University. What is a Tartan? The Carnegie Mellon athletic teams are nicknamed the \"Tartans\" as a nod to Andrew Carnegie's Scottish heritage. A tartan is|You can find our official tartan on various items in the University Store.  Source: \"Tartan: Romancing the Plaid,\" by Jeffrey Banks and Doria De La Chapelle      Official Mascot? More than a century after Carnegie Mellon University opened its|wasn't until 2007 that Carnegie Mellon officially welcomed the Scottish terrier as the university's first mascot.  In keeping with tradition, students, faculty, staff and alumni voted to name the new official mascot Scotty. But it's not just the|after Carnegie Mellon University opened its doors, an official mascot finally made its mark. Although students have dressed as a Scottish terrier \u2014 typically referred to as Scotty \u2014 for 50 years, it wasn't until 2007 that Carnegie Mellon officially|The Scottish terrier has long been a familiar figure around Carnegie Mellon's campus. For years students have suited up in an unofficial Scottish terrier costume to excite the fans at athletic events. But the relationship between the Scottish|Carnegie Mellon's official mascot debuted at the Nov. 10, 2007 home football game. The graphic features a profile of a distinguished, bold Scottish terrier sporting a plaid scarf around his neck. The dog is contained in a shield, representing",
        "retrieved_relevant_part": false,
        "model_answer": "Carnegie Mellon athletic teams are nicknamed the 'Tartans' as a nod to Andrew Carnegie's Scottish heritage",
        "actual_answer": "They are nicknamed the 'Tartans' as a nod to Andrew Carnegie's Scottish heritage",
        "exact_match": false,
        "f1_max_min_avg": [
            0.83,
            0.83,
            0.83
        ],
        "recall_max_min_avg": [
            0.92,
            0.92,
            0.92
        ]
    },
    {
        "question": "What is a Tartan actually?",
        "context": "What is a Tartan? The Carnegie Mellon athletic teams are nicknamed the 'Tartans' as a nod to Andrew Carnegie's Scottish heritage. A tartan is often misrepresented as a fierce warrior from either the Asian tundra or Scottish highlands. In actuality, a Tartan is a twilled woolen fabric with a plaid design. It is of Scottish origin and consists of stripes of various colors and widths against a solid ground, denoting a particular family lineage. The school's founder, Andrew Carnegie, was born in Dunfermline, Scotland, in 1835. Carnegie came to the United States in 1848 and founded Carnegie Technical Schools in Pittsburgh in 1900. The Scottish terrier mascot performer sports Carnegie tartan attire, while the graphic mascot is wearing a plaid scarf around its neck. So what's the difference between tartan and plaid?",
        "retrieved_doc": "Andrew Carnegie's Scottish heritage. A tartan is often misrepresented as a fierce warrior from either the Asian tundra or Scottish highlands. In actuality, a Tartan is a twilled woolen fabric with a plaid design. It is of Scottish origin and|tartan attire, while the graphic mascot is wearing a plaid scarf around its neck. So what's the difference between tartan and plaid?  You'll know it's a tartan if...\u2022 \"It's a check or pattern in a variety of colours in woven fabric in which bands of|You can find our official tartan on various items in the University Store.  Source: \"Tartan: Romancing the Plaid,\" by Jeffrey Banks and Doria De La Chapelle      Official Mascot? More than a century after Carnegie Mellon University opened its|1967, the school merged with Mellon Institute and became what is known today as Carnegie Mellon University. What is a Tartan? The Carnegie Mellon athletic teams are nicknamed the \"Tartans\" as a nod to Andrew Carnegie's Scottish heritage. A tartan is|so when vertical and horizontal stripes of the same color cross, the result is solid color at the point of intersection.\" \u2022 \"The arrangement of colored threads is the same in the warp as in the weft.\"  You can find our official tartan on various|April 13, 2024: Event Name: Tartans on the Rise (Invitation Only) 4:00 PM-5:30 PMET Private event, invitation only Tartans on the Rise celebrates recent alumni who are making an impact in their organizations and in their communities, across the nation and around the world through leadership, innovation and career achievements. Check out the Tartans on the Rise campus display outside the Purnell Center throughout the weekend to learn more about the slate of recent alumni being recognized. Note: Separate registration required. ",
        "retrieved_relevant_part": true,
        "model_answer": "A Tartan is a twilled woolen fabric with a plaid design",
        "actual_answer": "A twilled woolen fabric with a plaid design",
        "exact_match": false,
        "f1_max_min_avg": [
            0.84,
            0.84,
            0.84
        ],
        "recall_max_min_avg": [
            1.0,
            1.0,
            1.0
        ]
    },
    {
        "question": "Where and when was Andrew Carnegie born?",
        "context": "What is a Tartan? The Carnegie Mellon athletic teams are nicknamed the 'Tartans' as a nod to Andrew Carnegie's Scottish heritage. A tartan is often misrepresented as a fierce warrior from either the Asian tundra or Scottish highlands. In actuality, a Tartan is a twilled woolen fabric with a plaid design. It is of Scottish origin and consists of stripes of various colors and widths against a solid ground, denoting a particular family lineage. The school's founder, Andrew Carnegie, was born in Dunfermline, Scotland, in 1835. Carnegie came to the United States in 1848 and founded Carnegie Technical Schools in Pittsburgh in 1900. The Scottish terrier mascot performer sports Carnegie tartan attire, while the graphic mascot is wearing a plaid scarf around its neck. So what's the difference between tartan and plaid?",
        "retrieved_doc": "Andrew Carnegie  A self-educated \"working boy\" who loved books, Andrew Carnegie emigrated from Scotland in 1848 and settled in Pittsburgh, Pa. Attending night school and borrowing books, Carnegie went from factory worker in a textile mill to|with a plaid design. It is of Scottish origin and consists of stripes of various colors and widths against a solid ground, denoting a particular family lineage. The school's founder, Andrew Carnegie, was born in Dunfermline, Scotland, in 1835.|was born in Dunfermline, Scotland, in 1835. Carnegie came to the United States in 1848 and founded Carnegie Technical Schools in Pittsburgh in 1900.  The Scottish terrier mascot performer sports Carnegie tartan attire, while the graphic mascot is|Tartan Facts: Who founded Carnegie Mellon University? Carnegie Technical Schools was founded in 1900 by Andrew Carnegie. Twelve years later it became known as the Carnegie Institute of Technology. In 1967, the school merged with Mellon Institute and|century.    Carnegie Technical Schools  At one point the richest man in the world, Carnegie believed that \"to die rich is to die disgraced.\" He turned his attention to writing, social activism and philanthropy, determined to establish educational|went from factory worker in a textile mill to successful entrepreneur and industrialist. He rose to prominence by founding what became the world's largest steel producing company by the end of the 19th century.    Carnegie Technical Schools  At one",
        "retrieved_relevant_part": true,
        "model_answer": "Andrew Carnegie was born in Dunfermline, Scotland, in 1835",
        "actual_answer": "Andrew Carnegie was born in Dunfermline, Scotland, in 1835",
        "exact_match": true,
        "f1_max_min_avg": [
            0.89,
            0.89,
            0.89
        ],
        "recall_max_min_avg": [
            0.89,
            0.89,
            0.89
        ]
    },
    {
        "question": "When did Andrew Carnegie come to the United States?",
        "context": "What is a Tartan? The Carnegie Mellon athletic teams are nicknamed the 'Tartans' as a nod to Andrew Carnegie's Scottish heritage. A tartan is often misrepresented as a fierce warrior from either the Asian tundra or Scottish highlands. In actuality, a Tartan is a twilled woolen fabric with a plaid design. It is of Scottish origin and consists of stripes of various colors and widths against a solid ground, denoting a particular family lineage. The school's founder, Andrew Carnegie, was born in Dunfermline, Scotland, in 1835. Carnegie came to the United States in 1848 and founded Carnegie Technical Schools in Pittsburgh in 1900. The Scottish terrier mascot performer sports Carnegie tartan attire, while the graphic mascot is wearing a plaid scarf around its neck. So what's the difference between tartan and plaid?",
        "retrieved_doc": "Andrew Carnegie  A self-educated \"working boy\" who loved books, Andrew Carnegie emigrated from Scotland in 1848 and settled in Pittsburgh, Pa. Attending night school and borrowing books, Carnegie went from factory worker in a textile mill to|was born in Dunfermline, Scotland, in 1835. Carnegie came to the United States in 1848 and founded Carnegie Technical Schools in Pittsburgh in 1900.  The Scottish terrier mascot performer sports Carnegie tartan attire, while the graphic mascot is|with a plaid design. It is of Scottish origin and consists of stripes of various colors and widths against a solid ground, denoting a particular family lineage. The school's founder, Andrew Carnegie, was born in Dunfermline, Scotland, in 1835.|went from factory worker in a textile mill to successful entrepreneur and industrialist. He rose to prominence by founding what became the world's largest steel producing company by the end of the 19th century.    Carnegie Technical Schools  At one|Andrew Carnegie and other funders, Carnegie Tech laid the foundation for a school on the cutting edge. Some key developments were: It expanded from two buildings into an elegant 20th century campus designed in the beaux arts architectural style,|Tartan Facts: Who founded Carnegie Mellon University? Carnegie Technical Schools was founded in 1900 by Andrew Carnegie. Twelve years later it became known as the Carnegie Institute of Technology. In 1967, the school merged with Mellon Institute and",
        "retrieved_relevant_part": true,
        "model_answer": "Andrew Carnegie attended night school and borrowed books",
        "actual_answer": "Andrew Carnegie came to the United States in 1848",
        "exact_match": false,
        "f1_max_min_avg": [
            0.24,
            0.24,
            0.24
        ],
        "recall_max_min_avg": [
            0.22,
            0.22,
            0.22
        ]
    },
    {
        "question": "What name was chosen for the official mascot of Carnegie Mellon University?",
        "context": "Official Mascot? More than a century after Carnegie Mellon University opened its doors, an official mascot finally made its mark. Although students have dressed as a Scottish terrier \u2014 typically referred to as Scotty \u2014 for 50 years, it wasn't until 2007 that Carnegie Mellon officially welcomed the Scottish terrier as the university's first mascot. In keeping with tradition, students, faculty, staff and alumni voted to name the new official mascot Scotty. But it's not just the costumed mascot that voters named. The live dog is also known as Scotty to the Carnegie Mellon community.",
        "retrieved_doc": "after Carnegie Mellon University opened its doors, an official mascot finally made its mark. Although students have dressed as a Scottish terrier \u2014 typically referred to as Scotty \u2014 for 50 years, it wasn't until 2007 that Carnegie Mellon officially|wasn't until 2007 that Carnegie Mellon officially welcomed the Scottish terrier as the university's first mascot.  In keeping with tradition, students, faculty, staff and alumni voted to name the new official mascot Scotty. But it's not just the|Carnegie Mellon's official mascot debuted at the Nov. 10, 2007 home football game. The graphic features a profile of a distinguished, bold Scottish terrier sporting a plaid scarf around his neck. The dog is contained in a shield, representing|new official mascot Scotty. But it's not just the costumed mascot that voters named. The live dog is also known as Scotty to the Carnegie Mellon community.  About Scotty | Celebrating Scotty | Performer Requests     Department Quick Facts  Name of|You can find our official tartan on various items in the University Store.  Source: \"Tartan: Romancing the Plaid,\" by Jeffrey Banks and Doria De La Chapelle      Official Mascot? More than a century after Carnegie Mellon University opened its|power and agility in a small package. Many of these traits are also apparent throughout the university, making the Scottish terrier a natural choice for Carnegie Mellon's mascot.",
        "retrieved_relevant_part": true,
        "model_answer": "The official mascot of Carnegie Mellon University was named Scotty",
        "actual_answer": "Scotty",
        "exact_match": false,
        "f1_max_min_avg": [
            0.18,
            0.18,
            0.18
        ],
        "recall_max_min_avg": [
            1.0,
            1.0,
            1.0
        ]
    },
    {
        "question": "How long had students been dressing as a Scottish terrier before it became the official mascot?",
        "context": "Official Mascot? More than a century after Carnegie Mellon University opened its doors, an official mascot finally made its mark. Although students have dressed as a Scottish terrier \u2014 typically referred to as Scotty \u2014 for 50 years, it wasn't until 2007 that Carnegie Mellon officially welcomed the Scottish terrier as the university's first mascot. In keeping with tradition, students, faculty, staff and alumni voted to name the new official mascot Scotty. But it's not just the costumed mascot that voters named. The live dog is also known as Scotty to the Carnegie Mellon community.",
        "retrieved_doc": "after Carnegie Mellon University opened its doors, an official mascot finally made its mark. Although students have dressed as a Scottish terrier \u2014 typically referred to as Scotty \u2014 for 50 years, it wasn't until 2007 that Carnegie Mellon officially|The Scottish terrier has long been a familiar figure around Carnegie Mellon's campus. For years students have suited up in an unofficial Scottish terrier costume to excite the fans at athletic events. But the relationship between the Scottish|25 percent of 400 alumni surveyed thought the Scottish terrier was already the mascot.|wasn't until 2007 that Carnegie Mellon officially welcomed the Scottish terrier as the university's first mascot.  In keeping with tradition, students, faculty, staff and alumni voted to name the new official mascot Scotty. But it's not just the|The mascot selection process included a series of surveys and a university Town Hall meeting. Nearly 78 percent of 2,370 students surveyed in February 2007 voted for the Scottish terrier, and approximately 25 percent of 400 alumni surveyed thought|power and agility in a small package. Many of these traits are also apparent throughout the university, making the Scottish terrier a natural choice for Carnegie Mellon's mascot.",
        "retrieved_relevant_part": true,
        "model_answer": "Students have been dressing as a Scottish terrier before it became the official mascot",
        "actual_answer": "50 years",
        "exact_match": false,
        "f1_max_min_avg": [
            0,
            0,
            0.0
        ],
        "recall_max_min_avg": [
            0,
            0,
            0.0
        ]
    },
    {
        "question": "What is the enrollment of undergraduates at Carnegie Mellon University for Fall 2021?",
        "context": "Name of School: Carnegie Mellon University; City/Zip: Pittsburgh, PA 15213; Founded: 1900; Enrollment (undergrad): 6,982- Fall 2021; Enrollment (graduate and doctoral): 7,062 - Fall 2021; Alumni: 102,577; Nickname: Tartans; Mascot: Scottie Dog; School Colors: Cardinal and Gray; Football Stadium and Track and Field: Gesling Stadium; Capacity: 3,500; Surface: FieldTurf; Basketball/Volleyball Gym: Wiegand Gymnasium; Capacity: 500; Soccer Stadium: CMU Soccer Field; Capacity: 250; Surface: FieldTurf; Affiliation: NCAA Division III; Conference: University Athletic Association | Presidents' Athletic Conference (Football Only); President: Dr. Farnam Jahanian; Alma Mater, Year: University of Texas at Austin; Athletic Director: Dr. Josh Centor; Alma Mater, Year: Brandeis, 2004; Athletic Department Phone: 412-268-8054; Mailing Address:  5000 Forbes Avenue / Pittsburgh, PA 15213",
        "retrieved_doc": "Requests     Department Quick Facts  Name of School: Carnegie Mellon University  City/Zip: Pittsburgh, PA 15213  Founded: 1900  Enrollment (undergrad): 6,982- Fall 2021  Enrollment (graduate and doctoral): 7,062 - Fall 2021  Alumni: 102,577|6 1 Welcome Welcome to Carnegie Mellon University! Being in the CMU School of Computer Science (SCS) is a unique experience because of the size of the school (over 2000 students, staff and faculty), the quality of its members, the variety of research being conducted, and unparalleled learning opportunities. We encourage you to take adva ntage of CMU offerings, both inside and outside SCS, and also to explore Pittsburgh and southw est Pennsylvania to the extent your schedule permits. What you will find is an environm ent that encourages and rewards hard work and accomplishment. Pittsburgh has long been an indu strial area whose residents build things. In SCS we build things, and you will also. While this handbook is specific to your academic ex perience in the MSAII program, there are several other resources and offices graduate students are encouraged to consult during their tenure at Carnegie Mellon University. Infor mation about The Word, the student handbook, the Office of Graduate and Postdoc A ffairs, the Office of the Dean of Student Affairs and others are included in Appendix A of this handbook. 2 Mission, Vision and Philosophy Carnegie Mellon University will have a transfor mative impact on society through continual innovation in education, research, creativity, and entrepreneurship. Our mission is to create a transformative educatio nal experience for students focused on deep disciplinary knowledge; problem solving; teamwork, leadership, communication, and interpersonal skills; and pers onal health and well-being. The university community is committed to (a) at tracting and retaining diverse, world-class talent; (b) creating a collaborative environment open to the free exchange of ideas, in which research, creativity, innovation, and entrepreneu rship can flourish; and (c) ensuring individuals can achieve their full potential. We encourage our members to impact society in a transformative way \u2014 regionally, nationally, and globally \u2014 by engaging with partners out side the traditional bor ders of the university campus. See the full university mission statement . 3 Carnegie Mellon Statement of Assurance Carnegie Mellon University does not discriminate in admission, employment or administration of its programs or activities on the basis of r ace, color, national origin, sex, handicap or disability, age, sexual orientation, gender identity , religion, creed, ancestry , belief, veteran status or genetic information. Furthe rmore, Carnegie Mellon University does not discriminate and is required not to discriminate in violation of fede ral, state or local laws or executive orders|Carnegie Mellon University has been a birthplace  of innovation since its founding in 1900. Today, CMU is a global leader bringing groundbreaking  ideas to market and creating successful startup  businesses. Our award-winning faculty are renowned for  working closely with students to solve major scientific,  technological and societal challenges. We put a strong  emphasis on creating things \u2014 from art to robots. We  have become a model for economic development in  forming partnerships with companies such as Uber,  Google and Disney. Our students are recruited by some  of the world\u2019s most innovative companies. MANAGEMENT  INFORMATION  SYSTEMS U.S. News & World Report, 2022#1 ARTIFICIAL  INTELLIGENCE U.S. News & World Report, 2022#1 AMONG U.S.   UNIVERSITIES Times Higher Education   World University  Ranking, 2023#19SOFTWARE  ENGINEERING U.S. News & World Report, 2022COLLEGE OF  ENGINEERING U.S. News & World Report, 2022#1 #4#1SCHOOL OF  COMPUTER  SCIENCE U.S. News & World Report, 2022 UNIVERSITY   IN THE WORLD Times Higher Education   World University   Ranking, 2023#28TIME-BASED/   NEW MEDIA U.S. News & World Report, 2019#11,529   FACULTY16,779   STUDENTSGraduate Undergraduate 117,257  ALUMNI (LIVING) 85%  U.S. 15%  International35%  U.S. 65%  International 76%  U.S. 24%  InternationalGLOBAL COMMUNITY Students representing 126 countries Faculty representing 56 countries Alumni representing  148 countries OF COMPUTER  SCIENCE\u2019S FIRST- YEAR STUDENTS   WERE WOMEN   IN 2019 Nearly triple the   national average\u201c My Heart is in the Work. \u201d    Andrew Carnegie, Founder    November 15, 1900 49.8 % 87%  U.S. 13%  InternationalSCHOOLS AND COLLEGES College of Engineering  College of Fine Arts Dietrich College of Humanities   and Social Sciences Heinz College of Information Systems  and Public Policy Mellon College of Science School of Computer Science Tepper School of Business cmu.edu/assets/pdfs/cmu-fact-sheet.pdf    |   cmu.edu/about/awards.htmlMarch 2020BIG IDEAS THAT SHAPE YOUR WORLD START HERE 1,000+ companies greenlighted  across the U.S. and internationally  Cognitive tutors,  which improve  the math skills of 500,000+  students each year  The first U.S. school to award   a degree in drama  in 1914 James Gosling (SCS 1983)  invented the Java computer  programming language . The first exclusive higher  education partner of the Tony  Awards\u00ae , co-creating the first,  national recognition program  honoring K-12 theatre educators The first smile in an email , created  in 1982 by professor Scott Fahlman Kevlar Fiber , invented by alumna  Stephanie Kwolek (MM 1946) The Last Lecture , written   by alumni Randy Pausch (SCS 1988)   and Jeffrey Zaslow (DC 1980) In 1919, CMU\u2019s first Ph.D.  was  awarded to Mao Yisheng, father   of Chinese bridge construction.  Duolingo , invented by professor   Luis von Ahn (CS 2003, 2005), had   10 million downloads in 12 months  and was named Apple\u2019s 2013 app   of the year. :-) LEADERSHIP Farnam Jahanian    President David Coulter   Chair, Board of Trustees James H. Garrett Jr.   Provost2 National Academy of Engineering       3 National Academy of Sciences        4 National Academy of Medicine  Won by alumni and current/former faculty The leading university center  for cybersecurity , providing  support to more than 110  centers around the world  The world\u2019s first university  robotics department ,   founded in 1979 Alumnus Andy Warhol    (CFA1949), pop artist pioneer   and cultural icon One of only 29 universities   invited to be a member of the  World Economic Forum\u2019s  Global University   Leaders Forum CMU.EDU ECONOMIC IMPACT \u2022 Attracting major companies  \u2014   including Google, Intel, Uber and GE \u2014   to locate operations and create new   jobs in Pittsburgh \u2022 To date, the CMU community has  launched more than 400 startups   and created more than 152 spinoff  companies . \u2022 Contributing to the cultural and civic life of   the city with performances , exhibitions   and research collaborations 13 ACADEMY   AWARDS65 MEMBERS   OF NAE2 146 EMMY   AWARDS20 MEMBERS   OF NAS3 6 MEMBERS   OF NAM4 13 TURING   AWARDS 20 NOBEL   LAUREATES 58 TONY   AWARDS May 2023|2 Table of Contents 1 Welcome ............................................................................................................................... ................ 6 2 Mission, Vision and Philoso phy............................................................................................................. 6 3 Carnegie Mellon Statement of Assurance ............................................................................................ 6 4 Carnegie Mellon Code ........................................................................................................................... 7 5 University Policies and Expectations .................................................................................................... 8 6 Academic Calendar ............................................................................................................................... 8 7 School and Departmental Information ................................................................................................. 8 8 MSAII Policies ............................................................................................................................... ......... 9 8.1 The MSAII Degree ......................................................................................................................... 9 8.2 Program Contacts ........................................................................................................................ 10 8.3 The Reasonable Person Principle (RPP) ...................................................................................... 10 8.4 Academic Calendar ..................................................................................................................... 10 9 The Language Technologies Institute ................................................................................................. 11 9.1 Working Space for MS Students ................................................................................................. 11 9.2 Photocopies and Printers ............................................................................................................ 11 9.3 Computers for MS Students ........................................................................................................ 11 10 Degree Requirements ..................................................................................................................... 12 10.1 Course Grade and GPA Requirements ........................................................................................ 12 10.2 Course Requirements .................................................................................................................. 13 10.2.1 Incomplete Grades .............................................................................................................. 16 10.2.2 Change of grades and missing grades ................................................................................. 16 10.2.3 Transferring to another program ........................................................................................ 17 10.2.4 Intellectual Property Policy ................................................................................................. 17 10.2.5 Teaching Requirements ...................................................................................................... 17 10.3 Advising ............................................................................................................................... ........ 17 10.3.1 Student Advising ................................................................................................................. 17 10.3.2 Monitoring Progress ........................................................................................................... 17 10.3.3 Degree Certification ............................................................................................................ 17 10.4 Internship ............................................................................................................................... ..... 18 10.5 Employment Eligibility Verification ............................................................................................. 19 10.6 MSAII Orientation ....................................................................................................................... 20|Mellon throughout the world.   Carnegie Mellon University challenges the curious and passionate to deliver work that matters. Calendar Careers|now known as\u00a0Marianna Brown Dietrich College of Humanities and Social Sciences. In 2017, Carnegie Mellon celebrated the 50th anniversary of the Carnegie Tech-Mellon Institute merger, revisiting the shared vision of the founders and recognizing the",
        "retrieved_relevant_part": false,
        "model_answer": "Undergraduates at Carnegie Mellon University for Fall 2021 must complete a prerequisite degree requirement and a specific grade requirement",
        "actual_answer": "6982 Students",
        "exact_match": false,
        "f1_max_min_avg": [
            0,
            0,
            0.0
        ],
        "recall_max_min_avg": [
            0,
            0,
            0.0
        ]
    },
    {
        "question": "Who is the President of Carnegie Mellon University?",
        "context": "Name of School: Carnegie Mellon University; City/Zip: Pittsburgh, PA 15213; Founded: 1900; Enrollment (undergrad): 6,982- Fall 2021; Enrollment (graduate and doctoral): 7,062 - Fall 2021; Alumni: 102,577; Nickname: Tartans; Mascot: Scottie Dog; School Colors: Cardinal and Gray; Football Stadium and Track and Field: Gesling Stadium; Capacity: 3,500; Surface: FieldTurf; Basketball/Volleyball Gym: Wiegand Gymnasium; Capacity: 500; Soccer Stadium: CMU Soccer Field; Capacity: 250; Surface: FieldTurf; Affiliation: NCAA Division III; Conference: University Athletic Association | Presidents' Athletic Conference (Football Only); President: Dr. Farnam Jahanian; Alma Mater, Year: University of Texas at Austin; Athletic Director: Dr. Josh Centor; Alma Mater, Year: Brandeis, 2004; Athletic Department Phone: 412-268-8054; Mailing Address:  5000 Forbes Avenue / Pittsburgh, PA 15213",
        "retrieved_doc": "Carnegie Mellon University has been a birthplace  of innovation since its founding in 1900. Today, CMU is a global leader bringing groundbreaking  ideas to market and creating successful startup  businesses. Our award-winning faculty are renowned for  working closely with students to solve major scientific,  technological and societal challenges. We put a strong  emphasis on creating things \u2014 from art to robots. We  have become a model for economic development in  forming partnerships with companies such as Uber,  Google and Disney. Our students are recruited by some  of the world\u2019s most innovative companies. MANAGEMENT  INFORMATION  SYSTEMS U.S. News & World Report, 2022#1 ARTIFICIAL  INTELLIGENCE U.S. News & World Report, 2022#1 AMONG U.S.   UNIVERSITIES Times Higher Education   World University  Ranking, 2023#19SOFTWARE  ENGINEERING U.S. News & World Report, 2022COLLEGE OF  ENGINEERING U.S. News & World Report, 2022#1 #4#1SCHOOL OF  COMPUTER  SCIENCE U.S. News & World Report, 2022 UNIVERSITY   IN THE WORLD Times Higher Education   World University   Ranking, 2023#28TIME-BASED/   NEW MEDIA U.S. News & World Report, 2019#11,529   FACULTY16,779   STUDENTSGraduate Undergraduate 117,257  ALUMNI (LIVING) 85%  U.S. 15%  International35%  U.S. 65%  International 76%  U.S. 24%  InternationalGLOBAL COMMUNITY Students representing 126 countries Faculty representing 56 countries Alumni representing  148 countries OF COMPUTER  SCIENCE\u2019S FIRST- YEAR STUDENTS   WERE WOMEN   IN 2019 Nearly triple the   national average\u201c My Heart is in the Work. \u201d    Andrew Carnegie, Founder    November 15, 1900 49.8 % 87%  U.S. 13%  InternationalSCHOOLS AND COLLEGES College of Engineering  College of Fine Arts Dietrich College of Humanities   and Social Sciences Heinz College of Information Systems  and Public Policy Mellon College of Science School of Computer Science Tepper School of Business cmu.edu/assets/pdfs/cmu-fact-sheet.pdf    |   cmu.edu/about/awards.htmlMarch 2020BIG IDEAS THAT SHAPE YOUR WORLD START HERE 1,000+ companies greenlighted  across the U.S. and internationally  Cognitive tutors,  which improve  the math skills of 500,000+  students each year  The first U.S. school to award   a degree in drama  in 1914 James Gosling (SCS 1983)  invented the Java computer  programming language . The first exclusive higher  education partner of the Tony  Awards\u00ae , co-creating the first,  national recognition program  honoring K-12 theatre educators The first smile in an email , created  in 1982 by professor Scott Fahlman Kevlar Fiber , invented by alumna  Stephanie Kwolek (MM 1946) The Last Lecture , written   by alumni Randy Pausch (SCS 1988)   and Jeffrey Zaslow (DC 1980) In 1919, CMU\u2019s first Ph.D.  was  awarded to Mao Yisheng, father   of Chinese bridge construction.  Duolingo , invented by professor   Luis von Ahn (CS 2003, 2005), had   10 million downloads in 12 months  and was named Apple\u2019s 2013 app   of the year. :-) LEADERSHIP Farnam Jahanian    President David Coulter   Chair, Board of Trustees James H. Garrett Jr.   Provost2 National Academy of Engineering       3 National Academy of Sciences        4 National Academy of Medicine  Won by alumni and current/former faculty The leading university center  for cybersecurity , providing  support to more than 110  centers around the world  The world\u2019s first university  robotics department ,   founded in 1979 Alumnus Andy Warhol    (CFA1949), pop artist pioneer   and cultural icon One of only 29 universities   invited to be a member of the  World Economic Forum\u2019s  Global University   Leaders Forum CMU.EDU ECONOMIC IMPACT \u2022 Attracting major companies  \u2014   including Google, Intel, Uber and GE \u2014   to locate operations and create new   jobs in Pittsburgh \u2022 To date, the CMU community has  launched more than 400 startups   and created more than 152 spinoff  companies . \u2022 Contributing to the cultural and civic life of   the city with performances , exhibitions   and research collaborations 13 ACADEMY   AWARDS65 MEMBERS   OF NAE2 146 EMMY   AWARDS20 MEMBERS   OF NAS3 6 MEMBERS   OF NAM4 13 TURING   AWARDS 20 NOBEL   LAUREATES 58 TONY   AWARDS May 2023|Mellon has soared to national and international leadership in higher education and research. A birthplace of innovation since its founding, it continues to be known for innovation, for solving real-world problems and for interdisciplinary|Requests     Department Quick Facts  Name of School: Carnegie Mellon University  City/Zip: Pittsburgh, PA 15213  Founded: 1900  Enrollment (undergrad): 6,982- Fall 2021  Enrollment (graduate and doctoral): 7,062 - Fall 2021  Alumni: 102,577|now known as\u00a0Marianna Brown Dietrich College of Humanities and Social Sciences. In 2017, Carnegie Mellon celebrated the 50th anniversary of the Carnegie Tech-Mellon Institute merger, revisiting the shared vision of the founders and recognizing the|shared vision of the founders and recognizing the impact it has had, and will continue to have, in the world of higher education, research and discovery.    A Global Impact  In its 115 years, Carnegie Mellon has soared to national and international|6 1 Welcome Welcome to Carnegie Mellon University! Being in the CMU School of Computer Science (SCS) is a unique experience because of the size of the school (over 2000 students, staff and faculty), the quality of its members, the variety of research being conducted, and unparalleled learning opportunities. We encourage you to take adva ntage of CMU offerings, both inside and outside SCS, and also to explore Pittsburgh and southw est Pennsylvania to the extent your schedule permits. What you will find is an environm ent that encourages and rewards hard work and accomplishment. Pittsburgh has long been an indu strial area whose residents build things. In SCS we build things, and you will also. While this handbook is specific to your academic ex perience in the MSAII program, there are several other resources and offices graduate students are encouraged to consult during their tenure at Carnegie Mellon University. Infor mation about The Word, the student handbook, the Office of Graduate and Postdoc A ffairs, the Office of the Dean of Student Affairs and others are included in Appendix A of this handbook. 2 Mission, Vision and Philosophy Carnegie Mellon University will have a transfor mative impact on society through continual innovation in education, research, creativity, and entrepreneurship. Our mission is to create a transformative educatio nal experience for students focused on deep disciplinary knowledge; problem solving; teamwork, leadership, communication, and interpersonal skills; and pers onal health and well-being. The university community is committed to (a) at tracting and retaining diverse, world-class talent; (b) creating a collaborative environment open to the free exchange of ideas, in which research, creativity, innovation, and entrepreneu rship can flourish; and (c) ensuring individuals can achieve their full potential. We encourage our members to impact society in a transformative way \u2014 regionally, nationally, and globally \u2014 by engaging with partners out side the traditional bor ders of the university campus. See the full university mission statement . 3 Carnegie Mellon Statement of Assurance Carnegie Mellon University does not discriminate in admission, employment or administration of its programs or activities on the basis of r ace, color, national origin, sex, handicap or disability, age, sexual orientation, gender identity , religion, creed, ancestry , belief, veteran status or genetic information. Furthe rmore, Carnegie Mellon University does not discriminate and is required not to discriminate in violation of fede ral, state or local laws or executive orders",
        "retrieved_relevant_part": false,
        "model_answer": "David Singh",
        "actual_answer": "Dr. Farnam Jahanian",
        "exact_match": false,
        "f1_max_min_avg": [
            0,
            0,
            0.0
        ],
        "recall_max_min_avg": [
            0,
            0,
            0.0
        ]
    },
    {
        "question": "What are the school colors of Carnegie Mellon University?",
        "context": "Name of School: Carnegie Mellon University; City/Zip: Pittsburgh, PA 15213; Founded: 1900; Enrollment (undergrad): 6,982- Fall 2021; Enrollment (graduate and doctoral): 7,062 - Fall 2021; Alumni: 102,577; Nickname: Tartans; Mascot: Scottie Dog; School Colors: Cardinal and Gray; Football Stadium and Track and Field: Gesling Stadium; Capacity: 3,500; Surface: FieldTurf; Basketball/Volleyball Gym: Wiegand Gymnasium; Capacity: 500; Soccer Stadium: CMU Soccer Field; Capacity: 250; Surface: FieldTurf; Affiliation: NCAA Division III; Conference: University Athletic Association | Presidents' Athletic Conference (Football Only); President: Dr. Farnam Jahanian; Alma Mater, Year: University of Texas at Austin; Athletic Director: Dr. Josh Centor; Alma Mater, Year: Brandeis, 2004; Athletic Department Phone: 412-268-8054; Mailing Address:  5000 Forbes Avenue / Pittsburgh, PA 15213",
        "retrieved_doc": "You can find our official tartan on various items in the University Store.  Source: \"Tartan: Romancing the Plaid,\" by Jeffrey Banks and Doria De La Chapelle      Official Mascot? More than a century after Carnegie Mellon University opened its|Requests     Department Quick Facts  Name of School: Carnegie Mellon University  City/Zip: Pittsburgh, PA 15213  Founded: 1900  Enrollment (undergrad): 6,982- Fall 2021  Enrollment (graduate and doctoral): 7,062 - Fall 2021  Alumni: 102,577|6 1 Welcome Welcome to Carnegie Mellon University! Being in the CMU School of Computer Science (SCS) is a unique experience because of the size of the school (over 2000 students, staff and faculty), the quality of its members, the variety of research being conducted, and unparalleled learning opportunities. We encourage you to take adva ntage of CMU offerings, both inside and outside SCS, and also to explore Pittsburgh and southw est Pennsylvania to the extent your schedule permits. What you will find is an environm ent that encourages and rewards hard work and accomplishment. Pittsburgh has long been an indu strial area whose residents build things. In SCS we build things, and you will also. While this handbook is specific to your academic ex perience in the MSAII program, there are several other resources and offices graduate students are encouraged to consult during their tenure at Carnegie Mellon University. Infor mation about The Word, the student handbook, the Office of Graduate and Postdoc A ffairs, the Office of the Dean of Student Affairs and others are included in Appendix A of this handbook. 2 Mission, Vision and Philosophy Carnegie Mellon University will have a transfor mative impact on society through continual innovation in education, research, creativity, and entrepreneurship. Our mission is to create a transformative educatio nal experience for students focused on deep disciplinary knowledge; problem solving; teamwork, leadership, communication, and interpersonal skills; and pers onal health and well-being. The university community is committed to (a) at tracting and retaining diverse, world-class talent; (b) creating a collaborative environment open to the free exchange of ideas, in which research, creativity, innovation, and entrepreneu rship can flourish; and (c) ensuring individuals can achieve their full potential. We encourage our members to impact society in a transformative way \u2014 regionally, nationally, and globally \u2014 by engaging with partners out side the traditional bor ders of the university campus. See the full university mission statement . 3 Carnegie Mellon Statement of Assurance Carnegie Mellon University does not discriminate in admission, employment or administration of its programs or activities on the basis of r ace, color, national origin, sex, handicap or disability, age, sexual orientation, gender identity , religion, creed, ancestry , belief, veteran status or genetic information. Furthe rmore, Carnegie Mellon University does not discriminate and is required not to discriminate in violation of fede ral, state or local laws or executive orders|1967, the school merged with Mellon Institute and became what is known today as Carnegie Mellon University. What is a Tartan? The Carnegie Mellon athletic teams are nicknamed the \"Tartans\" as a nod to Andrew Carnegie's Scottish heritage. A tartan is|after Carnegie Mellon University opened its doors, an official mascot finally made its mark. Although students have dressed as a Scottish terrier \u2014 typically referred to as Scotty \u2014 for 50 years, it wasn't until 2007 that Carnegie Mellon officially|April 10, 2019 Buggy Races Keep Rolling at Carnegie Mellon In its 99th year, the tradition is a Spring Carnival treat By Heidi Opdyke opdyke(through)andrew.cmu.edu Media Inquiries  Julie Mattera Marketing and Communications",
        "retrieved_relevant_part": false,
        "model_answer": "Carnegie Mellon University has a transforative impact on society regionally, nationally, and globally by engaging with partners outside the traditional borders of the university campus",
        "actual_answer": "Cardinal and Gray",
        "exact_match": false,
        "f1_max_min_avg": [
            0.07,
            0.07,
            0.07
        ],
        "recall_max_min_avg": [
            0.33,
            0.33,
            0.33
        ]
    },
    {
        "question": "What is the capacity of Gesling Stadium at Carnegie Mellon University?",
        "context": "Name of School: Carnegie Mellon University; City/Zip: Pittsburgh, PA 15213; Founded: 1900; Enrollment (undergrad): 6,982- Fall 2021; Enrollment (graduate and doctoral): 7,062 - Fall 2021; Alumni: 102,577; Nickname: Tartans; Mascot: Scottie Dog; School Colors: Cardinal and Gray; Football Stadium and Track and Field: Gesling Stadium; Capacity: 3,500; Surface: FieldTurf; Basketball/Volleyball Gym: Wiegand Gymnasium; Capacity: 500; Soccer Stadium: CMU Soccer Field; Capacity: 250; Surface: FieldTurf; Affiliation: NCAA Division III; Conference: University Athletic Association | Presidents' Athletic Conference (Football Only); President: Dr. Farnam Jahanian; Alma Mater, Year: University of Texas at Austin; Athletic Director: Dr. Josh Centor; Alma Mater, Year: Brandeis, 2004; Athletic Department Phone: 412-268-8054; Mailing Address:  5000 Forbes Avenue / Pittsburgh, PA 15213",
        "retrieved_doc": "doctoral): 7,062 - Fall 2021  Alumni: 102,577  Nickname: Tartans  Mascot: Scottie Dog  School Colors: Cardinal and Gray  Football Stadium and Track and Field: Gesling Stadium  Capacity: 3,500  Surface: FieldTurf  Basketball/Volleyball Gym: Wiegand|Requests     Department Quick Facts  Name of School: Carnegie Mellon University  City/Zip: Pittsburgh, PA 15213  Founded: 1900  Enrollment (undergrad): 6,982- Fall 2021  Enrollment (graduate and doctoral): 7,062 - Fall 2021  Alumni: 102,577|LTI Ph.D. Graduate Student Handbook Page 39 accommodating retail and dining services. As the campus crossroads, the University Center functions as a place for students to interact, get involved and enjoy new experiences . Visit the University Center website for information about campus eateries, ATMs and PNC Bank, fitness rooms and schedules, retail stores, scheduling University Center space, the public prayer room, student organizations, and the Wright-Rogal Chapel. The University Center Information Desk (first floor of the Cohon Center next to Wean Commons and Kirr Commons) is the lo cation if you want to know about upcoming campus events or have questions about Carnegie Mellon in general, call the Information Desk at 412-268-2107. The Information Desk not only provides information about campus events, but also sells postage stamps, makes copies, sends faxes, distributes campus maps, manages a lost & found, and has information brochures about Pittsburgh and the campus. 6.17 Athletic/Fitness Facilities www.cmu.edu/athletics For the participant or the spectator, Carnegie Mellon offers intercollegiate athletics, intramural sports, physical education classes and club sports. The Athletics Department also offers aerobics classes in the University Center as well as occasional workshops and instruction related to fitness and health . The administrative offices are located in the Cohon University Fitness Center . The University Center\u2019s recreational facilities include an eight-lane pool, racquetball and squash courts, aerobics room, fitness center and gym for basketball and volleyball. With renovations to Skibo Gym and the new Highmark Center for Health, Wellness , and Athletic s scheduled for completion in 2024, the strength and conditioning facility has been temporarily place d on the lawn next to the outdoor basketball court close to the Donner locker rooms, Gesling Stadium, and Weigand Gymnasium. All users must present a valid CMU ID to use these facilities. 6.18 CMU Alert www.cmu.edu/alert CMU Alert sends voice and/or text messages to registered phones in the event of a campus emergency that threatens public safety or during tests of the system in the spring and fall semesters. Students are automatically registered for CMU-Alert using the current contact information that has been entered into the Student Information Online (SIO): https://www.cmu.edu/hub/sio/about.html |43athletics, intramural sports, physical education classes and club sports. The Athletics Department also offers aerobics classes in the University Center and Skibo Gym as well as occasional workshops and instruction related to fitness and health. The Athletics Office is located in the Skibo Gymnasium. Skibo Gym facilities include courts for basketball, volleyball, badminton, as well as weight-training and aerobic equipment. The University Center\u2019s recreational facilities include an eight-lane pool, racquetball and squash courts, aerobics room, fitness center and gym for basketball and volleyball. All users must present a current Carnegie Mellon Card to use these facilities. More information can be found at: http://www.cmu.edu/athletics 6.19 CMU Alert CMU Alert sends voice and/or text messages to registered phones in the event of a campus emergency that threatens public safety or during tests of the system in the Spring and Fall semesters. Students can register for CMU Alert through the web site. More information can be found at: http://www.cmu.edu/alert 6.20 Accidents on CMU property Please report all accidents to Charity Anderson (caanders@andrew.cmu.edu) and the MCDS program administrator. You will be asked to complete an accident report. By reporting accidents, the student helps minimize future harm! Serious accidents and accidents taking place elsewhere on campus should be reported to Campus Police, x8-6232 (non-emergency), x8-2323 (emergency). 6.21 Consumer Information Carnegie Mellon University suggests that all current and prospective students be informed consumers. Please see this link for detailed consumer information: https://www.cmu.edu/hub/consumer-information/ |40 SafeWalk information can be found at https://www.cmu.edu/admission/campus-experience/student-services. 13.16 Copying, Printing and Mailing Services Carnegie Mellon offers community members easy access to FedEx, copy centers, printing and mailing services, and postal services. More info rmation regarding these services, locations and contact information can be found in The Word at www.cmu.edu/tartanink/copyprint/index.html 13.17 University Center www.cmu.edu/university-center The University Center is a centerpiece of the camp us that provides a space for special events, physical fitness, student organizations and vari ous activities, as well as accommodating retail and dining services. As the campus crossroads, the University Center fu nctions as a place for students to interact, get involved and enjoy new experiences. Visit the University Center website for information about campus eateri es, ATMs and PNC Bank, fitness rooms and schedules, retail stores, schedu ling University Center space, th e public prayer room, student organizations and the Wright-Rogal Chapel. The University Center Information Desk is the lo cation if you want to know about upcoming campus events or have questions about Carnegie Me llon in general, call th e Information Desk at 412-268-2107. The Information Desk not only provides information about campus events, but also sells postage stamps, makes copies, sends fa xes, distributes campus maps, manages a lost & found, and has information brochures about Pittsburgh and the campus. 13.18 Athletic/Fitness Facilities www.cmu.edu/athletics For the participant or the spectator, Carnegie Me llon offers intercollegiate athletics, intramural sports, physical education classes and club sports. The Athletics Department also offers aerobics classes in the University Center and Skibo Gym as well as occa sional workshops and instruction related to fitness and health. The Athletics Office is located in the Cohon University Center. Skibo Gym facilities include courts for basketba ll, volleyball, badminton, as well as weight-training and aerobic equipment. The University Cent er\u2019s recreational facilities include an eight-lane pool, racquetball and squash courts, aerobi cs room, fitness center and gym for basketball and volleyball. All users must pr esent a current Carnegie Mellon Card to use these facilities|FieldTurf  Basketball/Volleyball Gym: Wiegand Gymnasium  Capacity: 500  Soccer Stadium: CMU Soccer Field  Capacity: 250 Surface: FieldTurf Affiliation: NCAA Division III Conference: University Athletic Association | Presidents' Athletic Conference",
        "retrieved_relevant_part": false,
        "model_answer": "Gesling Stadium at Carnegie Mellon University has a capacity of 3,500",
        "actual_answer": "3500",
        "exact_match": false,
        "f1_max_min_avg": [
            0,
            0,
            0.0
        ],
        "recall_max_min_avg": [
            0,
            0,
            0.0
        ]
    },
    {
        "question": "What is the scheduled time for the President's Graduates Toast?",
        "context": "Diploma ceremonies will take place both on and off campus. Locations and times for diploma ceremonies will be provided soon.\n    Diploma ceremonies typically include a reception and the length of time for each ceremony varies based on the number of graduates.\n\nMore details on the weekend schedule, including a diploma ceremony schedule, will be provided in the coming weeks.  \n, \n\nThursday, May 9\n\nPhi Beta Kappa Initiation Ceremony\nCeremony: 2\u20133 p.m.\nMcConomy Auditorium, Cohon University Center\nReception: 3\u20134 p.m.\nConnan Room, Cohon University Center\n\nContact:\nJoseph Devine\njd0x@andrew.cmu.edu \n\nJoanne Ursenbach\njoanneu@andrew.cmu.edu \n\nPresident's Graduates Toast (bachelor's students)\n3:30\u20134:30 p.m.\nLocation TBD\nRegistration required. Invitation, along with registration details, will be sent in late April.",
        "retrieved_doc": "Thursday, May 9  Phi Beta Kappa Initiation Ceremony Ceremony: 2\u20133 p.m. McConomy Auditorium, Cohon University Center Reception: 3\u20134 p.m. Connan Room, Cohon University Center  Contact: Joseph Devine jd0x@andrew.cmu.edu   Joanne Ursenbach joanneu@andrew.cmu.edu   President's Graduates Toast (bachelor's students) 3:30\u20134:30 p.m. Location TBD Registration required. Invitation, along with registration details, will be sent in late April.  First Gen Graduation Recognition Reception: 5-5:30 p.m. Alumni Concert Hall, College of Fine Arts Ceremony: 5:30-6:30p.m. Kresge Theater, College of Fine Arts  Contact: M. Shernell Smith mssmith@andrew.cmu.edu   Sam Colavecchio scolavec@andrew.cmu.edu  412-268-7733|What is the difference between a diploma ceremony and the main commencement ceremony?  All graduates (bachelor\u2019s, master\u2019s and doctoral degree candidates) will be celebrated at the main commencement ceremony on Sunday, May 12. The ceremony will include a procession of graduates, conferral of degrees, remarks from the president, keynote speaker, student speaker and academic deans, in addition to recognition of the honorary degree recipients.  In addition to the main commencement ceremony, each college/school/department will host a diploma ceremony to recognize their graduating students. Diploma ceremonies will be held over the course of the weekend (Friday, May 10\u2013Sunday, May 12) and include the presentation of diplomas to graduates, hooding of doctoral candidates and remarks from their college/school/department leadership.|Graduates  Congratulations on your upcoming graduation! We can't wait to celebrate with you during Commencement, May 10 \u2013 12, 2024.  The following groups are eligible to participate in commencement exercises:      Bachelor\u2019s degree students who completed their degree in August 2023, December 2023 and expected May and August 2024 graduates.     Master\u2019s degree students who completed their degree in August 2023, December 2023 and expected May and August 2024 graduates.     Doctoral degree students who have defended their dissertation and completed all degree requirements in August 2023, December 2023 and expected May 2024 graduates.  As you plan for commencement weekend, refer to this page for information about deadlines, cap and gown, robing, processional and more. We will update the site with new information frequently so check back often!|Saturday, May 11  Diploma Ceremonies Various times  Center for Student Diversity and Inclusion Ceremony Noon\u20132:30 p.m. Simmons Auditorium, Tepper Building  Contact: M. Shernell Smith mssmith@andrew.cmu.edu   Sam Colavecchio scolavec@andrew.cmu.edu   Naval ROTC Commissioning Ceremony: 1:30-2:30 p.m. Auditorium, Soldiers & Sailors Memorial Hall & Museum * 4141 Fifth Avenue, Pittsburgh, PA 15213  Contact: Mike Danko mdanko@andrew.cmu.edu   The President\u2019s Reception in honor of CMU\u2019s Doctoral Candidates 4\u20136 p.m. Tepper Building Atrium|Diploma Ceremonies      In addition to the main commencement ceremony, each college/school/department will host a diploma ceremony to recognize all graduating students. Diploma ceremonies will be held over the course of the weekend (Friday, May 10\u2013Sunday, May 12).     Diploma ceremonies will include the presentation of diplomas to graduates, hooding of doctoral candidates and remarks from their college/school/department leadership. Each ceremony is organized and customized by their college/school/department.     Diploma ceremonies will take place both on and off campus. Locations and times for diploma ceremonies will be provided soon.     Diploma ceremonies typically include a reception and the length of time for each ceremony varies based on the number of graduates.  More details on the weekend schedule, including a diploma ceremony schedule, will be provided in the coming weeks.|Friday, May 10  Diploma Ceremonies Various times  Senior Leadership Recognition Ceremony 4\u20135:30 p.m. Wiegand Gym, Cohon University Center Undergraduate students and their guests by invitation only. This ceremony recognizes nominated seniors who have reflected upon their specific leadership contributions during their time at CMU.",
        "retrieved_relevant_part": false,
        "model_answer": "The President's Graduates Toast will take place on May 11, 2024, from 3:30 p.m. to 4:30 p.m",
        "actual_answer": "3:30\u20134:30 p.m",
        "exact_match": false,
        "f1_max_min_avg": [
            0.11,
            0.11,
            0.11
        ],
        "recall_max_min_avg": [
            0.5,
            0.5,
            0.5
        ]
    },
    {
        "question": "What is the duration of the Diploma ceremonies.",
        "context": " Diploma ceremonies will be held over the course of the weekend (Friday, May 10\u2013Sunday, May 12) and include the presentation of diplomas to graduates, hooding of doctoral candidates and remarks from their college/school/department leadership.",
        "retrieved_doc": "Diploma Ceremonies      In addition to the main commencement ceremony, each college/school/department will host a diploma ceremony to recognize all graduating students. Diploma ceremonies will be held over the course of the weekend (Friday, May 10\u2013Sunday, May 12).     Diploma ceremonies will include the presentation of diplomas to graduates, hooding of doctoral candidates and remarks from their college/school/department leadership. Each ceremony is organized and customized by their college/school/department.     Diploma ceremonies will take place both on and off campus. Locations and times for diploma ceremonies will be provided soon.     Diploma ceremonies typically include a reception and the length of time for each ceremony varies based on the number of graduates.  More details on the weekend schedule, including a diploma ceremony schedule, will be provided in the coming weeks.|What is the difference between a diploma ceremony and the main commencement ceremony?  All graduates (bachelor\u2019s, master\u2019s and doctoral degree candidates) will be celebrated at the main commencement ceremony on Sunday, May 12. The ceremony will include a procession of graduates, conferral of degrees, remarks from the president, keynote speaker, student speaker and academic deans, in addition to recognition of the honorary degree recipients.  In addition to the main commencement ceremony, each college/school/department will host a diploma ceremony to recognize their graduating students. Diploma ceremonies will be held over the course of the weekend (Friday, May 10\u2013Sunday, May 12) and include the presentation of diplomas to graduates, hooding of doctoral candidates and remarks from their college/school/department leadership.|Diplomas  Graduating students will receive diplomas at their diploma ceremonies, which colleges/schools/departments will host throughout the weekend. We will share a final schedule in the coming weeks.    If you are unable to attend your diploma ceremony, we will mail you your diploma. You should enter your diploma delivery addresses in SIO under Academic Info > Graduation and Diploma. Because students often move shortly after graduation, we use this address instead of your permanent address.  If you are eligible to receive honors cords and medallions, you will receive them either prior to commencement or at your diploma ceremony. We will share more details in the spring.     If you have questions regarding diploma distribution, please contact Enrollment Services at uro-diplomas@andrew.cmu.edu.|Friday, May 10  Diploma Ceremonies Various times  Senior Leadership Recognition Ceremony 4\u20135:30 p.m. Wiegand Gym, Cohon University Center Undergraduate students and their guests by invitation only. This ceremony recognizes nominated seniors who have reflected upon their specific leadership contributions during their time at CMU.|Saturday, May 11  Diploma Ceremonies Various times  Center for Student Diversity and Inclusion Ceremony Noon\u20132:30 p.m. Simmons Auditorium, Tepper Building  Contact: M. Shernell Smith mssmith@andrew.cmu.edu   Sam Colavecchio scolavec@andrew.cmu.edu   Naval ROTC Commissioning Ceremony: 1:30-2:30 p.m. Auditorium, Soldiers & Sailors Memorial Hall & Museum * 4141 Fifth Avenue, Pittsburgh, PA 15213  Contact: Mike Danko mdanko@andrew.cmu.edu   The President\u2019s Reception in honor of CMU\u2019s Doctoral Candidates 4\u20136 p.m. Tepper Building Atrium|Commencement Schedule  We are proud to celebrate our newest graduates during this year\u2019s commencement exercises!  Main Commencement Ceremony      Bachelor\u2019s, master\u2019s and doctoral degree candidates and their guests are invited to join the main commencement ceremony on Sunday, May 12, for the conferral of all degrees.     The main ceremony will include remarks from the president, keynote speaker, student speaker and academic deans, in addition to recognition of the honorary degree recipients.     There is no limit on number of guests who can attend the main commencement ceremony and tickets are not needed.     The ceremony will take place on CMU\u2019s campus beginning at 10 a.m. and will be approximately 1.5 hours long. All guests must be seated by 9:15 a.m. for the start of teh student procession. Access to guest seating will be restricted once the student procession begins.",
        "retrieved_relevant_part": false,
        "model_answer": "The Diploma ceremonies will take place on May 12, 2023, with the conferral of degrees and remarks from the president",
        "actual_answer": "3 days.",
        "exact_match": false,
        "f1_max_min_avg": [
            0,
            0,
            0.0
        ],
        "recall_max_min_avg": [
            0,
            0,
            0.0
        ]
    },
    {
        "question": "Is there a limit to the number of guests for the main commencement ceremony?",
        "context": "Are there any restrictions for guests?\n\nGuests are welcome to attend commencement exercises. There is no limit to the number of guests for the main commencement ceremony and tickets are not needed. \n\nThere is no limit to the number of guests for the President\u2019",
        "retrieved_doc": "Are there any restrictions for guests?  Guests are welcome to attend commencement exercises. There is no limit to the number of guests for the main commencement ceremony and tickets are not needed.   There is no limit to the number of guests for the President\u2019s Reception for Doctoral Candidates and tickets are not needed. However, we ask that all doctoral graduates register the number of guests they are planning to bring to the reception so that we can prepare accordingly.   Please note that some diploma ceremonies will limit guests based on venue capacity.|Commencement Schedule  We are proud to celebrate our newest graduates during this year\u2019s commencement exercises!  Main Commencement Ceremony      Bachelor\u2019s, master\u2019s and doctoral degree candidates and their guests are invited to join the main commencement ceremony on Sunday, May 12, for the conferral of all degrees.     The main ceremony will include remarks from the president, keynote speaker, student speaker and academic deans, in addition to recognition of the honorary degree recipients.     There is no limit on number of guests who can attend the main commencement ceremony and tickets are not needed.     The ceremony will take place on CMU\u2019s campus beginning at 10 a.m. and will be approximately 1.5 hours long. All guests must be seated by 9:15 a.m. for the start of teh student procession. Access to guest seating will be restricted once the student procession begins.|What is the difference between a diploma ceremony and the main commencement ceremony?  All graduates (bachelor\u2019s, master\u2019s and doctoral degree candidates) will be celebrated at the main commencement ceremony on Sunday, May 12. The ceremony will include a procession of graduates, conferral of degrees, remarks from the president, keynote speaker, student speaker and academic deans, in addition to recognition of the honorary degree recipients.  In addition to the main commencement ceremony, each college/school/department will host a diploma ceremony to recognize their graduating students. Diploma ceremonies will be held over the course of the weekend (Friday, May 10\u2013Sunday, May 12) and include the presentation of diplomas to graduates, hooding of doctoral candidates and remarks from their college/school/department leadership.|Sunday, May 12  Gesling Stadium opens to guests 8 a.m.  Robing and procession for graduates 9\u201310 a.m. Various locations across campus  Student procession begins 9:15 a.m. All guests in stadium must be seated. Access to guest seating will be restricted once the procession begins.  Commencement Ceremony 10\u201311:30 a.m. Gesling Stadium, CMU\u2019s campus  Diploma Ceremonies Various times|Are drones or unmanned aircraft systems permitted to be operated as part of commencement? The operation of drones is prohibited prior to, during and after the commencement ceremony on May 12. For more information about the Drone Safety Program, click here.|Cap & Gown  If you plan to attend the main commencement ceremony or your diploma ceremony, you should plan to purchase a cap and gown.  To purchase cap, gown and in-stock diploma frames, be sure to stop by Rangos Ballroom on March 13-14 from 10 a.m.-5 p.m. Check out graduation swag, class rings and announcements, and enter to win door prizes.  If you are unable to attend, you can purchase your regalia at the University Store or order online by April 12 to have it shipped to you in time. Regalia fees can be found here.",
        "retrieved_relevant_part": false,
        "model_answer": "Yes",
        "actual_answer": "There is no limit to the number of guests for the main commencement ceremony.",
        "exact_match": false,
        "f1_max_min_avg": [
            0,
            0,
            0.0
        ],
        "recall_max_min_avg": [
            0,
            0,
            0.0
        ]
    },
    {
        "question": "Which group of Bachelor students are eligible to participate in commencement exercises?",
        "context": "Congratulations on your upcoming graduation! We can't wait to celebrate with you during Commencement, May 10 \u2013 12, 2024.\n\nThe following groups are eligible to participate in commencement exercises:\n\n    Bachelor\u2019s degree students who completed their degree in August 2023, December 2023 and expected May and August 2024 graduates.\n    Master\u2019s degree students who completed their degree in August 2023, December 2023 and expected May and August 2024 graduates.\n",
        "retrieved_doc": "Graduates  Congratulations on your upcoming graduation! We can't wait to celebrate with you during Commencement, May 10 \u2013 12, 2024.  The following groups are eligible to participate in commencement exercises:      Bachelor\u2019s degree students who completed their degree in August 2023, December 2023 and expected May and August 2024 graduates.     Master\u2019s degree students who completed their degree in August 2023, December 2023 and expected May and August 2024 graduates.     Doctoral degree students who have defended their dissertation and completed all degree requirements in August 2023, December 2023 and expected May 2024 graduates.  As you plan for commencement weekend, refer to this page for information about deadlines, cap and gown, robing, processional and more. We will update the site with new information frequently so check back often!|Diploma Ceremonies      In addition to the main commencement ceremony, each college/school/department will host a diploma ceremony to recognize all graduating students. Diploma ceremonies will be held over the course of the weekend (Friday, May 10\u2013Sunday, May 12).     Diploma ceremonies will include the presentation of diplomas to graduates, hooding of doctoral candidates and remarks from their college/school/department leadership. Each ceremony is organized and customized by their college/school/department.     Diploma ceremonies will take place both on and off campus. Locations and times for diploma ceremonies will be provided soon.     Diploma ceremonies typically include a reception and the length of time for each ceremony varies based on the number of graduates.  More details on the weekend schedule, including a diploma ceremony schedule, will be provided in the coming weeks.|What is the difference between a diploma ceremony and the main commencement ceremony?  All graduates (bachelor\u2019s, master\u2019s and doctoral degree candidates) will be celebrated at the main commencement ceremony on Sunday, May 12. The ceremony will include a procession of graduates, conferral of degrees, remarks from the president, keynote speaker, student speaker and academic deans, in addition to recognition of the honorary degree recipients.  In addition to the main commencement ceremony, each college/school/department will host a diploma ceremony to recognize their graduating students. Diploma ceremonies will be held over the course of the weekend (Friday, May 10\u2013Sunday, May 12) and include the presentation of diplomas to graduates, hooding of doctoral candidates and remarks from their college/school/department leadership.|Are drones or unmanned aircraft systems permitted to be operated as part of commencement? The operation of drones is prohibited prior to, during and after the commencement ceremony on May 12. For more information about the Drone Safety Program, click here.|Saturday, May 11  Diploma Ceremonies Various times  Center for Student Diversity and Inclusion Ceremony Noon\u20132:30 p.m. Simmons Auditorium, Tepper Building  Contact: M. Shernell Smith mssmith@andrew.cmu.edu   Sam Colavecchio scolavec@andrew.cmu.edu   Naval ROTC Commissioning Ceremony: 1:30-2:30 p.m. Auditorium, Soldiers & Sailors Memorial Hall & Museum * 4141 Fifth Avenue, Pittsburgh, PA 15213  Contact: Mike Danko mdanko@andrew.cmu.edu   The President\u2019s Reception in honor of CMU\u2019s Doctoral Candidates 4\u20136 p.m. Tepper Building Atrium|Thursday, May 9  Phi Beta Kappa Initiation Ceremony Ceremony: 2\u20133 p.m. McConomy Auditorium, Cohon University Center Reception: 3\u20134 p.m. Connan Room, Cohon University Center  Contact: Joseph Devine jd0x@andrew.cmu.edu   Joanne Ursenbach joanneu@andrew.cmu.edu   President's Graduates Toast (bachelor's students) 3:30\u20134:30 p.m. Location TBD Registration required. Invitation, along with registration details, will be sent in late April.  First Gen Graduation Recognition Reception: 5-5:30 p.m. Alumni Concert Hall, College of Fine Arts Ceremony: 5:30-6:30p.m. Kresge Theater, College of Fine Arts  Contact: M. Shernell Smith mssmith@andrew.cmu.edu   Sam Colavecchio scolavec@andrew.cmu.edu  412-268-7733",
        "retrieved_relevant_part": false,
        "model_answer": "Bachelor students who completed their degree in August 2023, December 2023, and are expected to graduate in May and August 2024",
        "actual_answer": "Bachelors who completed their degree in August 2023, December 2023 and expected May and August 2024 graduates.",
        "exact_match": false,
        "f1_max_min_avg": [
            0.63,
            0.63,
            0.63
        ],
        "recall_max_min_avg": [
            0.71,
            0.71,
            0.71
        ]
    },
    {
        "question": "Where can students buy the Class Rings?",
        "context": "Diploma Frames, Class Rings and other Graduation Merchandise\n\nYou can purchase items to help commemorate your graduation at the University Store.",
        "retrieved_doc": "Diploma Frames, Class Rings and other Graduation Merchandise  You can purchase items to help commemorate your graduation at the University Store.  Visit the University Store website and choose the Graduation tab for more information on ordering CMU personalized class rings, personalized announcements, gifts, diploma frames and more to celebrate your graduation.|Cap & Gown  If you plan to attend the main commencement ceremony or your diploma ceremony, you should plan to purchase a cap and gown.  To purchase cap, gown and in-stock diploma frames, be sure to stop by Rangos Ballroom on March 13-14 from 10 a.m.-5 p.m. Check out graduation swag, class rings and announcements, and enter to win door prizes.  If you are unable to attend, you can purchase your regalia at the University Store or order online by April 12 to have it shipped to you in time. Regalia fees can be found here.|email the Direcator at jolisar@andrew.cmu.edu.  Q: Can I borrow a school instrument? A: There are several Kiltie-owned instruments available for your use. Loans begin at 4:30 p.m. before the first rehearsal.   Q: What do they wear under those kilts?|Fall offering: Course: 24204 Title: Special Topics: Maker Series: Intro to Metal Jewelry Units: 3.0 Lec/Sec: Section S2 Days: Wednesday Begin: 07:00PM End: 08:50PM Bldg/Room: ANS C03 Location: Pittsburgh, Pennsylvania Instructor(s): Hitchcock |Spring offering: Course: 24204 Title: Special Topics: Maker Series: Intro to Metal Jewelry Units: 3.0 Lec/Sec: Section S4 Days: Wednesday Begin: 06:00PM End: 07:50PM Bldg/Room: ANS C03 Location: Pittsburgh, Pennsylvania Instructor(s): Hitchcock |Spring offering: Course: 24204 Title: Special Topics: Maker Series: Intro to Metal Jewelry Units: 3.0 Lec/Sec: Section S3 Days: Wednesday Begin: 06:00PM End: 07:50PM Bldg/Room: ANS C03 Location: Pittsburgh, Pennsylvania Instructor(s): Hitchcock ",
        "retrieved_relevant_part": false,
        "model_answer": "Students can purchase the Class Rings at the University Store",
        "actual_answer": "at the University Store.",
        "exact_match": false,
        "f1_max_min_avg": [
            0.43,
            0.43,
            0.43
        ],
        "recall_max_min_avg": [
            0.75,
            0.75,
            0.75
        ]
    },
    {
        "question": "Who are welcomed to the Carnegie Mellon University Alumni Association?",
        "context": "Congratulations graduating students and welcome to the Carnegie Mellon University Alumni Association!",
        "retrieved_doc": "CMU Alumni Association  Congratulations graduating students and welcome to the Carnegie Mellon University Alumni Association! Learn how to connect with other alumni and engage with the university through events and other alumni programming by joining the CMU Alumni Community.  Following your graduation, you will begin receiving information about upcoming events, available resources, campus news and more to help introduce you to the Alumni Association. To ensure that you receive these messages, please update your contact information. And as your city, job and contact information change over time, please keep your information current so that we can stay in touch!|April 13, 2024: Event Name: 50th Reunion Medallion Luncheon (1974 and Half Century Tartans) 11:30 AM-1:30 PMET Reunion Exclusive Join us for the Class of 1974 induction into the Half Century Tartans and celebrate with CMU leadership at this annual recognition event. As new members, you will receive your 50th Reunion Medallion during the event. The Half Century Tartans recognizes all alumni who have celebrated 50 or more years as an alumnus with Carnegie Mellon. All Half Century Tartans members are invited to attend as well. Note: Registration required. No event fee. This event is open to the Class of 1974 and Half Century Tartans alumni and their guests. |6 1 Welcome Welcome to Carnegie Mellon University! Being in the CMU School of Computer Science (SCS) is a unique experience because of the size of the school (over 2000 students, staff and faculty), the quality of its members, the variety of research being conducted, and unparalleled learning opportunities. We encourage you to take adva ntage of CMU offerings, both inside and outside SCS, and also to explore Pittsburgh and southw est Pennsylvania to the extent your schedule permits. What you will find is an environm ent that encourages and rewards hard work and accomplishment. Pittsburgh has long been an indu strial area whose residents build things. In SCS we build things, and you will also. While this handbook is specific to your academic ex perience in the MSAII program, there are several other resources and offices graduate students are encouraged to consult during their tenure at Carnegie Mellon University. Infor mation about The Word, the student handbook, the Office of Graduate and Postdoc A ffairs, the Office of the Dean of Student Affairs and others are included in Appendix A of this handbook. 2 Mission, Vision and Philosophy Carnegie Mellon University will have a transfor mative impact on society through continual innovation in education, research, creativity, and entrepreneurship. Our mission is to create a transformative educatio nal experience for students focused on deep disciplinary knowledge; problem solving; teamwork, leadership, communication, and interpersonal skills; and pers onal health and well-being. The university community is committed to (a) at tracting and retaining diverse, world-class talent; (b) creating a collaborative environment open to the free exchange of ideas, in which research, creativity, innovation, and entrepreneu rship can flourish; and (c) ensuring individuals can achieve their full potential. We encourage our members to impact society in a transformative way \u2014 regionally, nationally, and globally \u2014 by engaging with partners out side the traditional bor ders of the university campus. See the full university mission statement . 3 Carnegie Mellon Statement of Assurance Carnegie Mellon University does not discriminate in admission, employment or administration of its programs or activities on the basis of r ace, color, national origin, sex, handicap or disability, age, sexual orientation, gender identity , religion, creed, ancestry , belief, veteran status or genetic information. Furthe rmore, Carnegie Mellon University does not discriminate and is required not to discriminate in violation of fede ral, state or local laws or executive orders|April 12, 2024: Event Name: 50th Reunion Breakfast/Then & Now Presentation (1974) 9:00 AM-11:00 AMET Reunion Exclusive Join fellow classmates for a welcome breakfast, reliving your time as students and learning about today\u2019s Carnegie Mellon from University Archivist Julia Corrin. Can't make it back to campus? Register for the livestream during registration. Additionally, a closed-captioned recording will be available on the Carnival website a week after Carnival. Note: Registration required. No event fee. This event is open to the Class of 1974 and Half Century Tartan Reunion celebrants. |April 13, 2024: Event Name: Current & Former CMU AAB Member Coffee Catch Up (Private Event) 1:00 PM-2:30 PMET Private Event Attention Alumni Association Board Alumni: Calling all current and past members of the CMU AAB! Join us for a casual AABA Network Social to catch up and reconnect with current and former Carnegie Mellon Alumni Association Board members. Note: Private event. No event fee. This event is for alumni and current members of the Alumni Association Board only. |Requests     Department Quick Facts  Name of School: Carnegie Mellon University  City/Zip: Pittsburgh, PA 15213  Founded: 1900  Enrollment (undergrad): 6,982- Fall 2021  Enrollment (graduate and doctoral): 7,062 - Fall 2021  Alumni: 102,577",
        "retrieved_relevant_part": false,
        "model_answer": "The Carnegie Mellon University Alumni Association is open to current and past members of the Carnegie Mellon University community",
        "actual_answer": "graduating students.",
        "exact_match": false,
        "f1_max_min_avg": [
            0,
            0,
            0.0
        ],
        "recall_max_min_avg": [
            0,
            0,
            0.0
        ]
    },
    {
        "question": "Who created the first smile in an email?",
        "context": "The first smile in an email, created in 1982 by professor Scott Fahlman",
        "retrieved_doc": "5. Emoticons, 1982Sure, it was just a joke, but (for better or worse) it\u2019s endured for more than three decades. CMU researcher Scott Fahlman created the emoticon to clear up misunderstandings on computer message boards. We\u2019ve been looking at the world sideways ever since. :-)|13. Email attachments, 1992Steve Jobs liked the email system built into CMU\u2019s Andrew so much that he tried to hire Nathaniel Borenstein (CS\u201981,\u201985) and the rest of his team to create a similar program for Apple. Borenstein didn\u2019t take the offer, but he did like Jobs\u2019 idea about attaching documents to email. Borenstein went on to develop the MIME standard that\u2019s used by all email programs to send photos and other files over the Internet.|16. CAPTCHAs, 2000 \u201cSpam\u201d and malicious attacks were a growing problem on the Internet when hackers developed automated \u201cbots\u201d that could sign up for email and other Web services without human intervention. Luis von Ahn (CS\u201903,\u201905), Nick Hopper (CS\u201904), John Langford (CS\u201902) and CMU professor Manuel Blum invented a \u201cCompletely Automated Public Turing Test to tell Computers and Humans Apart,\u201d or CAPTCHA, to help foil the bots. A later variation, reCAPTCHA, is helping digitize old books and newspapers.|Author: Maarten Sap Title: From Dogwhistles to Bullhorns: Unveiling Coded Rhetoric with Language Models Publication year: 2023 Coauthors: Julia Mendelsohn, Ronan Le Bras, Yejin Choi, Maarten Sap Abstract: Dogwhistles are coded expressions that simultaneously convey one meaning to a broad audience and a second, often hateful or provocative, meaning to a narrow in-group; they are deployed to evade both political repercussions and algorithmic content moderation. For example, the word \u201ccosmopolitan\u201d in a sentence such as \u201cwe need to end the cosmopolitan experiment\u201d can mean \u201cworldly\u201d to many but also secretly mean \u201cJewish\u201d to a select few. We present the first large-scale computational investigation of dogwhistles. We develop a typology of dogwhistles, curate the largest-to-date glossary of over 300 dogwhistles with rich contextual information and examples, and analyze their usage in historical U.S. politicians\u2019 speeches. We then assess whether a large language model (GPT-3) can identify dogwhistles and their meanings, and find that GPT-3\u2019s performance varies widely across types of dogwhistles and targeted groups. Finally, we show that harmful content containing dogwhistles avoids toxicity detection, highlighting online risks presented by such coded language. This work sheds light on the theoretical and applied importance of dogwhistles in both NLP and computational social science, and provides resources to facilitate future research in modeling dogwhistles and mitigating their online harms.|6. Andrew project, 1982It was long the dream of computer scientists to put a workstation in every home and office, but no one had actually tried to accomplish it until researchers from Carnegie Mellon University and IBM launched the Andrew Project. Soon, every student, faculty member and employee had access to email, word processing, file-transfer services and graphics programs, and CMU was the most-wired campus in the world.|Author: Eric Xing Title: ALISON: Fast and Effective Stylometric Authorship Obfuscation Publication year: 2024 Coauthors: Eric Xing, Saranya Venkatraman, Thai Le, Dongwon Lee Abstract: Authorship Attribution (AA) and Authorship Obfuscation (AO) are two competing tasks of increasing importance in privacy research. Modern AA leverages an author's consistent writing style to match a text to its author using an AA classifier. AO is the corresponding adversarial task, aiming to modify a text in such a way that its semantics are preserved, yet an AA model cannot correctly infer its authorship. To address privacy concerns raised by state-of-the-art (SOTA) AA methods, new AO methods have been proposed but remain largely impractical to use due to their prohibitively slow training and obfuscation speed, often taking hours. To this challenge, we propose a practical AO method, ALISON, that (1) dramatically reduces training/obfuscation time, demonstrating more than 10x faster obfuscation than SOTA AO methods, (2) achieves better obfuscation success through attacking three transformer-based AA methods on two benchmark datasets, typically performing 15% better than competing methods, (3) does not require direct signals from a target AA classifier during obfuscation, and (4) utilizes unique stylometric features, allowing sound model interpretation for explainable obfuscation. We also demonstrate that ALISON can effectively prevent four SOTA AA methods from accurately determining the authorship of ChatGPT-generated texts, all while minimally changing the original text semantics. To ensure the reproducibility of our findings, our code and data are available at: https://github.com/EricX003/ALISON.",
        "retrieved_relevant_part": false,
        "model_answer": "Maarten Sap created the first smile in an email",
        "actual_answer": "Scott Fahlman",
        "exact_match": false,
        "f1_max_min_avg": [
            0,
            0,
            0.0
        ],
        "recall_max_min_avg": [
            0,
            0,
            0.0
        ]
    },
    {
        "question": "What is the ranking of CMU in Times Higher Education World University Ranking in 2023?",
        "context": "Times Higher Education  \nWorld University \nRanking, 2023#19",
        "retrieved_doc": "D.C.; Australia; China; Portugal and Rwanda.    The Future  CMU is positioned like never before to meet the challenges of the 21st century. In the coming years, the university will see the largest expansion to the Pittsburgh campus since 1900. At|Carnegie Mellon University has been a birthplace  of innovation since its founding in 1900. Today, CMU is a global leader bringing groundbreaking  ideas to market and creating successful startup  businesses. Our award-winning faculty are renowned for  working closely with students to solve major scientific,  technological and societal challenges. We put a strong  emphasis on creating things \u2014 from art to robots. We  have become a model for economic development in  forming partnerships with companies such as Uber,  Google and Disney. Our students are recruited by some  of the world\u2019s most innovative companies. MANAGEMENT  INFORMATION  SYSTEMS U.S. News & World Report, 2022#1 ARTIFICIAL  INTELLIGENCE U.S. News & World Report, 2022#1 AMONG U.S.   UNIVERSITIES Times Higher Education   World University  Ranking, 2023#19SOFTWARE  ENGINEERING U.S. News & World Report, 2022COLLEGE OF  ENGINEERING U.S. News & World Report, 2022#1 #4#1SCHOOL OF  COMPUTER  SCIENCE U.S. News & World Report, 2022 UNIVERSITY   IN THE WORLD Times Higher Education   World University   Ranking, 2023#28TIME-BASED/   NEW MEDIA U.S. News & World Report, 2019#11,529   FACULTY16,779   STUDENTSGraduate Undergraduate 117,257  ALUMNI (LIVING) 85%  U.S. 15%  International35%  U.S. 65%  International 76%  U.S. 24%  InternationalGLOBAL COMMUNITY Students representing 126 countries Faculty representing 56 countries Alumni representing  148 countries OF COMPUTER  SCIENCE\u2019S FIRST- YEAR STUDENTS   WERE WOMEN   IN 2019 Nearly triple the   national average\u201c My Heart is in the Work. \u201d    Andrew Carnegie, Founder    November 15, 1900 49.8 % 87%  U.S. 13%  InternationalSCHOOLS AND COLLEGES College of Engineering  College of Fine Arts Dietrich College of Humanities   and Social Sciences Heinz College of Information Systems  and Public Policy Mellon College of Science School of Computer Science Tepper School of Business cmu.edu/assets/pdfs/cmu-fact-sheet.pdf    |   cmu.edu/about/awards.htmlMarch 2020BIG IDEAS THAT SHAPE YOUR WORLD START HERE 1,000+ companies greenlighted  across the U.S. and internationally  Cognitive tutors,  which improve  the math skills of 500,000+  students each year  The first U.S. school to award   a degree in drama  in 1914 James Gosling (SCS 1983)  invented the Java computer  programming language . The first exclusive higher  education partner of the Tony  Awards\u00ae , co-creating the first,  national recognition program  honoring K-12 theatre educators The first smile in an email , created  in 1982 by professor Scott Fahlman Kevlar Fiber , invented by alumna  Stephanie Kwolek (MM 1946) The Last Lecture , written   by alumni Randy Pausch (SCS 1988)   and Jeffrey Zaslow (DC 1980) In 1919, CMU\u2019s first Ph.D.  was  awarded to Mao Yisheng, father   of Chinese bridge construction.  Duolingo , invented by professor   Luis von Ahn (CS 2003, 2005), had   10 million downloads in 12 months  and was named Apple\u2019s 2013 app   of the year. :-) LEADERSHIP Farnam Jahanian    President David Coulter   Chair, Board of Trustees James H. Garrett Jr.   Provost2 National Academy of Engineering       3 National Academy of Sciences        4 National Academy of Medicine  Won by alumni and current/former faculty The leading university center  for cybersecurity , providing  support to more than 110  centers around the world  The world\u2019s first university  robotics department ,   founded in 1979 Alumnus Andy Warhol    (CFA1949), pop artist pioneer   and cultural icon One of only 29 universities   invited to be a member of the  World Economic Forum\u2019s  Global University   Leaders Forum CMU.EDU ECONOMIC IMPACT \u2022 Attracting major companies  \u2014   including Google, Intel, Uber and GE \u2014   to locate operations and create new   jobs in Pittsburgh \u2022 To date, the CMU community has  launched more than 400 startups   and created more than 152 spinoff  companies . \u2022 Contributing to the cultural and civic life of   the city with performances , exhibitions   and research collaborations 13 ACADEMY   AWARDS65 MEMBERS   OF NAE2 146 EMMY   AWARDS20 MEMBERS   OF NAS3 6 MEMBERS   OF NAM4 13 TURING   AWARDS 20 NOBEL   LAUREATES 58 TONY   AWARDS May 2023|expansion to the Pittsburgh campus since 1900. At the intersection of technology and humanity, CMU research, innovation and creativity will continue to guide our future as a world-class university. As outlined in the Strategic Plan 2025, the|April 14, 2024: Event Name: Holi 2:30 PM-6:30 PMET Open to entire CMU community Join us for a delightful celebration of Holi at CMU! Embrace the start of spring as we celebrate the festival of colors during Carnival Weekend. Experience the charm of traditional South Asian dance teams and a special guest performer who will add a touch of magic to our color-throwing ceremony. Best of all, everyone is welcome to join in the festivities! Note: Time will be confirmed in the coming weeks. Ticket information will be added here when live (likely late March). CMUevents@andrew.cmu.edu 412-268-8089 |MLT Graduate Student Handbook Page 45 A.3.3 Campus Wellness http://www.cmu.edu/wellness/ At Carnegie Mellon, we believe our individual and collective well-being is rooted in healthy connections to each other and to campus resources. The university provides a wide variety of wellness, mindfulness and connectedness initiatives and resources designed to help students thrive inside and outside the classroom. The BeWell@CMU e-newsletter seeks to be a comprehensive resource for CMU regarding all wellness-inspired events, announcements and professional and personal development opportunities. Sign up for the Be Well monthly newsletter via https://bit.ly/BeWellNewsletter or by contacting the Program Director for Student Affairs Wellness Initiatives, at alusk@andrew.cmu.edu . A.3.4 Religious & Spiritual Life Initiatives (RSLI) www.cmu.edu/student-affairs/spirituality Carnegie Mellon is committed to the holistic growth of our students, including creating opportunities for spiritual and religious practice and exploration. We have relationships with local houses of worship from various traditions and many of these groups are members of CMU\u2019s Council of Religious Advisors. We also offer programs and initiatives that cross traditional religious boundaries in order to increase knowledge of and appreciation for the full diversity of the worldview traditions. Our RSLI staff are here to support students across the spectrum of religious and spiritual practice and would be more than happy to help you make a connection into a community of faith during your time at CMU. A.3.5 University Police http://www.cmu.edu/police/ 412-268-2323 The University Police Department is located at 4551 Filmore Street . The department\u2019s services include police patrols and call response, criminal investigations, fixed officer and foot officer patrols, event security, crime prevention and education programming, and bicycle and laptop registration. Visit the department\u2019s website for additional information about the staff, emergency phone locations, crime prevention, lost and found, fingerprint services, and annual statistic reports. Carnegie Mellon University publishes an annual campus security and fire safety report describing the university\u2019s security, alcohol and drug, sexual assault, and fire safe ty policies and containing statistics about the number and type of crimes committed on the campus and the number and cause of fires in campus residence facilities during the preceding three years. Graduate students can obtain a copy by contacting the Unive rsity Police Department at 412-268-6232. The annual security and fire safety report is also available online at https://www.cmu.edu/police/annualreports/ |CMU Alumni Association  Congratulations graduating students and welcome to the Carnegie Mellon University Alumni Association! Learn how to connect with other alumni and engage with the university through events and other alumni programming by joining the CMU Alumni Community.  Following your graduation, you will begin receiving information about upcoming events, available resources, campus news and more to help introduce you to the Alumni Association. To ensure that you receive these messages, please update your contact information. And as your city, job and contact information change over time, please keep your information current so that we can stay in touch!",
        "retrieved_relevant_part": false,
        "model_answer": "Carnegie Mellon University is the first university to provide a degree in drama in 1914",
        "actual_answer": "19th",
        "exact_match": false,
        "f1_max_min_avg": [
            0,
            0,
            0.0
        ],
        "recall_max_min_avg": [
            0,
            0,
            0.0
        ]
    },
    {
        "question": "What is the maximum courseload of a PhD student in LTI department.",
        "context": "Maximum Courseload  \nPh.D.  students are permitted to register for a maximum of 54  units of coursework per semester.",
        "retrieved_doc": "LTI Ph.D. Graduate Student Handbook Page 14 The School of Computer Science has a Help Center in GHC 4201 . It can be contacted at help@cs.cmu.edu , extension 8-4231 from a campus phone, or 412-268-4231 from an outside line (M-F, 9am-5pm) . 3 Standard Degree Requirements & Degree Certification 3.1 LTI Ph.D. Degree Requirements To complete the Ph.D. in Language and Information Technologies degree, the student must satisfy the following requirements: \u2022 Pass at least 96 units of graduate level courses, with additional requirements detailed below ; \u2022 Satisfy proficiencies in Writing, Presentation, Programming, and Teaching ; \u2022 Propose , write, and defend a Ph.D. dissertation (thesis) ; \u2022 Attend the LTI Colloquium (11-700) each semester ; and \u2022 Satisfy the Research Speaking Requirement. The sections below provide more detail about each of these requirements. 3.1.1 Course Requirements To complete the course requirements for the Ph.D. in Language and Information Technologies degree, the student must pass 96 or more course units of graduate courses, and meet the following criteria: \u2022 At least 72 units of \u201cLTI\u201d courses and 24 units of \u201cSCS\u201d courses, \u2022 At least one class in each \u201cLTI Focus Area\u201d, and \u2022 At least two labs, in two different research areas . For definitions of quoted terms, see the section on \u201cDefinitions of LTI Terminology\u201d. Unless approved by the Program Director in advance, the course requirements must be satisfied by actual classroom courses, not credit given for research or independent study. An \u201cLTI course \u201d is any 12-unit course with a number of 11-XXX; a 6-unit course with 11-XXX counts as one-half of an LTI course. Unless otherwise specified, \"course\" means an actual classroom course, not credit given for research or independent study. Note that the LTI allow s any one MLD (10-XXX) graduate course to count as an \"LTI course\". An \u201cSCS course\u201d is any 12-unit course with a course number indicating a unit of the School of Computer Science (including LTI); a 6-unit course with such a number counts as one-half of an SCS course. Unless otherwise specified, \"course\" means an actual classroom course, not credit given for research or independent study. Note: Recommended electives that are technically|LTI Ph.D. Graduate Student Handbook Page 15 outside of the SCS now count towards this requirement; for example, Digital Signal Processing in ECE. Please see the Program Director for approval of electives as \u201cSCS.\u201d \u201cLTI Focus Areas\u201d are sets of courses defined on the LTI course webpage under \u201cCourse Categories.\u201d If a student believes a new course should be added to a Focus Area, they should make a request to the Ph.D. Program Director . They will decide, with advice from faculty in the appropriate area, whether it should be in the Focus Area. I f approved , it will be added to the LTI Focus Area webpage. A \u201cTask-Orientation Focus Course \u201d is a course belonging to that LTI Focus Area, as listed on the LTI\u2019s \u201cCourse Categories\u201d webpage. An LTI \u201c lab course \u201d is a course in the list of lab courses defined o n the LTI \u2019s \u201cCourse Categories\u201d webpage . 3.1.2 Grade Requirements Students must demonstrate their mastery of material taught in courses and their success in applying their skills in directed stu dy by satisfying the following grade requirements . Minimum grade: Only courses with a grade of B (3.0) or higher are counted as satisfying a degree requirement. Pass/fail: Pass/fail grades are not permitted for courses and projects used to satisfy a degree requirement. 3.1.3 Proficiency Requirements The LTI Ph.D. does not require any Qualifying Exams. Instead, a LTI Ph.D. student is required to demonstrate proficiency in the following four areas. \u2022 Writing: This is satisfied by producing a peer-reviewed conference paper, or the equivalent (a written report that at least two SCS faculty certify as being of conference-paper quality). \u2022 Presentation: This is satisfied by the oral presentation of a conference paper, or the equivalent (an oral presentation that at least t wo SCS faculty certify as being of conference-talk quality). \u2022 Programming: This is satisfied by demonstrating competence in computer programming of language technology; this is normally satisfied in the course of the student's research and/or project work|LTI Ph.D. Graduate Student Handbook Page 25 Note that self-funded Ph.D. students (e.g., those registered for five units while on semester interns hip) are not permitted to receive a partial stipend for the semester of their internship, while full-time LTI-sponsored students are eligible for a partial stipend. All students are caution ed to be aware of potential intellectual property (IP) problems with internships, and to review any IP agreements with their advisors before signing them. It is possible to lose ownership of your ideas. If the student is to receive academic credit for the internship, it must have deliverables from the student commensurate with the number of units, they are taking. This can be in the form of interim and final reports on the experience, presentations in the following semester regarding the experience, assessments of their experience as it relates to their course of study, etc. 4.1.3 Maximum Courseload Ph.D. students are permitted to register for a maximum of 54 units of coursework per semester. 4.1.4 Pass/Fail Grades Pass/fail grades are not permitted for courses used to satisfy a degree requirement. Graduate students who are required to take additional undergraduate courses to build up the core foundations of computer science may not elect the pass/fail option for th ese courses. 4.1.5 Transfer Credit An equivalent graduate course previously completed at another institution may be permitted to satisfy one of the Ph.D. course requirements. The decision on whether a course may be transferred is made by the Ph.D. Program Direct or. Typically, the student will provide the Program Director with the syllabus of the external course, and the Program Director will use that and the student\u2019s transcript to make the decision. See the section on \u201cDefinition of transfer credit versus cour se exemption .\u201d A student may not receive transfer credit for more than four courses. 4.1.6 Residency Requirements The university requires Ph.D. s to spend at least one year of residency at Carnegie Mellon. The SCS requires that all Ph.D. students must take at Carnegie Mellon a minimum of 48 units of the total coursework required by their respective programs|Ph.D. in Language and Information Technology: The Ph.D. in LTI focuses on developing the next generation of scientific and entrepreneurial leaders. The first two years of the Ph.D. program are similar to our MLT program. After the second year, you will spend most of your time working closely with your faculty advisor on research that advances the state-of-the-art in computer science.  Ph.D. students are expected to publish papers about original research in the most competitive scientific journals and international conference proceedings, and to present their research at conferences and workshops. Most of our Ph.D. graduates become professors and research scientists, while a few have started their own companies.|Ph.D. in Language and Information Technology Requirements: In general, students pursuing a Ph.D. in Language and Information Technologies must      Pass at least 96 units of graduate-level courses.     Satisfy proficiencies in writing, presentation, programming and teaching; and     Propose, write and defend a Ph.D. dissertation (thesis).  Students must also attend the LTI Colloquium each semester and satisfy our Research Speaking Requirement.  For a detailed breakdown of the above requirements, download and read the PhD Handbook.|LTI Ph.D. Graduate Student Handbook Page 3 Contents 1 Introduction ........................................................................................................................................ 9 1.1 Degrees Offered .................................................................................................................................. 9 1.2 Department Personnel ..................................................................................................................... 10 1.3 University Policies and Expectations .......................................................................................... 10 1.4 The Academic Calendar .................................................................................................................. 11 1.5 Carnegie Mellon University Statement of Assurance ............................................................. 11 1.6 The Carnegie Mellon Code ............................................................................................................. 12 2 The Language Technologies Institute ......................................................................................... 12 2.1 Pittsburgh Campus Location ......................................................................................................... 12 2.2 Office Space ........................................................................................................................................ 13 2.3 Mailboxes and Office Supplies ...................................................................................................... 13 2.4 Photocopies and Printers ................................................................................................................ 13 2.5 Computers for LTI Ph.D. Students ............................................................................................... 13 3 Standard Degree Requirements & Degree Certification ....................................................... 14 3.1 LTI Ph.D. Degree Requirements ................................................................................................... 14 3.1.1 Course Requirements ............................................................................................................. 14 3.1.2 Grade Requirements ............................................................................................................... 15 3.1.3 Proficiency Requirements ...................................................................................................... 15 3.1.4 The Ph.D. Dissertation ............................................................................................................ 16 3.1.5 Research Speaking Requirement ......................................................................................... 17 3.2 Advising .............................................................................................................................................. 17",
        "retrieved_relevant_part": false,
        "model_answer": "54 units",
        "actual_answer": "54 units",
        "exact_match": true,
        "f1_max_min_avg": [
            1.0,
            1.0,
            1.0
        ],
        "recall_max_min_avg": [
            1.0,
            1.0,
            1.0
        ]
    },
    {
        "question": "Does LTI allow its masters to transfer to PhD program?",
        "context": "Transferring Into the Ph.D.  Program  \nThe LTI does not allow direct transfers from its master\u2019s programs into its Ph.D.  program .",
        "retrieved_doc": "LTI Ph.D. Graduate Student Handbook Page 26 4.1.7 Transferring Into the Ph.D. Program The LTI does not allow direct transfers from its master\u2019s programs into its Ph.D. program . The student must apply for the Ph.D. at the usual time . However, students that are already enrolled in an LTI degree program are not required to retake GRE and TOEFL exams or to produce new transcripts from other universities. 4.1.8 Transferring Out of the Ph.D. Program The Ph.D. program doe s not prevent students from transferring to another degree program . A student who is interested in transferring out of the Ph.D. degree program should consult the handbook and Program Director of the desired degree program to learn whether transfers are permitted, and if so, how, and when to request such a transfer. 4.2 LTI Academic Policies 4.2.1 \u201cGrandfather\u201d Policy A student can graduate under the policies in effect at the time that the student entered the program; or, at the student's choice, the student can graduate under policies that are adopted after the student entered the program. If it is not realistic to follow a particular policy exactly, the department may approximate the policy as closely as possible; this situation is rare and typically arises only when a student is enrolled in the program for an extended period of time. 4.2.2 Definition of Transfer Credit vs. Course Exemption The LT I may grant transfer credit or issue an exemption for equivalent graduate courses previously completed at another institution. This decision rests with the director of the particular program. If a student is exempt from a required course due to prior cour ses or experience, the student can replace that course with an open elective. The student does not receive credit for the external course but can take any course that could normally count toward the degree in its place. If a student receives credit for pr ior coursework completed at CMU or elsewhere, the student receives that many units of credit, and the total amount of required coursework is reduced by that amount. 4.2.3 External Employment/Consulting Students funded by LTI research projects are expected to wor k primarily for those projects. Since consulting provides useful experience, students are generally permitted to consult at most one day per seven-day week, with the advisor's consent . International students must also have approval in advance from the Office of International Education (OIE) ; otherwise, they may be in violation of their visa status. See also External Internships|LTI Ph.D. Graduate Student Handbook Page 5 4.1.8 Transferring Out of the Ph.D. Program ............................................................................. 26 4.2 LTI Academic Policies .................................................................................................................... 26 4.2.1 \u201cGrandfather\u201d Policy .............................................................................................................. 26 4.2.2 Definition of Transfer Credit vs. Course Exemption ...................................................... 26 4.2.3 External Employment/Consulting ...................................................................................... 26 4.2.4 Leave of Absence ..................................................................................................................... 27 4.2.5 Satisfactory Progress .............................................................................................................. 27 4.2.6 Time Away from Academic Responsibilities ................................................................... 27 4.3 CMU Academic Policies ................................................................................................................ 27 4.3.1 Drop/Add/Withdraw Procedures ....................................................................................... 27 4.3.2 Doctoral Student Status ........................................................................................................ 28 4.3.3 ABD versus ABD in Absentia (ABS) ................................................................................... 28 4.3.4 Statute of Limitations: Time to Degree .............................................................................. 28 4.3.5 University Financial Aid ....................................................................................................... 29 4.3.6 Assistance for Individuals with Disabilities ..................................................................... 29 4.3.7 Summary of Graduate Student Appeal and Grievance Procedures ............................ 29 4.3.8 Sexual Misconduct Policy ..................................................................................................... 29 4.3.9 Gestational and Parental Accommodations ..................................................................... 30 4.3.10 Accommodations for Gestational Parents ........................................................................ 30 4.3.11 Parental Accommodation for Doctoral Students ............................................................. 31 4.3.12 Financial Assistance for Student Parents .......................................................................... 31 4.3.13 Consensual Intimate Relationship Policy Regarding Undergraduate Students .... 32 5 Financial Support ............................................................................................................................. 32|Ph.D. in Language and Information Technology: The Ph.D. in LTI focuses on developing the next generation of scientific and entrepreneurial leaders. The first two years of the Ph.D. program are similar to our MLT program. After the second year, you will spend most of your time working closely with your faculty advisor on research that advances the state-of-the-art in computer science.  Ph.D. students are expected to publish papers about original research in the most competitive scientific journals and international conference proceedings, and to present their research at conferences and workshops. Most of our Ph.D. graduates become professors and research scientists, while a few have started their own companies.|LTI Ph.D. Graduate Student Handbook Page 4 3.3 LTI Orientation ................................................................................................................................. 18 3.4 End of Semester Evaluation ............................................................................................................ 18 3.5 Electives Outside of SCS ................................................................................................................. 19 3.6 Completing an M.S. Degree Enrou te to a Ph.D. ........................................................................ 19 3.7 Grading and Evaluation ................................................................................................................. 20 3.7.1 University Policy on Grades ................................................................................................. 20 3.7.2 University Policy on Grades for Transfer Courses ......................................................... 20 3.8 Academic Integrity ........................................................................................................................... 21 3.9 Withdrawal of a Degree ................................................................................................................. 22 3.10 Employment Eligibility Verification ........................................................................................... 22 3.11 Additional Guidance for Students ............................................................................................... 22 3.11.1 Program of Study ..................................................................................................................... 23 3.11.2 Financial Aid and Student Account ................................................................................... 23 3.11.3 International Students ........................................................................................................... 23 4 Ph.D. Academic Policies ................................................................................................................. 23 4.1 Duration of Study ............................................................................................................................ 23 4.1.1 Department Policy on Double Counting Courses .......................................................... 24 4.1.2 External Internships .............................................................................................................. 24 4.1.3 Maximum Courseload ........................................................................................................... 25 4.1.4 Pass/Fail Grades ...................................................................................................................... 25 4.1.5 Transfer Credit ........................................................................................................................ 25 4.1.6 Residency Requirements ...................................................................................................... 25 4.1.7 Transferring Into the Ph.D. Program .................................................................................. 26|MLT Graduate Student Handbook Page 15 How and when the advisor is selected: the Marriage Process: Advisors are selected during the first month of the program. Students are expected to attend the LTI's Orientation (\u201cImmigration Course ,\u201d or IC) lectures, in which faculty describe their interests and areas of expertise, and to be proactive about meeting individually with potential advisors. After meeting with several potential advisors, each student will be asked to indicate a firs t, second, and third choice for advisor. Meanwhile, the potential advisors determine how many new students they can take, and indicate their preferences. Finally, the entire LTI faculty meets as a \u201c Marriage Committee \u201d to determine the best set of matches. Some entering MLT students are prefunded, meaning they have received and accepted a funding letter from a faculty member before the Marriage Process. (Even students who are prefunded must attend the research talks, to become acquainted with the LTI\u2019s rese arch projects.) Even self-supporting MLT students are expected to perform research with a faculty advisor, since research experience is an important part of our graduate programs. Until a student finds a specific advisor, the chair of the LTI graduate prog rams serves as the advisor. How to change advisors: The initial advisor selection should be made carefully. However, it is possible to change advisors. To do so, the student should find another faculty member willing to serve as an advisor, and then make a request to the Program Director to switch advisors. The LTI follows the long-standing SCS policy that both the new and old advisors need to agree to the change; typically, this is not a problem ( assuming the new advisor has agreed in advance, as described here ). It is to the student's advantage to avoid switching advisors, especially late in their graduate studies, because forging a strong student-advisor relationship takes time. 4.3 Optional Masters\u2019 Thesis MLT students may optionally elect to complete a Mast ers\u2019 Thesis; it is not required. Students who intend to apply for the PhD program should consider the MLT Thesis as one of several ways to demonstrate their research potential. Other possibilities include innovative research in a research project or class project work. The MLT Thesis must be completed according to the following guidelines. Note in particular the October 31 proposal deadline! \u2022 There are two course components required for students who elect to complete the M.S. Thesis: 11-928 \u2013 Masters \u2019 Thesis I (with the chosen thesis advisor, typically for 12 units, typically in the Fall of their second year) and 11-929 \u2013 Masters \u2019 Thesis II in the following Spring. \u2022 Each of these two courses counts towards 6 units of MLT-level LTI course credit; if the student goes on to an LTI PhD, the second course (11-929) counts towards one PhD lab requirement. \u2022 The MLT thesis may focus on either a significant research result or a significant implementation of a new technology. The student should work with their adv isor to define an interesting but bounded thesis research project. The MLT thesis culminates in|MLT Graduate Student Handbook Page 22 5.1.7 Transferring Into the MLT Program Transfers into the MLT program are not permitted during a student\u2019s first semester at CMU. Students must begin their study at CMU in the program that admitted them; this is a university policy. Students may request to transfer into the MLT program after completing their first semester. The student must make the request in writing (or email) to the MLT/PhD Admissions Chair. The MLT/PhD Admissions Chair will inform the student about what application materials are required; for example, an explanation of why a transfer is desired, a proposed plan of study, a proposed advisor, and CMU transcripts. Students that are already enrolled in an LTI degree program are not required to retake GRE and TOEFL exams or to produce new transcripts from other universities. The MLT program will conduct an expedited admissions process after receiving such a request. 5.1.8 Transferring Out of the MLT Program The MLT program does not prevent students from transferring to another degree program. Each degree program has its own rules about whether and when transfers into the program are permitted. A student that is interested in transferring out of the MLT degree program should consult the handbook and Pr ogram Director of the desired degree program to learn whether transfers are permitted, and if so, how and when to request such a transfer. 5.1.9 Drop/Add/Withdraw Procedures Students taking undergraduate and Masters\u2019 level courses must follow the procedures and deadlines for adding, dropping, and withdrawing from courses as identified on the academic calendar. Information can be found at https://www.cmu.edu/hub/registrar/course-changes.index . Please note that there is a separate calendar for doctoral courses that does not apply to Masters\u2019 students. 5.1.10 Statute of Limitations As outlined in the Master\u2019s Students Statute of Limitations, https://www.cmu.edu/policies/student-and-student-life/masters-students-statute-of-limitations.html. Students will complete all requirements for the m a sters\u2019 degree within a maximum of seven years from original matriculation as a masters\u2019 student, or less if required by a more restrictive department, school, or college policy. Once this time-to-degree limit has lapsed, the person may resume work towards a masters\u2019 degree only if newly admitted to a currently offered master s\u2019 degree program under criteria determined by that program. See also the \u2018Duration of Study\u2019 policy",
        "retrieved_relevant_part": false,
        "model_answer": "Yes, LTI allows its masters to transfer to PhD program",
        "actual_answer": "No, it doesn't.",
        "exact_match": false,
        "f1_max_min_avg": [
            0,
            0,
            0.0
        ],
        "recall_max_min_avg": [
            0,
            0,
            0.0
        ]
    },
    {
        "question": "What is the location of Computing Services of CMU?",
        "context": "Computing Services  is located in Cyert Hall \u2013 Room 285.  Computing Services develops, \nmaintains,  and supports the computing infrastructure for Carnegie Mellon students, faculty \nmembers and staff members. This includes the campus wired and wireless networks, public \ncomputer labs or \u201cclusters,\u201d cable television and telephone services, computing related \ndocu mentation and support through the Help Center.",
        "retrieved_doc": "46 14.2.1 Computing and Information Resources www.cmu.edu/computing Computing Services maintains and supports co mputing resources for the campus community, including the campus wired and wi reless networks, printing, computer labs, file storage, email and software catalog. As members of this community , we are all responsible for the security of these shared resources. Be sure to review the Safe Computing (https://www.cmu.edu/computing/safe/ ) section and the University Computing Policy (https://www.cmu.edu/policies/infor mation-technology/computing.html ) Visit the Computing Services website ( https://www.cmu.edu/computing/ ) to learn more. For assistance the Computing Services Help Cent er is available at 412-268-4357 (HELP) or it-help@cmu.edu . 14.2.2 Student Academic Success Center https://www.cmu.edu/student-success/ Student Academic Support Programs Tartan Scholars \uf0b7 The Tartan Scholars program was created to provide support for limited resourced students through an intentional first year undergraduate experience with the goals of enhancing the cohort\u2019s skill and community buil ding through a lens of self-authorship, growth mindset, and a sense of belonging. As part of the Student Academic Success Center, Tartan Scholars are invited to jo in the University and participate in summer initiatives and pre-orientation activities prio r to their first year at the University. \uf0b7 There are opportunities for graduate students to serve as accountab ility, learning, or development partners, workshop facilitators , and presenters. Contact Diane Hightower at ddhighto@andrew.cmu.edu for more details. Learning Support \uf0b7 Supplemental Instruction: Supplemental Instruction (SI) is an academic support model that utilizes peer-assisted study sessions. Th e SI program provides regularly scheduled review sessions on course materials outside th e classroom. SI is a non-remedial approach to learning as the program targets high-risk courses and is available in select courses based on data related to past stu dent performance and feasibility. \uf0b7 Peer Tutoring: Weekly Tutoring Appointments are offered in a one-on-one and small group format to students from any discipli ne who need assistance with a course that may not be supported by our other services. Weekly appointments give students the opportunity to interact regularly with the s ame tutor to facilitate deeper understanding|38 also two neighboring libraries open to Carnegie Mellon graduate students: Carnegie Library of Pittsburgh and University of Pittsburgh Libraries. Visit the University Libraries website for information about all mentioned library locatio ns and hours, on-line resources and FAQ\u2019s. 13.10 Computing Services www.cmu.edu/computing/ Computing Services is located in Cyert Hall 285. Computing Services develops, maintains and supports the computing infrastructure for Carneg ie Mellon students, faculty members and staff members. This includes the campus wired and wi reless networks, public computer labs or \u201cclusters,\u201d cable television and telephone se rvices, computing related documentation and support through the Help Center. In addition, Computing Services provides standard classroom technologies for over 100 lecture halls, cl assrooms and seminar rooms across campus. The website contains additional information regardin g The Help Center hours, location and contact information, computing cluster hours and locatio n, the Carnegie Mellon web portal, computing security and policies and guidelines. Students can email the Help Center at it-help@cmu.edu with questions and for assistance. 13.11 Family and Dependents Resources The Graduate Student Assembly website maintai ns a resource page fo r spouses, domestic partners and families of graduate students: www.cmu.edu/stugov/gsa/Resources-for-Graduate-Students/Partner-and-Family-Resources.html, including The Student Parent Association, new mother rooms, and links to resources around campus and the Pittsburgh area. 13.12 Domestic Partner Registration Carnegie Mellon extends certain benefits to domest ic partners of students. Eligible students may elect benefits for their domestic partners th rough the registration process orchestrated by the Office of the Dean of Students, 3rd floor Warner Hall. Information regarding the benefits available for domestic partners, eligibility for domestic partner benefits, registration instructions and forms can be located at: www.cmu.edu/student-affairs/dean/domestic-partner/ . 13.13 Housing The university does not currently offer housing to graduate students. The Office of Housing and Dining Services provides community housin g information to assist graduate students who are seeking housing in the commu nities surrounding the universit y, including information on|6 19 Key Offices for Academic & Research Support 20 Computing and Information Resources https://www.cmu.edu/computing/ Computing Services maintains and supports computing resources for the campus community, including the campus wired and wireless networks, printing, computer labs, file storage, email and software catalog. As members of this community, we are all responsible for the security of these shared resources. Be sure to review the Safe Computing (https://www.cmu.edu/computing/safe/ ) section and the University Computing Policy (https://www.cmu.edu/policies/information-technology/computing.html ) Visit the Computing Services website (https://www.cmu.edu/computing/ ) to learn more. For assistance the Computing Services Help Center is available at 412-268-4357 (HELP) or ithelp@cmu.edu . 21 Student Academic Success Center https://www.cmu.edu/student-success/ The Student Academic Success Center\u2019s (SASC) work to support success focuses on creating spaces for students to engage in their coursework and approach to learning through many group and individual program options. SASC supports student success by providing academic coaching, subject-specific tutoring, effective communication strategies, accommodations for students with disabilities, and language support for multilingual learners. SASC engages with faculty and staff to improve the coordination and professional development for academic advisors. Visit the SASC website for more information about services offered in areas such as communication and language support; language and cross-cultural support; and learning support. 22 University Libraries https://www.library.cmu.edu/ The University Libraries offers a wide range of information, resources, and services supporting graduate students in coursework, research, teaching, and publishing. The library licenses and purchases books, journals, media, and other needed materials in various formats. Library liaisons, consultants, and information specialists provide in-depth and professional assistance and advice in all-things information, including: \uf0b7 Locating and obtaining specific resources|39More information can be found at: http://www.library.cmu.edu/ 6.10 Computing Services Computing Services is located in Cyert Hall 285. Computing Services develops, maintains and supports the computing infrastructure for Carnegie Mellon students, faculty members and staff members. This includes the campus wired and wireless networks, public computer labs or \u201cclusters,\u201d cable television and telephone services, computing related documentation and support through the Help Center. In addition, Computing Services provides standard classroom technologies for over 100 lecture halls, classrooms and seminar rooms across campus. The website contains additional information regarding The Help Center hours, location and contact information, computing cluster hours and location, the Carnegie Mellon web portal, computing security and policies and guidelines. Students can email the Help Center at advisor@andrew.cmu.edu with questions and for assistance. More information http://www.cmu.edu/computing/ 6.11 Family and Dependents Resources The Graduate Student Assembly website maintains a resource page for spouses, domestic partners and families of graduate students, including The Student Parent Association, new mother rooms, and links to resources around campus and the Pittsburgh area. Affiliate ID Cards are available for spouses and domestic partners of graduate students that allow them to access Carnegie Mellon\u2019s campus. These cards are available through The HUB to spouses and partners of graduate students who are enrolled for the current academic year in a full-time graduate degree program. The card is valid for one year. More information can be found at: http://www.cmu.edu/stugov/gsa/resources/family.html|MLT Graduate Student Handbook Page 33 workshops; and to connect with consultants in scholarly publishing, research data management, and digital humanities. 7.10 Computing Services www.cmu.edu/computing/ Computing Services is located in Cyert Hall 285. Computing Services develops, maintains, and supports the computing infrastructure for Carnegie Mellon students, faculty members, and staff members. This includes the campus wired and wireless networks, public computer labs or \u201cclusters,\u201d cable television and telephone services, computing related documentation and support through the Help Center. In addition, Computing Services provides standard classroom technologies for over 100 lecture halls, classrooms, and seminar rooms across campus. The website contains addition information regarding The Help Center hours, location and contact information, computing cluster hours and location, the Carnegie Mellon web portal, computing securit y, and policies and guidelines. Students can email the Help Center at advisor@andrew.cmu.edu with questions and for assistance. 7.11 Family and Dependents Resources The Graduate Student Assembly website maintains a resource page for spouses, domestic partners, and families of graduate students: www.cmu.edu/stugov/gsa/resources/family.html , including The Student Parent Association, new mother rooms, and links to resources around campus and the Pittsburgh area. Affiliate ID Cards are available for spouses and domestic partners of graduate students that allow them to access Carnegie Mellon\u2019s campus. These cards are available through The HUB to spouses and partners of graduate students who are enrolled for the current academic year in a full-time graduate degree program. The card is valid for one year. For more information about student and affiliate ID cards, please visit: http://www.cmu.edu/idplus/idcards/cardtypes.html . 7.12 Domestic Partner Registration Carnegie Mellon extends certain benefits to domestic partners of students. Eligible students may elect benefits for their domestic partners through the registration process orchestrated by the Office of the Dean of Student Affairs, 3 rd floor Warner Hall. Informati on regarding the benefits avail able for domestic partners, eligibility for domestic partner benefits, registration instructions, and forms can be located at: www.studentaffairs.cmu.edu/dean/domestic_partner/index.html |LTI Ph.D. Graduate Student Handbook Page 37 6.9 Computing Services Computing Services is located in Cyert Hall \u2013 Room 285. Computing Services develops, maintains, and supports the computing infrastructure for Carnegie Mellon students, faculty members and staff members. This includes the campus wired and wireless networks, public computer labs or \u201cclusters,\u201d cable television and telephone services, computing related docu mentation and support through the Help Center. In addition, Computing Services provides standard classroom technologies for over 100 lecture halls, classrooms, and seminar rooms across campus. The website contains addition information regarding The Help Ce nter hours, location and contact information, computing cluster hours and location, the Carnegie Mellon web portal, computing security and policies and guidelines. Students can email the Help Center at it-help@cmu.edu or call 412-268-4357 (HELP) with questions and for assistance. 6.10 Family and Dependents Resources The Graduate Student Assembly website maintains a resource page for spouses, domestic partners and families of graduate students: https://www.cmu.edu/stugov/gsa/Resources-for-Graduate-Students/index.html , i ncluding Th e Student Parent Association, new mother rooms, and links to resources around campus and the Pittsburgh area. Affiliate ID Cards are available for spouses and domestic partners of graduate students that allow them to access Carnegie Mellon\u2019s campus. These cards are available through The HUB to spouses and partners of graduate students who are enrolled for the current academic year in a full-time graduate degree program . The card is valid for one year . For more information about student and affiliate ID cards, please visit: http://www.cmu.edu/idplus/idcards/sponsored.html . 6.11 Domestic Partner Registration Carnegie Mellon extends certain benefits to domestic partners of students. Eligible students may elect benefits for their domestic partners through the registration process orchestrated by the Office of the Dean of Students , Warner Hall, room 321 . Information regarding the benefits avail-able for domestic partners, eligibility for domestic partner benefits, registration instructions and forms can be located at: https://www.cmu.edu/student-affairs/dean/domestic-partner/index.html. 6.12 Hou sing The university does not currently offer housing to graduate students . The Office of Housing and Dining Services does provide community housing information to assist graduate students who are seeking housing in the communities surrounding the university, including information on the legal aspects of renting an apartment, moving checklists and the off-campus housing database. This information can be located at: https://www.cmu.edu/housing/our-communities/index.html ",
        "retrieved_relevant_part": false,
        "model_answer": "Computing Services of CMU is located in Cyert Hall 285",
        "actual_answer": "Cyert Hall",
        "exact_match": false,
        "f1_max_min_avg": [
            0.33,
            0.33,
            0.33
        ],
        "recall_max_min_avg": [
            1.0,
            1.0,
            1.0
        ]
    },
    {
        "question": "Does the university offer housing to graduate students?",
        "context": "The university does not currently offer housing to graduate students .  The Office of Housing and \nDining Services does provide  community housing information to assist graduate students who are \nseeking housing in the communities surrounding the university, including information on the legal aspects of renting an apartment, moving checklists and the off -campus housing database.",
